기사날짜,기사제목,네이버 뉴스 url,기사내용
2022.04.26.,"우리금융, 폐플라스틱 재활용 캠페인 전개",https://n.news.naver.com/mnews/article/018/0005200363?sid=101,"그룹사 임직원 등 자발적 참여‘우리가 그린 미래’캠페인 일환[이데일리 황병서 기자] 우리금융그룹이 폐플라스틱 재활용 캠페인 ‘Act for Nature with Woori(엑트 포 네이처 위드 우리)’를 전개한다고 26일 밝혔다. 우리금융그룹이 폐플라스틱 재활용 캠페인 ‘Act for Nature with Woori(엑트 포 네이처 위드 우리)’를 전개한다고 26일 밝혔다. (사진=우리금융그룹)해당 캠페인은 우리금융그룹이 지난 5일 식목일을 맞이해 전국 35개 초등학교 학생들과 실시한 ‘우리가 GREEN(그린) 미래’ 캠페인의 일환이다. 우리금융지주를 비롯해 우리은행 등 그룹사 임직원들이 자발적으로 참여한다.평소 재활용이 어려운 칫솔, 세제통, 샴푸통, 분무기와 같은 생활용품 속 플라스틱을 업사이클링(재활용품에 디자인 또는 활용도를 더해 그 가치를 높인 제품으로 재탄생시키는 것)해 지역사회에 나눔을 실천하는 캠페인이다. 수거 품목을 깨끗하게 세척·건조 후 플라스틱 금속 부분은 별도 분리 배출하는 등 임직원들이 재활용을 올바르게 할 수 있도록 안내하고 있다.생활용품 플라스틱은 우리금융그룹 본사 및 주요 사업장에 비치된 ‘우리 그린 수거함’을 통해 수거된다. 특히 수거된 플라스틱은 업사이클링을 통해 텃밭 화분으로 재탄생되고, 미세먼지 없는 초등학교 교실숲 조성을 위해 기부될 예정이다.손태승 우리금융 회장은 “태평양에 우리나라 규모의 약 16배인 쓰레기 섬이 존재하고, 해마다 800만톤의 플라스틱 쓰레기가 바다에 버려지고 있다”며 “우리금융 임직원들의 이번 캠페인이 지구와 바다를 살리는 작은 밀알이 돼 ‘더 나은 세상’이 되는 기폭제가 됐으면 한다”고 밝혔다.한편, 우리금융그룹은 올해 1월 생물다양성 보전 등 생태계 회복을 위한 글로벌 환경 협의체인 TNFD(자연관련 재무정보공개 협의체)에 국내 기업 최초로 가입했다. 지난 3월부터 국내 기업에서는 유일하게 UNEP FI(유엔환경계획 금융이니셔티브) 순환경제 분야 워킹그룹에 참여하고 있다. 또한 순환경제 달성 및 ESG 실천 강화를 위해 지난 3월 16일 글로벌 자연보전기관인 WWF(세계자연기금)와 업무협약도 체결했다."
2022.04.02.,"[A 금융가 소식] 하나은행, 차세대 '국외 자금세탁방지 거래 모니터링 시스템' 고도화 外",url없음,<네이버 기사 없음>
2022.04.28.,4월29일 알림,https://n.news.naver.com/mnews/article/028/0002588694?sid=102,"◇ 원불교는 28일 코로나19로 열지 못했던 교단 최대 경축일인 대각개교절 기념식을 3년 만에 봉행했다. 대각개교절은 교조인 소태산 박중빈 대종사가 우주 진리의 큰 깨달음으로 종단을 창시한 날로 전북 익산의 중앙총부를 비롯해 국내외 700여 교당과 기관에서 기념식을 했다.왼쪽부터 김만진 한국관광공사 제주지사장과 안은주 제주올레 대표이사. 제주올레 제공◇ 제주올레(이사장 서명숙)와 한국관광공사 제주지사(지사장 김만진)는 지난 27일 제주 바다를 깨끗하게 하기 위해 업무협약을 맺었다. ’바당길, 깨끗하길’ 캠페인을 추진하며 제주 바다에 밀려오는 해양 쓰레기를 집중 수거하고, 해양 환경 오염과 그 피해의 심각성을 알리는 활동을 할 계획이다. 김완진 서울대 명예교수. 한국학중앙연구원 제공◇ 한국학중앙연구원은 28일 ‘제3회 한국학저술상’ 수상작으로 김완진 서울대 명예교수가 쓴 <향가해독법연구>를 선정했다. 책은 우리나라 고유 정형시인 향가를 분석한 국어국문학 학술서로, 향가를 해독하는 새로운 방법을 내놓았다는 평가를 받았다. 한국학저술상은 서울 인사동 고서점 ‘통문관' 창업주인 산기 이겸로의 뜻을 기려 설립한 산기재단과 함께 우수 한국학 도서 발굴과 연구 분위기 조성을 위해 제정했다.주민현 시인. 계간 시산맥 제공◇ 계간 시산맥은 28일 ‘제12회 시산맥작품상’에 주민현 시인의 ‘그림 없는 미술관'을 선정했다. 잡지에 발표된 작품 중 11편을 대상으로 심사해 수상작을 뽑았다. 상금은 300만 원. 주 시인은 2017년 <한국경제신문> 신춘문예 시 부문으로 등단해 시집 <킬트, 그리고 퀼트>를 냈다. 올해 두 번째인 ‘시산맥시문학상’에는 김대호 시인의 ‘고비의 배후’와 이령 시인의 ‘사사로운 별’이 공동 선정됐다. 상금은 각 200만 원이다. 시상식은 5월28일 오후 4시 서울 종로 강호화랑에서 열린다.왼쪽부터 김태영 종근당홀딩스 대표이사, 박시월·오세경·최수정 작가, 김노암 아트스페이스 휴 대표. 종근당홀딩스 제공◇ 종근당은 28일 ‘2022 종근당 예술지상’ 수상자로 박시월·오세경·최수정 작가를 선정했다. 신예작가 발굴·지원과 대안공간 운영 활성화를 목표로 하는 프로젝트로, 선정 작가들은 앞으로 3년 동안 매년 1천만원씩 각각 창작지원금을 받아 마지막 해 전시회를 연다.◇ 문화재청은 새달 5일 어린이날 고궁과 조선왕릉을 국적과 연령 구별없이 전면 무료 개방하기로 했다. 대통령 당선인 취임일인 새달 10일에도 전례에 따라 모든 사람에게 궁능 무료입장을 허용하기로 했다.왼쪽부터 서혜란 관장과 이종한 피디. 국립중앙도서관 제공◇ 국립중앙도서관(관장 서혜란)은 28일 드라마 연출가 이종한씨가 기증한 자료를 모은 ‘이종한 문고'를 설치했다. 이씨는 <왕룽일가>, <분례기>, <관촌수필>, <연개소문>, <토지> 등 드라마의 콘티·대본 457책, 영상이 담긴 VHD와 DVD 351점, 팸플릿과 포스터 383점을 전날 기증했다.‘ESG 경영 성과 보고회’. 한국농수산식품유통공사 제공◇ 한국농수산식품유통공사(사장 김춘진)는 28일 ESG경영 선포 1주년을 맞아 83개 협약기관과 지난 ESG경영을 진단하고 재도약하는 성과 보고회를 열어 ESG경영 실천·확산에 기여가 큰 새마을운동중앙회, 시청자미디어재단 등 18개 기관에 최우수협력 증서를 전했다.서울 남가좌동 명지대 인문캠퍼스 전경. 명지대 제공◇ 명지대(총장 유병진)는 28일 서울회생법원으로부터 명지학원의 회생절차에 대한 개시를 승인받았다. 명지학원은 지난달 채무자 자격으로 회생절차 개시를 재신청했고, 법원은 교육부의 의견서 등을 참고해 개시 결정을 했다. ◇ 숙명여대(총장 장윤금)는 28일 과학기술정보통신부와 기획평가원이 시행하는 소프트웨어중심대학 사업에 뽑혔다. 정부로부터 8년간 150억원을 지원받아 산업계가 요구하는 전문 IT인재 양성을 위해 교육체계를 혁신할 예정이다.전영덕 회장. 경희대총동문회 제공◇ 경희대 총동문회는 지난 26일 2022년도 정기 대의원총회를 열고 제31대 회장으로 전영덕 동문을 선출했다. 체육대학 82학번인 전 신임 회장은 총동문회 수석부회장과 대한장애인 아이스하키협회 상임부회장, 소치 패럴림픽 장애인 아이스하키 선수단장 등을 맡고 있다.왼쪽부터 한균태 총장과 고 이종민 동문의 부친 이옥규씨. 경희대 제공◇ 경희대는 28일 3년 전 세상을 떠난 동문 이종민씨의 부친 이옥규씨로부터 미래과학관 건축 기금으로 써달라며 3억원을 기부받았다. 2002년 컴퓨터공학과에 입학한 이씨는 대기업에 근무하다 2019년 불의의 사고로 세상을 떠났다.고 안준호씨 아너 소사이어티 특별회원증. 경남사회복지공동모금회 제공◇ 경남사회복지공동모금회(회장 강기철)는 28일 2019년 서울 목동 빗물배수처리시설 공사장 수몰사고로 숨진 고 안준호씨를 특별회원으로 추대했다. 고인의 가족이 1억원 이상을 기부해 아너 소사이어티(고액 기부자 모임) 회원으로 등록했다. 현대건설 직원이었던 고인은 2017년부터 해마다 사랑의 열매 직장인 나눔 캠페인을 통해 기부를 실천하기도 했다.김종수 재단 고문과 장학증서 수혜자들. 포니정재단 제공◇ 포니정재단(이사장 정몽규)은 28일 서울 강남 파크하얏트 서울에서 ‘2022년 포니정 학술지원·인문연구장학 증서 수여식'을 열고 학술 2명과 인문 15명에게 장학증서와 함께 사은품을 전달했다.◇ 귀뚜라미그룹은 광주 북구청과 28일 인재 육성을 위한 장학금 지원 협약을 맺고, 북구 지역 학생들의 학업과 재능증진을 위해 대학생 300만원, 고등학생 100만원 등 총 5천만원의 장학금을 지원하기로 했다.◇ 대전신세계 아트앤사이언스는 28일 열악한 환경에서도 꿈을 키우는 청소년을 후원하기 위해 희망장학금 1억3천만원을 지역 청소년들에게 전했다. 저소득층이나 다문화가정 청소년, 순직 및 공상 경찰관 자녀, 중소 협력업체 자녀 등 중·고등학생 130명에게 각각 100만원씩 지급했다.◇ 남양유업은 28일 대리점과의 동반 성장을 위해 대리점주 자녀 56명에게 ‘패밀리 장학금' 7천만원을 지급했다.◇ 한국마사회 탁구단은 지난 26일 경기도 이천 장애인체육종합훈련원을 찾아 데플림픽(청각장애인올림픽) 국가대표 탁구선수들을 상대로 재능기부 트레이닝 봉사활동을 했다. 현정화 감독이 이끄는 여자 탁구단과 최영일 감독이 지휘하는 남자 탁구단 소속 13명의 선수와 코치진이 함께 훈련하며 대표팀의 막판 경기력 향상을 도왔다.경기여성단체연합 제공◇ 경기여성단체연합 부천여성노동자회 수원여성노동자회 안산여성노동자회는 28일 수원인권센터 돋움에서 경기도 90년대생 여성노동자 집담회 <우리들의 목소리 톤업>을 진행했다. 박선영 중앙대 중앙사회학연구소 연구원이 ‘설문조사를 통해 본 경기도 90년대생 여성노동자들의 노동이력과 삶’을 발제했으며 채용 성차별, 성차별 조직문화 개선과 사업장 중심의 지원정책 등을 요구했다.◇ 대전충남인권연대는 새달 17일 오후 7~9시 대전평생교육진흥원 대강당에서 창립 10돌 기념식과 특별강연을 한다. 1부에선 10년 회원에게 감사패를 전하고, 10년간의 활동영상을 함께 시청하며 2부에선 성공회대 조효제 교수가 ‘지구를 위해 인권을!’을 제목으로 강연할 예정이다. 10주년 축하 후원금 우리은행 1005-701-991191(대전충남인권연대). 문의 (042)867-1210.◇ 대구대 다문화사회정책연구소는 새달 16일 ‘외국인 유학생 대상 교육법’을 주제로 세미나를 한다. 한국연구재단이 후원하며 윤재운 대구대 역사학과, 백순철 대구대 국어교육과 교수가 각각 ‘한국 역사'와 ‘한국 문학'을 주제로 발표한다. 참여 문의 (053)850-4263.◇ 현대차는 28일 ‘상용차 부문 판매거장’으로 서부트럭지점 강병철 영업부장을 뽑았다. 판매거장은 누계 판매 2500대를 돌파한 우수 영업사원에게 주어지는 최고의 영예로 강 부장은 1997년 현대차 입사 후 26년 만에 기록을 달성했다.◇ 한국국제교류재단(KF·이사장 이근)는 오는 30일 김포 CGV에서 주한라트비아대사관, 김포시, 김포국제청소년영화제조직위원회(GIYFF)와 공동 주최로 〈주한라트비아대사관과 함께하는 KF-GIYFF 영화상영회〉를 한다.◇ KT&G 장학재단은 새달 20일까지 ‘2022 대학 상생장학생'을 모집한다. 국내 대학교에 재학하는 기초생활수급자 및 차상위 계층을 대상으로 200명을 선발해 인당 300만원을 지급한다. 누리집(scholarship.ktngtogether.com/) 참고.◇ 하이투자증권은 28일 새달 5일인 어린이날 100주년을 맞아 소아암 어린이를 지원하기 위한 ‘히크만 주머니' 만들기 캠페인을 했다. ‘히크만 주머니'는 소아암 어린이 가슴에 채혈이나 약물 주입을 위해 삽입하는 히크만 카테터를 담아 목에 걸 수 있는 주머니로, 임직원들은 3주간 160개를 만들어 소아암 쉼터 운영지원금 300만원과 함께 한국백혈병어린이재단에 전했다.◇ KB국민카드는 새달 31일까지 서울 종로 본사에서 ‘2050 어린이날을 지켜라, 플로깅 챌린지 지원' 행사를 한다. 어린이날 100주년 기념과 미래세대를 위한 환경보호 캠페인으로 2천50명의 신청을 받아 지역 종량제 봉투 등을 가지고 주변 쓰레기를 주우며 걷는 ‘플로깅'을 하고, 전국 100개 지역아동센터 아동 2천50명에게 친환경 문구 세트와 간식도 지원할 예정이다. ◇ 캐딜락은 28일 ‘2022 베이징동계올림픽’ 쇼트트랙 금메달리스트 최민정(성남시청)과 황대헌(강원도청) 선수에게 럭셔리 스포츠유틸리티차 ‘XT5'를 지원하기로 했다.◇ 서초문화재단과 서리풀청년아트갤러리는 새달 20일까지 오전 11시∼오후 7시 서울 예술의전당 앞 서리풀청년아트갤러리에서 청년예술가 단수민, 단재민, 김명규의 기억을 탐구하고 기록한 전시 <예·기·법>(예술가의 기록법+예기(豫期)하는 방법)을 한다. 기억과 망각의 속성을 담아낸 작품 100여점을 선보이며 무료다. 공휴일·월요일 휴무."
2022.04.25.,"우리금융, 스타트업과 혁신 '윈윈'",https://n.news.naver.com/mnews/article/030/0003012567?sid=101,"우리금융그룹(회장 손태승)은 스타트업 협력 프로그램 디노랩(Dinnolab) 소속 기업들과 우리은행, 우리에프아이에스 등 자회사간 오픈 이노베이션(개방형 혁신) 사례를 다수 만들었다고 25일 밝혔다.우리은행은 지난 2월부터 '반프'가 개발한 시스템을 현금 수송차량에 적용했다. 타이어와 도로 상태 실시간 데이터를 수집하고 사고 예측을 방지해 안전 운행을 가능토록 하는 테스트베드를 지원했다.반프는 트럭 자율주행 차량에 필요한 타이어의 안전성을 높이는 안전 관제시스템을 개발했다. 지난 23일 미국 에디슨 어워즈(Edison Awards)에서 기술력을 인정받아 자동차 테크 분야를 수상했다.우리에프아이에스는 선불폰에서 불법으로 본인인증을 시도하는 금융범죄 사례를 근절하고자 '엘핀'과 함께 작년 11월부터 기술검증(PoC)을 수행했다.엘핀은 스마트폰 위치 요소를 활용해 새로운 인증 영역을 개척하고 있다. 고객 정보를 탈취한 금융 범죄자가 선불폰으로 부정 접속하면 기존 인증방식에 위치 정보를 추가해 사고를 예방한다. 우리에프아이에스는 추후 서비스에 적용할 모델과 대상 채널을 협의하고 있다.프리미엄 김 제조사 '담아'는 우수한 품질의 한국 전통음식을 고급화·스낵화·플랫폼화해 세계 시장에 도전장을 던진 스타트업이다. 우리은행은 마이데이터 구독서비스에서 담아의 프리미엄 김 정기 구독 서비스를 상반기 중 선보일 예정이다.우리은행이 기업금융 디지털화를 위해 준비하는 디지털 공급망 금융(SCF) 플랫폼인 'WON 비즈플라자'와 디노랩 기업들이 손잡았다. WON 비즈플라자 플랫폼에서는 중소기업 운전자금 확보를 돕는 고유의 금융기능 외에 기업 경영지원 활동을 위한 비금융 B2B 전문몰을 동시에 선보이기 위해 준비하고 있다.디노랩 스타트업 중 에이치알엠(ESG 순환자원 솔루션), 웨인힐스브라이언트A.I(AI기반 텍스트 영상자동변환), 아미쿠스렉스(AI기반 법률문서 자동작성 플랫폼), 글로싸인(클라우드기반 전자계약서비스), 엘핀(위치기반 모바일 인증 솔루션) 등이 참여할 예정이다.우리금융그룹 관계자는 “그룹 디지털 초혁신과 신성장 동력 마련을 위해 디노랩 기업과 전방위로 협업을 시도하고 있으며 시너지를 창출해 나가겠다”고 말했다.한편 우리금융그룹은 오는 30일까지 서울 성동구 성수동에 위치한 디노랩 제1센터에 입주할 디노랩 3기 스타트업을 모집하고 있다."
2022.04.27.,"CJ대한통운, 수출 중소기업 지원군 나선다",url없음,<네이버 기사 없음>
2022.04.25.,"우리금융, 오픈 이노베이션으로 스타트업과 맞손",https://n.news.naver.com/mnews/article/119/0002597537?sid=101,"자회사와 혁신 DNA 창출우리금융그룹 사옥 ⓒ 우리금융그룹[데일리안 = 이호연 기자] 우리금융그룹은 스타트업 협력 프로그램인 ‘디노랩(Dinnolab)’ 소속 기업들과 자회사간 다양한 사업 협력을 시도하며 오픈 이노베이션 사례를 만들어가고 있다고 25일 밝혔다.오픈 이노베이션이란, 기술이나 아이디어가 기업 내외의 경계를 넘나들며 기업의 혁신으로 이어지도록 하는 것이다.우리은행은 지난 2월부터 ‘반프’가 개발한 시스템을 현금 수송차량에 적용해 타이어 및 도로 상태 실시간 데이터를 수집하고, 사고예측을 사전에 방지해 안전 운행을 가능토록 하는 테스트베드를 지원했다. 반프는 트럭 자율주행 차량에 필요한 타이어의 안전성을 높이는 안전 관제시스템을 개발하는 모빌리티 테크 기업이다. 지난 23일 미국 ‘에디슨 어워즈- 2022’에서 기술력을 인정받아 자동차 테크 분야에서 수상한 바 있다.우리에프아이에스는 선불폰을 통해 불법으로 본인인증을 시도하는 금융범죄 사례를 근절하고자 ‘엘핀’과 함께 작년 11월부터 PoC(현장기술검증)를 수행했다.엘핀은 스마트폰의 위치 요소를 활용해 새로운 인증 영역을 개척하고 있는 테크 기업이다. 고객의 정보를 탈취한 금융 범죄자가 선불폰을 통해 부정 접속시, 기존 인증방식에 위치 정보를 추가해 사고를 예방한다. 우리에프아이에스는 추후 서비스에 적용될 모델과 대상 채널을 협의하고 있다.‘담아’는 프리미엄 김 제조 업체로서 우수한 품질의 한국 전통 음식을 고급화·스낵화·플랫폼화해 세계 시장에 도전장을 내고 있는 스타트업이다. 우리은행은 지난 2월부터 업계 최초로 선보인 마이데이터 구독서비스를 통해 ‘담아’의 프리미엄 김 정기 구독 서비스를 상반기 중 시장에 선보일 예정이다.더불어 우리은행이 기업금융 디지털화를 위해 준비하고 있는 디지털 공급망 금융(SCF) 플랫폼인 ‘WON 비즈플라자’와 디노랩 기업들이 손을 잡았다. WON 비즈플라자 플랫폼에서는 중소기업의 운전자금 확보를 돕는 고유의 금융기능 외에도 기업의 경영지원 활동을 위한 비금융 B2B 전문몰을 동시에 오픈 준비 중이다.디노랩의 스타트업 중 에이치알엠(ESG 순환자원 솔루션), 웨인힐스브라이언트A.I(AI기반 텍스트 영상자동변환, 전 웨인힐스벤처스), 아미쿠스렉스(AI기반 법률문서 자동작성 플랫폼), 글로싸인(클라우드기반 전자계약서비스), 엘핀(위치기반 모바일 인증 솔루션) 등이 참여 예정이다.우리금융 관계자는 “그룹 디지털 초혁신 추진 및 신성장 동력 마련을 위해 디노랩 기업들과 전방위로 협업을 시도중”이라며 “우리금융과 혁신 DNA를 만들어갈 수 있는 디노랩 기업들과 시너지를 창출해 나갈 것”이라고 말했다.한편 우리금융은 이달 30일까지 서울 성동구 성수동에 위치한 디노랩 제1센터에 입주할 디노랩 3기 스타트업을 모집 중이다."
