기사날짜,기사제목,네이버 뉴스 url,기사내용
2023.08.23.,[고유권의 쿰파니스] 은행 금융사고와 이권 카르텔,url없음,<네이버 기사 없음>
2023.08.31.,"안양시, 차기 시금고 운영 금융기관 선정",url없음,<네이버 기사 없음>
2023.08.30.,예대금리차 다시 확대… 농협·국민·신한銀 순,https://n.news.naver.com/mnews/article/029/0002822381?sid=101,"5대 은행(KB국민·신한·하나·우리·NH농협)의 가계 예대금리차가 5개월 만에 확대된 것으로 나타났다. 30일 은행연합회 소비자포털에 공시된 '예대금리차 비교' 통계에 따르면 신규 취급액 기준 7월 평균 가계 예대금리차(정책서민금융 제외)는 0.934%포인트(p)로 집계됐다. 전월 평균(0.928%p) 대비 0.006%p 확대됐다.예대금리차는 저축성 수신금리에서 대출금리를 뺀 값이다. 은행의 수익성을 나타내는 지표로 쓰인다. 예대금리차가 상대적으로 크다는 것은 산술적으로 대출·예금 금리 격차에 따른 마진(이익)이 많다는 뜻이다.은행별로보면 농협은행이 1.11%p로 가장 높았다. 다만 전월 대비 0.08%p 낮아졌다. 농협은행 다음으로 KB국민은행(0.92%p), 신한은행(0.91%p), 우리은행(0.90%p), 하나은행(0.83%p) 순이었다.  5대 은행, 인터넷은행, 지방은행, 외국계 은행을 포함해 이날 공시에 참여한 19개 은행 중 가계 예대금리차가 가장 큰 곳은 전북은행(5.76%p)이었다. 토스뱅크(3.39%) 인터넷은행, 지방은행, 외국계 은행을 포함해 이날 공시에 참여한 19개 은행 가운데 정책서민금융 제외 가계 예대금리차가 가장 큰 곳은 전북은행(5.76%p)이었고, 토스뱅크(3.39%p)가 뒤를 이었다.기업 대출까지 포함한 전체 은행의 예대금리차(대출금리-저축성수신금리)의 경우 5대 은행 중 농협은행(1.53%p)이 1위를 차지했다. 2위에는 신한은행(1.36%p)이 이름을 올렸다. 신규 대출이 아닌 대출 잔액 기준으로 5대 은행 가운데 정책서민금융을 제외한 가계 예대금리차가 가장 큰 곳은 KB국민은행(2.54%p)으로 나타났다. 농협은행(2.45%p)·신한은행(2.38%p)·우리은행(2.18%p)·하나은행(2.08%p)이 뒤를 이었다.사진 연합뉴스."
2023.08.31.,지역경제 기여 최우수 은행 국민·기업·농협…SC·씨티는 ‘미흡’,url없음,<네이버 기사 없음>
2023.08.31.,"우리銀, 토큰증권시장 진출... 삼성證·SK證와 맞손",url없음,<네이버 기사 없음>
2023.08.31.,[테크M 이슈] 말 많은 토큰증권 시대 개막...블록체인 기반 투자자산 늘어난다,url없음,<네이버 기사 없음>
2023.08.30.,"'4% 예금' 속속 부활…""고금리 특판 경쟁 다시?"" 저축은행 '긴장'",https://n.news.naver.com/mnews/article/008/0004931596?sid=101,"[MT리포트-9월 수신전쟁, 고금리 100조가 몰려온다]②고금리 수신경쟁 시작한 금융권[편집자주] 금융권에서 9월 위기감이 감돌고 있다. 9월말 유동성 비율 규제를 맞추기 위한 '수신전쟁'이 되풀이될 수 있다는 우려다. 지난해 레고랜드 사태 이후 벌어진 '수신전쟁'의 결과인 연 5% 이상 고금리예금 100조원 이상의 만기가 서서히 다가오고 있다. 과도한 '머니무브'는 금융회사의 건전성은 물론 유동성 위기까지 가져올 수 있다. 과도한 머니무브를 막기 위한 방안을 고민할 때다.은행·2금융권 등 전 금융권 예금금리가 조금씩 오르고 있다. 시장금리 상승세를 반영한 것이지만 지난해 말 팔았던 고금리 특판 예금상품의 만기가 다가오자 자금 이탈을 막기 위해 금융사들이 선제적으로 나선 영향도 있다. 저축은행, 신협, 새마을금고를 중심으로 한 2금융권에서는 ""지난해 말처럼 고금리 특판 출혈 경쟁이 벌어지는 것 아니냐""는 우려가 커지고 있다. 30일 은행연합회에 따르면 국내 은행의 예금 최고금리(우대금리 포함)는 연 2.7~4.1%로 나타났다. 지난해 말 연 5%대까지 치솟았던 은행 예금금리가 상반기 연 3%대까지 떨어졌다가 최근 다시 연 4%가 넘는 상품이 등장하고 있다.    이날 기준 가장 높은 예금금리를 주는 상품은 SC제일은행의 'e-그린세이브예금(4.1%)'이다. 우리은행도 지난달 '우리 첫거래 우대 정기예금'의 기본금리를 연 2.8%에서 연 3.1%로 인상해 모든 우대금리를 합친 최고금리가 연 4.1% 수준이다. DGB대구은행의 'DGB함께예금'의 금리도 연 4.05%로 4%를 넘는다. 지난해 말 고금리 특판의 만기가 다가오자 이를 통해 끌어모았던 자금을 재예치하기 위해서 금리를 인상한 것으로 보인다. 지난해 10월 레고랜드 사태가 터진 후 채권시장이 출렁였다. 은행들은 자금확보를 위해 은행채 발행 규모를 역대 최대로 늘리고, 예금금리 또한 5%대까지 높였다. 은행 정기예금이 5%대까지 치솟은 것은 이례적이었다. 코로나19(COVID-19) 사태 이후 한시적으로 완화했던 은행권 규제가 원래 수준으로 돌아가자 은행들이 예금 확보에 적극적으로 나선 영향도 없지 않다. 금융당국은 지난달부터 예대율(예금 대비 대출 비율) 규제를 정상화했고, 은행 유동성커버리지비율(LCR)도 연말까지 95%를 유지한 뒤 내년 규제비율은 연말에 시장 상황을 보고 결정하기로 했다. 한 은행권 관계자는 ""지난해에는 레고랜드 사태와 함께 흥국생명의 콜옵션 미이행 등으로 채권금리가 급등하는 가운데 금융당국이 은행채 발행을 자제해 예금금리가 급등하는 사태가 발생했다""며 ""올해에도 중국 부동산 위기가 심해지고 미국이 한 차례 더 기준금리를 인상해 시장금리가 상승하면 또다시 예금금리 경쟁이 재현될 가능성이 있다""고 설명했다. 은행들이 예금금리를 높이자 2금융권의 긴장감은 커지고 있다. 2금융권보다 안전한 이미지가 강한 은행이 예금금리를 인상하면 고객 이탈을 막기 위해 저축은행들은 더 높은 금리의 상품을 내세울 수밖에 없다. 통상 은행보다 1%포인트 높은 이자를 줘야 자금 이탈을 방어할 수 있다. 실제로 지난해 레고랜드 사태 이후 은행들이 자금을 확보하기 위해 5%대 예금상품을 내놓자 저축은행, 새마을금고 등은 고객 이탈을 막기 위해 6%가 넘는 상품을 출시했다. 당시 연 10%대 적금까지 등장하며 일부 2금융권 지점에서는 예·적금 상품에 가입하기 위해 아침부터 고객들이 줄을 서며 기다리는 '오픈런' 현상까지 나타났다. ""지난해와 같은 고금리 특판 경쟁이 나타나는 것 아니냐""는 우려까지 나온다. 이미 우려를 반영해 2금융권 금리는 높아지고 있다. 한때 3%대까지 떨어졌던 79개 저축은행의 만기 1년 예금금리 평균도 6월1일부터 4%를 넘은 뒤 계속 상승하고 있다. 한성·페퍼저축은행 등은 4.5% 금리의 예금상품을 판매하고 있다. 일부 새마을금고는 최근 연 7.7% 금리의 적금 상품을 내놓기도 했다. 한 저축은행 관계자는 ""저축은행의 예금금리는 기준금리보다는 타업권의 예금금리에 영향을 받는데, 올해 인터넷은행이 자산을 공격적으로 늘리고 상호금융권도 경쟁적으로 금리를 올리고 있다""며 ""올해 대출영업이 축소돼 예수금에 대한 수요가 크진 않지만, 지나친 자금 이탈을 막기 위해 저축은행들이 예금금리 인상 눈치를 보고 있다""고 말했다."
2023.08.31.,[테크M 이슈] 말 많은 토큰증권 시대 개막...블록체인 기반 투자자산 늘어난다,url없음,<네이버 기사 없음>
2023.08.30.,은행권 가계 예대금리차 다시 확대… 농협·국민·신한 순,https://n.news.naver.com/mnews/article/448/0000425471?sid=101,"지난달 5대 은행 가운데 가계대출 예대금리차가 가장 컸던 곳은 NH 농협은행으로 나타났다.30일 은행연합회 소비자 포털에 공시된 '예대금리차 비교' 통계에 따르면, 지난달 정책서민금융을 뺀 NH 농협은행의 가계 예대금리차는 1.11%p로 집계됐다.이어 KB국민은행 0.92%p, 신한은행 0.91%p, 우리은행 0.90%p, 하나은행 0.83%p 순이었다.대출금리와 예금금리 차이인 예대금리차가 상대적으로 크다는 건, 대출·예금 금리 격차에 따른 은행 이익이 많다는 뜻이다.인터넷은행, 지방은행, 외국계 은행을 포함해 공시에 참여한 19개 은행으로 범위를 넓히면 전북은행이 5.76%p로 가장 컸고, 토스뱅크가 3.39%p로 뒤를 이었다.19개 은행 월별 예대금리차 공시는 지나친 이자 장사를 막자는 취지에서 지난해 7월 시작됐다."
2023.08.30.,"'4% 예금' 속속 부활…""고금리 특판 경쟁 다시?"" 저축은행 '긴장'",https://n.news.naver.com/mnews/article/008/0004931596?sid=101,"[MT리포트-9월 수신전쟁, 고금리 100조가 몰려온다]②고금리 수신경쟁 시작한 금융권[편집자주] 금융권에서 9월 위기감이 감돌고 있다. 9월말 유동성 비율 규제를 맞추기 위한 '수신전쟁'이 되풀이될 수 있다는 우려다. 지난해 레고랜드 사태 이후 벌어진 '수신전쟁'의 결과인 연 5% 이상 고금리예금 100조원 이상의 만기가 서서히 다가오고 있다. 과도한 '머니무브'는 금융회사의 건전성은 물론 유동성 위기까지 가져올 수 있다. 과도한 머니무브를 막기 위한 방안을 고민할 때다.은행·2금융권 등 전 금융권 예금금리가 조금씩 오르고 있다. 시장금리 상승세를 반영한 것이지만 지난해 말 팔았던 고금리 특판 예금상품의 만기가 다가오자 자금 이탈을 막기 위해 금융사들이 선제적으로 나선 영향도 있다. 저축은행, 신협, 새마을금고를 중심으로 한 2금융권에서는 ""지난해 말처럼 고금리 특판 출혈 경쟁이 벌어지는 것 아니냐""는 우려가 커지고 있다. 30일 은행연합회에 따르면 국내 은행의 예금 최고금리(우대금리 포함)는 연 2.7~4.1%로 나타났다. 지난해 말 연 5%대까지 치솟았던 은행 예금금리가 상반기 연 3%대까지 떨어졌다가 최근 다시 연 4%가 넘는 상품이 등장하고 있다.    이날 기준 가장 높은 예금금리를 주는 상품은 SC제일은행의 'e-그린세이브예금(4.1%)'이다. 우리은행도 지난달 '우리 첫거래 우대 정기예금'의 기본금리를 연 2.8%에서 연 3.1%로 인상해 모든 우대금리를 합친 최고금리가 연 4.1% 수준이다. DGB대구은행의 'DGB함께예금'의 금리도 연 4.05%로 4%를 넘는다. 지난해 말 고금리 특판의 만기가 다가오자 이를 통해 끌어모았던 자금을 재예치하기 위해서 금리를 인상한 것으로 보인다. 지난해 10월 레고랜드 사태가 터진 후 채권시장이 출렁였다. 은행들은 자금확보를 위해 은행채 발행 규모를 역대 최대로 늘리고, 예금금리 또한 5%대까지 높였다. 은행 정기예금이 5%대까지 치솟은 것은 이례적이었다. 코로나19(COVID-19) 사태 이후 한시적으로 완화했던 은행권 규제가 원래 수준으로 돌아가자 은행들이 예금 확보에 적극적으로 나선 영향도 없지 않다. 금융당국은 지난달부터 예대율(예금 대비 대출 비율) 규제를 정상화했고, 은행 유동성커버리지비율(LCR)도 연말까지 95%를 유지한 뒤 내년 규제비율은 연말에 시장 상황을 보고 결정하기로 했다. 한 은행권 관계자는 ""지난해에는 레고랜드 사태와 함께 흥국생명의 콜옵션 미이행 등으로 채권금리가 급등하는 가운데 금융당국이 은행채 발행을 자제해 예금금리가 급등하는 사태가 발생했다""며 ""올해에도 중국 부동산 위기가 심해지고 미국이 한 차례 더 기준금리를 인상해 시장금리가 상승하면 또다시 예금금리 경쟁이 재현될 가능성이 있다""고 설명했다. 은행들이 예금금리를 높이자 2금융권의 긴장감은 커지고 있다. 2금융권보다 안전한 이미지가 강한 은행이 예금금리를 인상하면 고객 이탈을 막기 위해 저축은행들은 더 높은 금리의 상품을 내세울 수밖에 없다. 통상 은행보다 1%포인트 높은 이자를 줘야 자금 이탈을 방어할 수 있다. 실제로 지난해 레고랜드 사태 이후 은행들이 자금을 확보하기 위해 5%대 예금상품을 내놓자 저축은행, 새마을금고 등은 고객 이탈을 막기 위해 6%가 넘는 상품을 출시했다. 당시 연 10%대 적금까지 등장하며 일부 2금융권 지점에서는 예·적금 상품에 가입하기 위해 아침부터 고객들이 줄을 서며 기다리는 '오픈런' 현상까지 나타났다. ""지난해와 같은 고금리 특판 경쟁이 나타나는 것 아니냐""는 우려까지 나온다. 이미 우려를 반영해 2금융권 금리는 높아지고 있다. 한때 3%대까지 떨어졌던 79개 저축은행의 만기 1년 예금금리 평균도 6월1일부터 4%를 넘은 뒤 계속 상승하고 있다. 한성·페퍼저축은행 등은 4.5% 금리의 예금상품을 판매하고 있다. 일부 새마을금고는 최근 연 7.7% 금리의 적금 상품을 내놓기도 했다. 한 저축은행 관계자는 ""저축은행의 예금금리는 기준금리보다는 타업권의 예금금리에 영향을 받는데, 올해 인터넷은행이 자산을 공격적으로 늘리고 상호금융권도 경쟁적으로 금리를 올리고 있다""며 ""올해 대출영업이 축소돼 예수금에 대한 수요가 크진 않지만, 지나친 자금 이탈을 막기 위해 저축은행들이 예금금리 인상 눈치를 보고 있다""고 말했다."
2023.08.30.,"""롯데카드 매각 어쩌나""…부동산 PF 부실 위험에 배임까지",https://n.news.naver.com/mnews/article/003/0012057973?sid=101,"직원들 100억원대 배임 적발돼부동산 PF대출 1조5000억원 규모 *재판매 및 DB 금지[서울=뉴시스] 남정현 기자 = 카드업계가 실적 부진을 겪고 있는 가운데 롯데카드는 카드업계에서 유일하게 조 단위로 부동산 PF대출을 취급하고 있는 등 신용판매보다 기업대출을 통해 외형적인 성장을 이뤘다는 평가를 받는다. 최근 새마을금고 사태로 PF대출 부실우려가 전 금융권으로 확산되고 있는데, 롯데카드에서 직원들의 100억원대 배임이 적발돼 이 회사의 매각에 상당한 난항이 예상된다.30일 금융업계에 따르면 금융감독원은 롯데카드 직원의 업무상배임 혐의에 대해 현장검사를 실시해 지난 14일 해당 카드사 직원 2명과 관련 협력업체 대표를 검찰에 고발했다고 전날 밝혔다.금감원은 부실한 협력업체와 제휴계약을 체결해 105억원을 지급한 뒤 66억원을 페이퍼컴퍼니 등의 대가를 받은 롯데카드 직원 2명(사고자)을 적발했다.금감원은 상기 혐의사실에 대해 롯데카드 직원 2인 및 협력업체 대표를 특경법 위반(업무상배임) 혐의로 검찰에 고발하는 한편, 내부통제 실패에 책임이 있는 임직원을 엄정 조치하도록 지도할 방침이다.롯데카드 관계자는 ""롯데카드 직원이 협력업체로부터 금품을 받았다는 제보를 받고 자체 감사를 진행해 관련 사실을 금융당국에 보고하고 보다 정확한 사실관계 확인을 위해 경찰에 수사를 의뢰했다""며 ""현재 수사 중인 사안으로 당사는 수사에 적극 협조하고 있다""고 해명했다.이어 ""아울러 유사 사례가 발생하지 않도록 내부통제 전반을 재점검해 재발방지대책을 마련했으며 충실히 이행하겠다""고 덧붙였다. MBK파트너스가 2019년 5월 롯데카드를 매입한 후 이 회사는 순이익이 다섯 배 가까이 오르는 등 가치가 크게 상승했다. 카드사 매각가의 산정 기준이 되는 롯데카드의 자본총계는 3월 말 기준 2조9154억원에 달했다.  하지만 롯데카드는 지난해와 4년 전 매각을 위한 예비입찰에서 흥행에 실패했는데 이는 카드업황 자체의 미래도 밝지만은 않은 상황에서 롯데카드가 본업인 신용판매보다 대출자산 증가세 등을 통해 외형성장을 이뤘다는 평가를 받기 때문이다. 3월 말 기준 롯데카드의 영업자산은 18조8000억원인데 카드자산 15조, 대출자산 3조로 구성됐다. 이 중 대출자산은 부동산PF가 50%로 가장 높고, 기타 기업대출이 36%로 기업대출이 86%가량을 차지했다.부동산 PF대출잔액은 1조5477억원으로 영업자산의 8.2%를 차지했다. 이는 2020년 말 기준 2290억원(영업자산의 1.8%)과 비교해 9분기 만에 6.7배가량 늘었다.영업이익은 664억원으로 전년동기 대비 42% 감소했다. 한국신용평가는 평가리포트에서 ""최근 금리 상승, 경기 불확실성 확대 등으로 자산건전성지표가 저하됐다""며 ""기존 카드자산 대비 본원적인 위험 수준이 높은 점, 최근 부동산 경기가 저하된 점 등을 고려할 때 부실발생 위험에 대한 모니터링이 필요하다""고 지적했다. 롯데카드 관계자는 ""롯데카드의 부동산PF 대출의 질은 시공사 구성, 수도권 및 주거시설 비중 등을 판단할 때 다른 제2금융권 금융기관 대비 우수한 것으로 분석하고 있다""고 설명했다. 앞서 MBK파트너스는 2019년 5월 우리은행과 컨소시엄을 이뤄 1조3810억원에 롯데카드를 인수했다. MBK파트너스가 59.83%, 우리은행이 20%의 지분을 각각 보유하고 있다. 한 금융업계 관계자는 ""카드업계에서 PF대출을 취급하는 카드사는 신한카드와 롯데카드 2곳이고 신한카드는 2000억원으로 규모가 크지 않아 그만큼 익스포저(위험노출액)가 크지 않다""고 말했다."
2023.08.16.,"5대 시중은행, 23兆 민‧관 합동 수출기업 지원책의 23.5% 감당",url없음,<네이버 기사 없음>
2023.08.31.,특례보금자리론 금리 또 인상…일반형 0.25%p·우대 0.2%p↑,https://n.news.naver.com/mnews/article/374/0000349384?sid=101,"[앵커]정부가 서민들의 내 집 마련의 부담을 덜어주기 위해 출시한 정책금융상품인 특례보금자리론의 금리를 올리기로 했습니다.지난 2월 이후 줄어들던 은행권 가계 예대금리차가 다시 확대됐습니다.박채은 기자와 이야기 나눠보겠습니다.특례보금자리론의 금리가 구체적으로 얼마나 오르나요?[기자]다음 달 7일부터 특례보금자리론 일반형은 0.25%p, 우대형은 0.2%p 인상됩니다.주택가격이 6억원이 넘거나 부부합산 연소득이 1억원이 넘는 경우에 해당하는데요.이번 이상으로 상황기간에 따른 일반형의 금리 수준은 연 4.65%에서 최고 연4.95%가 됩니다.다만 전세사기 피해자의 경우 주거안정과 경제적 재기 지원을 위해 종전과 동일한 금리를 적용합니다.이번 인상으로 특례보금자리론의 금리는 두 달 연속 오르게 됐는데요.최근 가계대출 급증 원인 중 하나로 특례보금자리론이 지목되면서 금융당국이 추가 금리 인상을 통해 공급속도 조절에 나선 것으로 풀이됩니다.[앵커]가계대출 예대금리차, 5대 은행 중 가장 큰 곳은 어디였나요?[기자]은행연합회 소비자 포털에 공시된 '예대금리차 비교' 통계에 따르면 지난달 정책서민금융을 뺀 NH농협의 가계 예대금리차가 1.11%p로 가장 컸습니다.이어 KB국민은행, 신한은행, 우리은행, 하나은행 순으로 나왔습니다.예대금리차가 상대적으로 크다는 건 대출 금리와 예금 금리 격차에 따른 은행 마진이 많다는 뜻인데요.신한은행과 농협은행의 예대금리차는 전월보다 축소됐지만, 국민은행과 하나은행, 우리은행의 예대금리차는 전월보다 확대됐습니다.한편, 공시에 참여한 19개 은행 가운데 예대금리차가 가장 큰 곳은 전북은행으로 5.76%p로 집계됐습니다.[앵커]이 내용도 짚어보죠.전세사기 피해지원 특별법의 지원을 받을 수 있는 피해자가 추가로 인정됐다고요?[기자]그렇습니다.국토교통부 전세사기피해지원위원회는 어제(30일) 제8차 전체회의를 열고 피해자 결정 신청 1천430건 중 1천119건을 가결했다고 밝혔습니다.피해지원위원회는 전세금 반환 보증보험에 가입했거나 최우선변제금을 받아 보증금 전액 반환이 가능한 62명에 대해선 피해자로 인정하지 않았습니다.또 183명은 특별법의 피해자 요건을 충족하지 못했습니다.이번 전체회의에서는 이의신청 54건 중 23건이 받아들여져 피해자로 인정됐습니다.[앵커]현대자동차가 특근을 거부하기로 하면서 노사 간 갈등이 장기화 조짐을 보이고 있는데요.철도노조 역시 파업을 예고했습니다.관련해서 소식 전해주시죠.[기자]현대차 노조는 올해 임금 및 단체협약 교섭에서 난항을 이어가자 어제(30일) 중앙쟁의대책위원회를 열고 다음달 4일부터 주말 특근을 거부하기로 결정했습니다.다만 회사 요청에 따라 오늘(31일)부터 교섭은 재개하기로 했습니다.현재 노조는 합법적인 파업권을 확보한 상태인데요, 재개된 교섭에서도 별다른 진전이 없으면 파업 돌입을 검토할 것으로 예상됩니다.전국철도노동조합도 지난 28일부터 진행한 쟁의행위 찬반투표 결과 64.4% 찬성으로 가결됐습니다.노조는 다음달 1일 서울역에서 쟁의 돌입 절차 등에 관해 기자회견을 하고, 확대쟁의대책위원회를 개최할 예정입니다. 당신의 제보가 뉴스로 만들어집니다.SBS Biz는 여러분의 제보를 기다리고 있습니다.홈페이지 = https://url.kr/9pghjn"
2023.08.31.,"안양시, 차기 시금고 운영 금융기관 선정",url없음,<네이버 기사 없음>
2023.08.31.,4대은행 점포 수 석달 만에 30개 줄었다,https://n.news.naver.com/mnews/article/014/0005065630?sid=101,"급격한 점포폐쇄에 제동 걸기 위해 공시 주기 단축 점포폐쇄 공시 주기 단축 효과는 '아직'  [파이낸셜뉴스]  사진=뉴시스 4대 시중은행(KB국민·신한·하나·우리)의 점포(지점·출장소) 수는 2·4분기 기준 2818개로 전 분기 보다 30개 줄어든 것으로 나타났다.   8월 31일 은행연합회 공시에 따르면 4대 은행의 점포 수는 2818개로 지난 1·4분기 말 2848개 보다 30개 감소했다.   은행별로 보면 KB국민은행의 점포 수가 가장 많이 줄었다. 지난 1·4분기 818개였던 KB국민은행 점포 수는 2·4분기에 794개로 24개 감소했다. 신한은행도 729개에서 722개로 7개 줄었다. 하나은행은 출장소가 하나 늘어 점포 수가 593개에서 594개로 유일하게 늘었다. 우리은행은 2·4분기 708개로 전 분기 말과 동일하다.   점포 현황을 공시한 16개 은행의 전체 점포 수는 5740개로 1분기(5778개)보다 38개가 줄었다. 폐쇄된 점포가 40개, 신설된 점포는 2개였다.   금융당국은 시중은행들의 점포폐쇄가 잇따르자 이에 제동을 걸기 위해 지난 5월 ‘은행 점포 폐쇄 내실화 방안’을 발표하고 은행 경영 공시 중 영업점 폐쇄 현황 공시를 연 1회에서 분기 1회로 단축했다. 이날 발표된 공시는 주기 단축 후 나온 첫 공시다.   다만 은행들이 점포를 폐쇄할 때는 대부분 연간 계획을 잡고 진행하는 만큼 공시가 단축됐다고 해서 바로 폐쇄점포가 줄어드는 효과를 얻기는 힘들 것으로 보인다.   한 시중은행 관계자는 ""당국의 공시 주기 단축 조치가 5월에 발표됐는데 이미 올해 점포 폐쇄 계획은 올 초에 확정된 것인 만큼 이로 인한 효과가 당장 나타나기는 쉽지 않을 것""이라고 말했다.   한편 은행권의 점포 폐쇄는 2015년 이후 금융에 있어서도 디지털화가 빠르게 진행되면서 급속도로 진행돼 왔다. 특히 코로나19 이후로는 비대면 금융거래가 활발해지면서 점포폐쇄는 더욱 가속화됐다. 이에 지난 2015년 3924곳에 달했던 은행권 영업점 수는 7년 새 1024곳 가량 줄어들었다."
2023.08.31.,"국민·기업·농협銀, 지역재투자 최우수…SC제일·씨티 미흡",url없음,<네이버 기사 없음>
