기사날짜,기사제목,네이버 뉴스 url,기사내용
2022.02.28.,"우리은행, 플래그십 영업점 '판교역프리미엄금융센터' 개점",https://n.news.naver.com/mnews/article/001/0013018030?sid=101,"우리은행, 플래그십 영업점 '판교역프리미엄금융센터' 오픈(서울=연합뉴스) 우리은행이 일반 고객뿐 아니라 기업 및 자산가 고객을 대상으로 한 플래그십 영업점 1호 '판교역프리미엄금융센터'를 판교테크원타워에 개점한다고 28일 밝혔다. '플래그십'은 기업의 주력 상품 또는 서비스를 뜻한다. 사진은 판교역프리미엄금융센터의 PCIB 존. 2022.2.28     [우리은행 제공. 재판매 및 DB 금지] photo@yna.co.kr    (서울=연합뉴스) 김유아 기자 = 우리은행은 경기도 성남시 분당구 판교테크원타워에 기업 및 자산가 고객 등을 대상으로 한 플래그십 영업점 1호인 '판교역프리미엄금융센터'를 개점한다고 28일 밝혔다.    플래그십 영업점은 기업의 주력 상품이나 서비스를 선보이는 곳이다.    판교역프리미엄금융센터는 일반 개인 고객과 개인사업자 고객이 이용하는 리테일(Retail) 존과 고액 자산가와 기업고객 대상 특화 서비스를 제공하는 존으로 구성된 대형 복합점포다.    교통이 편리한 판교역세권에 있으며, 인근 정보기술(IT) 기업체와 임직원뿐만 아니라 기존 고액 자산가 고객의 수요에 맞춰 전문 상담 중심의 서비스를 제공한다는 게 우리은행 설명이다.    우리은행은 ""앞으로도 새로운 거점지역에 프리미엄금융센터를 지속해서 오픈할 계획""이라면서 ""이를 통해 전문 상담 중심의 최상위 금융서비스를 확대하겠다""라고 말했다.우리은행, 플래그십 영업점 '판교역프리미엄금융센터' 오픈(서울=연합뉴스) 우리은행이 일반 고객뿐 아니라 기업 및 자산가 고객을 대상으로 한 플래그십 영업점 1호 '판교역프리미엄금융센터'를 판교테크원타워에 개점한다고 28일 밝혔다. '플래그십'은 기업의 주력 상품 또는 서비스를 뜻한다. 사진은 판교역프리미엄금융센터의 리테일 존. 2022.2.28     [우리은행 제공. 재판매 및 DB 금지] photo@yna.co.kr    kua@yna.co.kr"
2022.02.28.,"우리은행, 판교역프리미엄금융센터 오픈…전문상담 제공",https://n.news.naver.com/mnews/article/421/0005935436?sid=101,"판교역프리미엄금융센터 리테일 존(우리은행 제공) © 뉴스1(서울=뉴스1) 이승환 기자 = 우리은행은 플래그십 영업점 1호 '판교역프리미엄금융센터'의 문을 열었다고 28일 밝혔다.플래그십은 기업의 주력 상품 또는 서비스를 의미하며, 우리은행은 판교역프리미엄금융센터를 플래그십 대형 모델로 삼았다.판교테크원타워에 들어서는 이 영업점은 일반 개인 고객과 소호(개인사업자) 고객이 이용하는 리테일 존, 고액 자산가와 기업고객 대상 특화 서비스를 제공하는 PCIB 존으로 구성됐다. 두 개의 영업점을 함께 배치한 대형 복합점포인 셈이다.특히 리테일 존에는 고객이 여유롭게 금융서비스를 이용할 수 있도록 갤러리 형태의 대기 공간 '라운지'를 조성했다.판교역프리미엄금융센터는 교통이 편리한 판교역세권에 위치해 인근 정보기술(IT) 기업의 임직원과 기존 고액 자산가 고객의 요구에 맞춰 전문 상담 중심의 서비스를 제공한다. 우리은행 관계자는 ""전문 상담 중심의 최상위 금융서비스를 지속적으로 확대하겠다""고 말했다."
2022.02.28.,[인사] 우리금융·우리은행,url없음,<네이버 기사 없음>
2022.02.28.,[#오늘의 금융] 우리은행 '플래그십 영업점' 1호 개점 外 신한은행·국민은행,url없음,<네이버 기사 없음>
2022.02.28.,"러시아 스위프트 퇴출, 국내은행 '신용 위험성' 대응책 고심",url없음,<네이버 기사 없음>
2022.02.28.,서울시 금고지기를 맡아라! 신한은행 또 출혈경쟁 나설까,https://n.news.naver.com/mnews/article/262/0000015239?sid=101,"[금융 인사이드] ● 2018년 우리은행 104년 독점 깬 신한은행● 4년 전 공개입찰에 3015억 원 출연금 써내● 금감원, 기관경고 및 과태료 21억 원 부과● “징계 받고 일부 적자라도 수주하는 게 이득”● 출연금 배점 낮췄지만 평가 항목 개선 필요신한은행은 4년 전 우리은행의 서울시 금고은행 독점체제를 깨고 1금고에 선정됐다. [신한은행]서울시 금고지기 선정을 놓고 시중은행 간 치열한 경쟁이 예상된다. 서울시는 2023년부터 4년간 44조2190억 원의 예산과 기금 관리를 맡길 금고은행 선정을 앞두고 있다. 2월 안에 시금고 선정 계획을 공고하고, 심사를 거쳐 3월 최종 금고은행을 확정 지을 예정이다.지자체의 예산과 기금 관리를 맡을 금고은행은 각 지자체에서 공개입찰 방식으로 결정한다. 금고은행으로 선정되면 시의 현금과 유가증권 출납보관, 세입금 수납이체, 세출금 지급 등을 도맡게 된다. 서울시는 통상 5월경 금고은행을 선정했으나, 올해는 3월 대선과 6월 서울시장 선거 영향으로 선정 날짜를 두 달가량 앞당겼다.현재 서울시 금고를 운영하는 은행은 두 군데로 1금고는 신한은행이, 2금고는 우리은행이 관리한다. 1915년 경성부 금고 시절부터 2018년까지 104년간 우리은행이 서울시 금고를 독점으로 맡았다. 그러나 서울시가 2018년 시금고 선정을 앞두고 단일금고 체제를 복수금고 체제로 개편하면서 1금고에는 일반특별회계, 2금고에는 기금 관리를 맡기기로 했다. 바뀐 방침에 따라 각 은행은 공개입찰에 나섰다. 신한은행이 우리은행 독점 체제를 깨고 1금고 사업자로 선정됐다.배점 높이려 과감한 출연금 베팅2018년 입찰 당시 각 은행은 상당한 수준의 출연금을 약정해 논란이 됐다. 출연금은 일종의 협력사업비로 금고은행이 지자체 자금을 대신 운용해주고 투자수익 일부를 출연하는 것을 말한다. 당시 신한은행은 금고 운영을 위한 전산망 구축비용으로 1000억 원을 제시하는 등 3015억 원의 출연금을 지급하기로 약속했는데, 이는 시중은행 가운데 가장 많은 액수였다. 신한은행은 과감하게 출연금을 베팅해 금고 지정을 위한 평가 기준 점수를 높이는 전략을 썼다.이는 결국 문제가 됐다. 금융감독원은 신한은행이 서울시 금고지기를 차지하기 위해 제시한 출연금 액수가 정상 수준을 벗어난다고 판단한 것. 지난해 3월 금감원은 신한은행을 종합검사한 결과를 토대로 신한은행에 기관경고 제재와 과태료 21억3110만 원을 부과했다. 금감원은 신한은행이 전산망 구축비용으로 제시한 1000억 원 가운데 393억 원은 꼭 필요한 비용이 아니었다는 결론을 내렸다. 또 2018년 서울시 금고 유치전을 총괄한 위성호 당시 신한은행장(현 흥국생명 부회장)에게 주의적 경고(상당)를 통보했다.서울시를 비롯한 지자체 금고 지정을 놓고 은행 간 과당경쟁이 벌어지자 비판이 제기됐다. 은행이 과도한 출연금을 지출하는 데 따른 손실을 보전하기 위해 일반 고객에게 돌아갈 혜택을 줄이는 등의 피해 전가가 우려된다는 지적이 계속됐다.2019년 3월 행정안전부는 금고 선정제도 개선안을 내놨다. 문제가 된 협력사업비 배점을 기존 4점에서 2점으로 축소하고, 금리 배점을 15점에서 18점으로 확대해 출연금이 아닌 이자 경쟁을 유도하는 방향으로 기준을 바꿨다. 또 협력사업비가 순이자 마진을 초과하거나 전년 대비 출연 규모가 20% 이상 증액되는 경우 가운데 하나라도 해당되면 출연금이 과다한 경우로 보고 지자체가 행정안전부에 보고하도록 하는 방침도 내렸다. 당시 고규창 행정안전부 지방재정경제실장은 “금고 본연의 업무를 투명하고 공정하게 평가할 수 있도록 기준을 개선하고, 협력사업비 등 금고제도 운영 전반에 대한 모니터링을 지속적으로 강화해 나갈 것”이라고 밝혔다.그러나 정부의 이 같은 조치에도 시중은행의 출혈경쟁은 계속됐다. 1월 국회 정무위원회 소속 윤창현 국민의힘 의원실이 KB국민신한하나우리NH농협은행 등 5대 시중은행에서 받은 자료를 토대로 집계한 바에 따르면 2017년 말부터 2021년 말까지 이들 은행이 지자체에 낸 출연금은 1조864억 원인 것으로 밝혀졌다. 출연금 규모가 가장 큰 곳은 신한은행으로, 이 기간 동안 신한은행의 지자체 금고 출연금은 4879억 원이었다. 이는 5대 시중 은행 전체 출연금의 약 45% 수준이다. 신한은행 다음으로는 NH농협(2728억 원), 우리(2237억 원), KB국민(707억 원), 하나(295억 원) 순이었다.각 은행은 지자체 금고 운영을 통해 벌어들이는 수익이 어느 정도인지 공개하지 않고 있다. 업무상 비밀이라는 게 표면적 이유다. 단순히 운영을 통해 벌어들이는 수익만 놓고 보면 실익이 없는 것으로 보인다. 업계에 따르면 신한은행은 2018년 서울시 금고 입찰에 3000억 원이 넘는 출연금을 제시한 데다가 과태료까지 내게 된 탓에 2021년 이후에야 서울시 금고사업의 손익분기점을 넘긴 것으로 알려졌다.‘영예 사업’이라기엔 부수적 이익 상당해금융권에서는 지자체 금고 사업을 두고 이익이 거의 발생하지 않는 은행의 영예 사업이라는 견해도 나온다. 금융권의 한 관계자는 “산술적으로 계산기를 두들겨 보면 경쟁에 쏟아붓는 자금과 노력 대비 수익이 적다. 지자체 금고로 선정되면 공신력을 얻는 등 TV 광고보다 더 큰 홍보 효과를 누리기 때문에 경쟁에 뛰어드는 것”이라고 설명했다.어떤 업계보다 실익을 따지는 은행권에서 단순히 영예를 얻기 위해 시금고 사업에 뛰어든다고 보기는 어렵다. 전문가들은 시금고로 지정되면 산하기관을 비롯해 공무원과 가족 등을 고객으로 확보할 수 있다는 점에서 잠재적 이익이 상당하다고 지적한다. 정대걸 법률사무소 로바인 대표는 “실익이 없다는 말은 거짓이다. 수천억 원에 이르는 출연금 이상의 수익이 발생하기 때문에 은행들이 출혈경쟁을 벌이는 것”이라며 “일단 지자체 금고은행이 바뀌면 소속 공무원들은 급여통장부터 바꾸는데 은행은 부도 위험 0%인 우량 고객을 앉아서 받는 셈이다. 상품만 잘 끼워 팔아도 영업이익이 상당하다”고 말했다.또한 시금고 은행으로 지정되면 지자체의 신규 사업을 수주하는 데도 유리한 조건에 선다. 실제로 신한은행은 최근 4년간 서울시 금고를 운영하며 1000억 원을 투입해 전산시스템을 구축했고, 이를 통해 쌓은 운영 노하우를 발판으로 다양한 서울시 수익사업을 수주했다.지난해 11월 신한은행과 신한카드는 서울시가 발행하는 서울사랑상품권 운영사업자에 뽑혀 1월 24일 ‘서울pay+’ 앱을 출시하고 판매부터 결제, 정산까지 담당하고 있다. 또 신한은행은 지난해 12월부터 서울시 공공 애플리케이션 서울지갑 내 ‘이사온’에 비대면 전세자금대출 서비스를 연계 제공하고 있다. 이와 관련해 정 대표는 “신한은행은 서울시의 신사업 추진에 즉각 발맞춰 대응하면서 수익사업을 확대했다. 이는 금고은행만이 누릴 수 있는 혜택인 셈이다. 다른 은행들이 이번 서울시 금고 입찰에 사활을 거는 요인으로 작용할 것”이라고 말했다.출연금 상한선 없어… 평가 항목 개선해야서울시는 3월 2023년부터 4년간 서울시 예산과 기금 관리를 맡길 금고은행을 선정할 예정이다. [뉴스1]이런 가운데 신한은행은 재선정을 노리고 준비 작업에 돌입했다. 지난해 신한은행은 연말 임원 인사에서 기관영업 베테랑으로 꼽히는 박성현 부행장을 기관그룹장으로 선임했다. 박 부행장은 2017년 7월부터 1년 2개월 동안 기관고객부장으로 일하며 2018년 신한은행이 서울시 1금고를 유치할 때 주도적 역할을 한 인물이다. 신한은행 관계자는 “4년간 서울시 금고 운영에 많은 자금과 인력이 투입됐기 때문에 재유치가 필요한 상황”이라고 밝혔다.이번 서울시 금고 입찰의 경우 평가 기준이 4년 전과 달라져 전과 같은 전략으로는 승부를 보기 어려울 것이란 전망이 나온다. 평가 기준에서 협력사업비 배점이 기존 4점에서 2점으로 낮아져 은행들이 출연금 베팅으로 점수를 높이는 것에 회의적일 수 있다. 또 금리 배점이 15점에서 18점으로 높아져 각 은행이 최고 수준의 금리를 제시할 것으로 예상되지만, 큰 차이가 없을 것으로 보여 당락을 가르는 변수로 작용하기 어렵다.경영과 협업 역량 측면에서도 평가 기준이 달라졌다. 금고업무 관리 능력 배점이 19점에서 22점으로, 자치단체 자율 항목 배점이 9점에서 11점으로 높아졌다. 이에 따라 신한은행은 2018년과 같이 대규모 출연금으로 협력사업비 점수를 높이기보다는 4년 동안 쌓은 금고업무 노하우와 서울시에 기여해 온 실적을 바탕으로 입찰에 나설 것이라는 관측도 나온다. 신한은행 관계자는 “공개입찰이기 때문에 전략을 밝힐 수 없다”면서도 “서울시 금고은행으로서 역량을 잘 살려서 이번에도 선정되도록 총력을 기울이고 있다”고 말했다.일각에서는 평가 항목이 달라지지 않는 한 시중은행의 출연금 베팅은 계속될 것이란 우려 섞인 목소리도 나온다. 평가 항목에서 배점이 조정됐지만 금리나 업무 능력 등은 대동소이한 수준이기 때문에 결국은 은행들이 출연금 베팅에 사활을 걸 수밖에 없는 구조라는 지적이다. 김득의 금융정의연대 공동대표는 “결국 당락에 영향을 미치는 것은 출연금이다. 은행 내부적으로는 적자가 예상돼도 ‘제 살 깎아 먹기’ 식으로 출혈경쟁을 벌이는데 결국 은행 재정건전성이 문제가 될 수 있다”고 말했다.출연금 상한을 규정하지 않고, 출연금 액수에 비해 징계 수준이 낮은 것도 문제점으로 지적된다. 행정안전부가 2019년에 발표한 금고지정 평가항목 및 배점기준 개선안에는 협력사업비의 상한선을 규정하는 내용은 없다. 다만 전년 대비 출연 규모가 20% 이상 증액되면 보고하도록 하고, 행정안전부는 조치가 필요한 경우 금융 당국에 협조를 요청할 계획이라고 명시돼 있다.이에 따라 평가 항목을 개선하고, 평가 점수를 외부에 공개해 투명성을 높여야 한다는 지적도 나온다. 김 대표는 “출연금 상한선이 없고, 3000억 원에 대한 과징금이 21억 원 정도밖에 되지 않으니 은행의 과당경쟁은 계속 우려될 수밖에 없다”며 “ESG 경영 실적 가산이라든지, 징계나 채용 비리 관련 감점이라든지 평가 항목을 개선하는 방향으로 나가야 한다. 또 형식적으로 배점하는 것이 아니라 결과에 따른 가감 요인을 외부에 공개하도록 해 심사위원들이 신중한 판단을 하게끔 제도를 개선할 필요가 있다”고 말했다."
2022.02.28.,"우리금융, 은행장 내정 이어 지주·은행 임원인사 단행",url없음,<네이버 기사 없음>
2022.02.25.,"우리금융, 지주 및 은행 임원인사 단행",https://n.news.naver.com/mnews/article/018/0005155342?sid=101,"[이데일리 노희준 기자] 우리금융지주(316140)(회장 손태승)가 25일 은행 및 지주 임원 인사를 단행했다. 미래성장분야 육성, 디지털 및 ESG 역량 강화 및 그룹 시너지 확대 등이 키워드다.먼저, 우리금융은 미래성장동력 강화를 위해 1966년생인 우리은행 전상욱 부행장보를 지주 미래성장총괄 사장으로 발탁했다. 또한, 그룹 디지털전략 전담 임원(CDO)으로 글로벌 컨설팅사 출신의 전략 및 디지털 전문가인 1974년생 옥일진씨를 영입했다.특히, 우리은행은 차세대 리더그룹 양성의 일환으로 유도현 본부장을 경영기획그룹장으로, 전성찬 지점장을 본부장 승진 후 경영지원그룹장으로 임명했다. 아울러 동부영업본부를 이끌며 영업실적을 거둔 송현주 영업본부장을 투자상품전략단 임원으로 기용했다. 한편, 우리금융그룹은 ESG경영을 고도화하고 금융의 사회적 역할 강화 요구에 부응하기 위해 ESG부서를 지주에는 전략부문에, 은행에는 경영기획그룹에 각각 편제해 경영전략과의 연계성을 강화하기로 했다. 동시에 3월 주총에서는 ESG분야에 전문성을 갖춘 젊은 여성 변호사를 사외이사로 영입한다는 계획이다.아울러 영업력 강화를 위해 우리은행 박화재 부행장을 지주 사업지원총괄 사장으로 선임했다. 박 부행장은 그룹사 간 시너지 극대화는 물론, 자산운용·연금·글로벌·CIB 등 핵심사업 분야의 성과를 끌어올릴 계획이다. 이와 함께 은행에서는 지방 소재 기관 및 공기업,  중견기업 등 주요고객을 적극 유치하기 위해 충청·호남·경북·경남 등 4개 권역으로 나눠 지역총괄본부를 신설하고 지역그룹장들을 배치했다. 우리금융 관계자는 “신임 은행장과 더욱 강력한 원팀 시너지 창출은 물론, 과감한 세대교체를 단행했다”며 “앞으로 있을 부서장 및 팀장급 후속  인사에서도 발탁인사를 확대 실시해 그룹의 활력을 제고하고 변화와 혁신도 강력히 이끌어 갈 것”이라고 말했다."
2022.02.25.,[인사] 우리금융·우리은행,https://n.news.naver.com/mnews/article/001/0013013973?sid=101,우리금융그룹    <사장>(승진)    ▲ 사업지원총괄 박화재 ▲ 미래성장총괄 전상욱    <수석부사장>(승진)    ▲ 감사부문 신민철    <부사장>(승진)    ▲ 전략부문 박종일 ▲ 재무부문 이성욱 ▲ 준법감시인 우병권    <부사장>(보임)    ▲ IT부문 노진호    <전무>(승진)    ▲ 경영지원부문 이종근    <상무>(승진)    ▲ 브랜드전략실 송태정    <상무>(신임)    ▲ 디지털부문 옥일진  우리은행    <집행부행장>(승진)    ▲ 개인/기관그룹 박완식 ▲ 자금시장그룹 강신국 ▲ IT그룹 고정현 ▲ 준법감시인 김정록    <집행부행장>(보임)    ▲ 영업총괄그룹 이석태 ▲ 기업그룹 조병규 ▲ 리스크관리그룹 정석영 ▲ 브랜드홍보그룹 황규목    <집행부행장보>(승진)    ▲ 부동산금융단 심기우 ▲ 자산관리그룹 조영수 ▲ 투자상품전략단 송현주 ▲ 글로벌그룹 윤석모 ▲ 정보보호그룹 김백수 ▲ 여신지원그룹 성윤제 ▲ 경영기획그룹 유도현    <집행부행장보>(보임)    ▲ 외환사업단 김응철 ▲ 금융소비자보호그룹 정연기    <집행부행장보>(신임)    ▲ 디지털전략그룹 옥일진    <지역그룹장>(보임)    ▲ 충청지역총괄본부 김창현 ▲ 경남지역총괄본부 이효환 ▲ 경북지역총괄본부 이상철 ▲ 호남지역총괄본부 문흥식    <본부장>(승진)    ▲ 경영지원그룹 전성찬    <영업본부장>(보임)    ▲ 동부영업본부 이명수    <본부장>(보임)    ▲ 검사실 송유수 ▲ 문정중앙영업그룹(겸 문정중앙금융센터) 전재화 (서울=연합뉴스)
2022.02.28.,"우리은행, 사설인증서 개발 박차…S/W 사업공고",url없음,<네이버 기사 없음>
2022.02.28.,"가세연 ""朴 달성사저, 박지만이 마련? 100% 거짓말…우린 은행빚까지 냈다""",https://n.news.naver.com/mnews/article/421/0005935822?sid=102,"박근혜 전 대통령이 퇴원 후 정치적 고향인 대구에서 생활하기 위해 25억원을 주고 달성군 유가읍 쌍계리에 마련한 사저.  © News1 공정식 기자(서울=뉴스1) 박태훈 선임기자 = 유튜브 채널 가로세로연구소(가세연)는 박근혜 전 대통령의 대구 달성 사저를 마련해 준 주인공에 대해 묘한 말을 했다.박 전 대통령 남동생 박지만 EG회장은 결코 아니라면서 누군지 말할 순 없지만 그동안 가세연이 사저 마련을 위해 은행빚까지 낸 사실을 강조, 알아서들 해석 하라고 했다.강용석 변호사와 함께 가세연을 운영하고 있는 김세의 대표는 28일, SNS를 통해 ""내곡동 사저 경매 때 큰 이자를 감수하고 은행대출을 받아 36억 2200만원을 준비했었다""며 ""쌍방울 때문에 내곡동 사저가 좌절됐지만 저와 강용석 소장은 반드시 박 대통령 거처를 마련하겠다고 여러분들께 약속했다""고 소개했다. 그런데 ""요즘 코인팔이 세력들이 박지만 EG회장이 박근혜 대통령의 달성 사저 비용을 마련했다고 소문을 퍼뜨리고 있다""며 ""이는 명백한 허위사실이다""고 목소리를 높였다. 김 대표는 ""이쯤 되면 박지만 회장이 직접 나서서 진실을 밝혀야 한다""며 박 회장에게 '박 전 대통령 달성 사저를 마련해 준 이는 내가 아니다'라는 사실을 밝힐 것으로 요구했다.또 김 대표는 ""달성 사저 문제는 저와 강용석 소장이 직접 밝히는 것은 예의가 아니다""며 ""박 대통령이 직접 밝히실 때가 머지않아 올 것으로 생각한다""고 지적했다.이어 ""박근혜 대통령은 현재 재산이 전무한 상태로 누군가 대통령을 위해 적극 나서야 했지만 진짜로 아무도 없었다""며 ""정말 천벌을 받을 것""이라고 격분했다.그러면서 ""가세연은 여러분들과 약속을 어긴 적이 단 한번도 없다""며 박 전 대통령 사저마련 약속을 상기시켰다.박 전 대통령이 퇴원 후 머물 대구 달성사저는 지난 17일자로 매입대금 25억원 전액과 취득세 3억원 납부절차를 완료, 박 전 대통령 소유가 됐다."
2022.02.26.,"우리금융, 지주·은행 임원인사 및 조직개편 단행",url없음,<네이버 기사 없음>
