기사날짜,기사제목,네이버 뉴스 url,기사내용
2022.02.18.,“美·이란 핵합의 초안에 韓 동결자금 70억 달러 해제 포함”,https://n.news.naver.com/mnews/article/020/0003411963?sid=104,"하산 로하니 이란 대통령(오른쪽) ‘이란 핵 기술의 날’ 수도 테헤란에서 열린 핵 성과 전시회에 참여해 나탄즈 핵시설에서 시범 가동할 개량형 원심분리기를 살펴보고 있다. 이란 대통령실이란이 미국 등 6개국과 맺은 핵 합의 복원 협상 타결이 임박한 것으로 알려졌다. 이란은 우라늄 농축 농도를 단계적으로 낮추고, 미국은 한국에 묶여 있는 이란의 원유수출 대금을 풀어준다는 내용이 합의안 초안에 포함된 것으로 전해졌다.  로이터통신은 17일(현지 시간) 20여 쪽에 이르는 당사국 간 합의문 초안에 미국과 이란 양측이 이란 핵 합의(JCPOA·포괄적 공동행동계획) 준수를 위해 단계적으로 취해야 할 조치들이 포함됐다고 보도했다.   이 합의문에는 한국에 동결된 이란의 원유수출 대금 70억 달러(약 8조 3720억 원)를 해제한다는 내용이 담겼다. 이란은 미국의 제재로 달러 송금이 어려워지자 2010년 우리은행과 IBK기업은행에 원화 계좌를 개설해 원유 수출 대금을 받아왔다. 이란산 원유 수입 대금을 이 계좌에 예치한 뒤 이란에 수출하는 국내 기업들이 해당 계좌에서 수출물품 대금을 가져가는 방식이다. 하지만 미국이 2019년 이란 제재를 복원하면서 이 계좌가 동결됐다.   이란은 이 돈을 돌려달라고 한국 정부에 강하게 요구해 왔다. 지난해 1월 이란이 걸프 해역에서 해양오염을 이유로 한국 선박을 나포한 것도 실제로는 동결 자금에 대한 불만과 연관돼 있다고 한국 정부는 보고 있다. 정부는 이 문제 해결을 위해 이번 핵 합의에 동결 자금 해제를 포함시키는 방안을 미국과 논의한 것으로 알려졌다.   이번 이란 핵 합의문 초안에는 이란이 5%를 초과하는 우라늄 농축을 중단하는 방안이 포함된 것으로 전해졌다. 이란은 2015년 미국 등 유엔 안전보장이사회 상임이사국 5개국 및 독일 등 6개국과 이란의 우라늄 농축 수준을 3.67% 이하로 제한하는 대신 경제 제재를 완화하는 내용의 핵 합의를 맺었다. 하지만 도널드 트럼프 전 미국 행정부가 2018년 핵합의에서 탈퇴했고 이란은 이에 반발해 우라늄 농축 수준을 핵무기 개발이 가능한 수준인 60%까지 끌어올렸다.    합의문 초안에는 이밖에도 이란에 억류된 서방 인사들을 석방하는 내용도 포함되어 있다고 로이터통신은 보도했다.  핵 합의 최종 타결도 임박한 것으로 전해졌다. 미국 국무부 대변인은 이날 AFP통신에 “지난주에 협상에 상당한 진전이 있었다”며 “이란이 진정성을 보인다면 며칠 안에 JCPOA의 완전한 이행을 위한 합의에 도달할 수 있을 것”이라고 밝혔다.   앞서 16일 이란 측도 핵 합의 복원 협상 타결이 임박했다고 확인했다. 미국과 이란의 핵협상이 속도를 내게 된 것은 최근 우크라이나 사태가 계속 확산되는 가운데 미국이 중동 지역에서라도 긴장의 ‘뇌관’을 빨리 제거하려는 시도를 한 것으로 풀이된다. 다만 이란이 미국에 행정부의 약속 외에 의회 차원의 승인 절차도 요구하고 있어 막판 합의의 변수로 작용하고 있다.  최근 우크라이나 전쟁 위기로 급등세를 보이던 국제유가는 이란 핵 합의에 대한 긍정적인 전망이 나오면서 다시 내림세로 전환했다. 이날 뉴욕상업거래소에서 서부텍사스산원유(WTI)는 2.0% 내린 배럴당 91.76달러에 마감했다."
2022.02.21.,"'윤석열 저격수' 안철수 ""핀트 못 잡으신 것 같다"" … 거듭 압박",https://n.news.naver.com/mnews/article/417/0000787579?sid=100,"21일 윤석열 국민의힘 대선 후보와 안철수 국민의당 대선 후보가 TV토론에서 격돌했다. 사진은 안철수 국민의당 대선 후보와 윤석열 국민의힘 대선 후보가 서울 마포구 상암동 MBC 공개홀에서 열린 중앙선거방송토론위원회 주관 제20대 대통령 선거 후보자 초청 토론회 시작에 앞서 인사하는 모습. /사진=장동규 기자야권 단일화가 결렬된 가운데 안철수 국민의당 대선 후보가 ""질문 핀트를 못 잡으신 것 같다"", ""깊이 고민을 안 하신 것 같다"" 등의 발언으로 윤석열 국민의힘 대선 후보의 부족한 경제 지식을 꼬집었다.안 후보는 21일 저녁 8시 서울 마포구 상암동 MBC에서 열린 중앙선거방송토론위원회 주관 제20대 대선 후보 1차 토론회에서 윤 후보의 답변을 끊는 등 이전 토론과는 다른 태도를 보였다.이날 안 후보는 신종 코로나바이러스 감염증(코로나19) 추가경정예산(추경) 관련 질문으로 윤 후보를 곤혹스럽게 했다. 안 후보는 ""현재 한국은행이 금리를 올리고 있는데 우리 정부는 확장 재정으로 추경을 하고 있다""며 ""금리를 올리면서 확장 재정을 하면 금리 인상 효과가 상쇄되기 때문에 또 금리를 올려야 한다. 왜 이런 상황이 우리나라만 생겼다고 생각하느냐""고 물었다.이에 윤 후보는 ""원래 재정이나 금융이나 확장할 때 같이 확장하고, 긴축할 때는 (같이) 긴축하는 것이 정상인데 지금의 재정 확장은 임의적인 재량 재정이라기보다는 코로나19 손실 보상이라고 하는 법상의 의무를 국가가 지는 부분이라 불가피한 측면이 있다""고 답했다.이어 ""미국에서도 소위 '테이퍼링'(양적 완화 정책 점진 축소)이라고 하는 긴축을 하면서 장기이자율만 아니라 단기이자율까지 상승하기 때문에 우리나라도 이게 불가피한 측면이 있다""며 ""우리 한국은행이나 재정당국에서 여러 물가 관리나 담보대출의 실수요자에 대해 피해가 가지 않게 잘 관리해야 한다""고 주장했다.이에 안 후보는 ""지금 핀트를 못 잡고 계신 것 같다""며 윤 후보를 압박했다. 이어 ""재정을 확장하면서 재정 건전성도 확보하는 방법이 있는지를 묻는 것""이라고 재차 질문했다. 안 후보의 질문에 윤 후보는 ""무슨 일반적인 해답은 없고 우리 시장과 가계가 부담을 느끼지 않도록 미세한 대책이 필요하다""고 답변하자 안 후보는 ""아마 깊이 고민을 안 하신 것 같다""고 거듭 강하게 말했다.안 후보는 ""코로나19가 확산될 때마다 계속 추경으로 땜질하는 것은 굉장히 비상식적이고 국가재정을 누더기로 만드는 일""이라며 ""그래서 제가 코로나19 특별회계 이야기를 한 것""이라고 말했다. 이어 ""사실 거대 양당 모두 책임이 있다""며 ""제1야당에서 고민이 부족한 것 아닌가 싶다""고 윤 후보를 비판했다.안 후보는 윤 후보가 강조하는 '디지털 데이터 경제'에 대해서도 물었다. 안 후보는 ""아까 디지털 데이터 경제라고 말하셨는데 윤 후보가 생각하는 디지털 데이터 경제가 무엇이냐""라고 질문했다.이에 윤 후보는 ""지금은 디지털 기기들이 전부 서로 연결돼 있으면서 정보 데이터들이 물 흐르듯 흐르고 있다""며 ""이 속도를 더 빠르게 해야만 자율주행 자동차라든지 이런 4차 산업혁명의 총아를 만들어낼 수 있다는 이야기""라고 답했다.안 후보는 재차 ""그럼 그중 제일 핵심이 무엇이냐""고 물었다. 이에 윤 후보는 ""데이터들이 신속하게 움직이고 이동할 수 있는 그런 네트워크를 구축하고 이것이 전부 클라우드에 모여서 집적하고 분석할 수 있는 인공지능(AI) 알고리즘이 중요하다고 생각한다""고 주장했다. 그러자 안 후보는 ""그건 전부 하드웨어 쪽이지 데이터나 인프라 쪽은 아니다""고 지적했다."
2022.02.22.,박정운 한국외대 12대 총장 취임,url없음,<네이버 기사 없음>
2022.02.28.,국내기업들 對러시아 무역 年33조…결제 막혀 피해 우려,https://n.news.naver.com/mnews/article/020/0003413568?sid=101,"[러, 우크라 침공]서방 제재로 무역거래 차질 예상…금융망 퇴출 러 은행 범위에 촉각무역협회에 中企 애로상담 줄이어정부, ‘대체 결제’ 지원 방안 모색미국을 비롯한 서방 국가들이 러시아를 국제 금융 거래망에서 퇴출시키는 초강력 제재안을 꺼내 들면서 러시아와 거래하는 한국 기업들의 수출입대금 결제와 현지 교민들의 송금이 중단될 것이라는 우려가 커지고 있다. 정부와 금융당국은 러시아 은행들의 퇴출 범위에 촉각을 곤두세우고 국내 기업들의 러시아 무역 거래에 차질이 발생하지 않도록 ‘대체 결제’를 지원할 방침이다. 27일 한국무역협회 등에 따르면 러시아 현지와 원자재 및 부품 등을 거래하는 국내 중소업체들은 이미 수출입대금 결제에 어려움을 겪고 있다. 홍콩 무역업체를 통해 러시아산 펄프를 수입하는 A사는 국내 은행 4곳에서 수입 업무에 필요한 신용장 개설을 거부당했다. 러시아가 우크라이나를 침공한 뒤 국내 은행들이 러시아와 관련된 수출입 서류 인수 등의 업무를 중단했기 때문이다. 러시아로 자동차 부품을 수출하는 B사는 외환 거래가 막혀 현지에서 결제대금을 받지 못할까봐 우려하고 있다. 26일까지 협회 긴급대책반에 접수된 기업들의 애로사항 35건 가운데 대금 결제와 관련된 내용이 15건이었다. 러시아 은행들을 국제은행간통신협회(SWIFT·스위프트) 결제망에서 퇴출하는 제재가 본격화되면 국내 기업들의 피해는 더 커질 것으로 우려된다. 지난해 대(對)러시아 무역 규모는 273억 달러(약 32조6000억 원)에 이른다. 국내 조선사들이 러시아에서 선박 등을 수주한 규모도 약 12조 원으로, 수주대금 정산에 차질을 빚을 것이라는 우려도 나온다. 러시아 현지 유학생이나 주재원들의 국제 송금에도 제약이 생길 것으로 보인다. 지난해 신한 하나 우리 NH농협은행 등 국내 주요 시중은행을 통해 러시아 유학생, 주재원에게 송금된 자금은 624만7438달러(약 75억 원)다. 한 은행 관계자는 “SWIFT가 아닌 다른 결제망을 통해 송금할 방법은 있지만 하루 송금액이 제한돼 불편함이 따를 것”이라고 했다. 정부와 금융당국은 러시아 은행의 SWIFT 퇴출 범위에 따라 국내 기업과 국민에 미칠 파장이 크게 달라질 것으로 보고 서방 국가의 결정을 예의주시하고 있다. 정부는 27일 우크라이나 사태 비상대응 태스크포스(TF) 회의를 열고 러시아의 금융 거래가 차단되면 국내 기업들이 대체 계좌를 통해 무역대금을 결제할 수 있도록 관계 외교당국과 적극 협력하기로 했다.  현재 이란도 서방 국가의 금융 제재로 거의 모든 금융사가 SWIFT 결제망에서 퇴출돼 달러화 결제가 막혀 있다. 이에 따라 국내 기업들은 우리은행과 IBK기업은행이 이란 중앙은행 명의로 만든 원화 대체 계좌를 활용해 무역대금을 결제하고 있다. 금융당국 관계자는 “이란과 달리 러시아는 일부 은행만 제재 대상에 포함될 것”이라며 “제재 대상에 포함되지 않은 현지 은행을 통해 무역대금을 주고받을 수 있을 것으로 예상된다”고 했다. 아울러 정부는 ‘해외직접제품규칙(FDPR)’ 등 러시아 수출통제 참여를 논의하기 위해 다음 달 초 미국과 협의에 나서기로 했다. 미국이 24일(현지 시간) 발표한 러시아 수출통제 조치에 FDPR가 포함돼 기업들은 한국에서 생산한 제품이라도 미국산 기술이나 소프트웨어를 활용했다면 러시아 수출 때 미국의 허가를 받아야 한다. 정부는 또 우크라이나 사태가 장기화하면 네온, 크립톤 등 반도체 제조 핵심 품목의 수급에 문제가 생길 수 있다고 보고 제3국을 통한 수입과 대체재 확보 등에 나서기로 했다."
2022.02.27.,"서울시, 우크라이나 평화기원 '평화의빛' 캠페인",url없음,<네이버 기사 없음>
2022.02.22.,"우리銀, 올 상반기 신입행원 공채 실시...""디지털 통합 인재 선호""",url없음,<네이버 기사 없음>
2022.02.27.,"서울시, 우크라이나 평화기원 '평화의빛' 캠페인",url없음,<네이버 기사 없음>
2022.02.24.,LG엔솔 상장에 1월 발행주식 6배↑… 금리 상승에 회사채 96.8% 증가,url없음,<네이버 기사 없음>
2022.02.22.,"우리銀, 올 상반기 신입행원 공채 실시...""디지털 통합 인재 선호""",url없음,<네이버 기사 없음>
2022.02.25.,"우리금융, 세대교체·파격승진 인사 단행...미래성장총괄 사장 신설",url없음,<네이버 기사 없음>
2022.02.27.,"오세훈 ""우크라이나 평화 기원…남의 일 같지 않다""(종합)",https://n.news.naver.com/mnews/article/421/0005934167?sid=102,"서울시청, 남산 서울타워 등에 평화 메시지 표출오세훈 서울시장. 2022.2.17/뉴스1 © News1 신웅수 기자(서울=뉴스1) 전준우 기자 = 오세훈 서울시장이 27일 우크라이나의 평화를 기원하며 ""북핵 문제와 미·중 패권 경쟁으로 언제라도 안보 위기에 처할 수 있는 우리나라 입장에서도 남의 일 같지 않다""고 말했다.오 시장은 이날 자신의 페이스북을 통해 ""러시아군의 우크라이나에 대한 공세가 점점 거세지고 있다""며 이같이 밝혔다. 오 시장은 ""수백년 동안 러시아, 폴란드, 오스트리아 등 강대국의 공격을 받으며 분열과 혼란을 반복했던 우크라이나의 역사는 외세의 침탈로 고통을 겪어야 했던 과거 한반도의 역사와도 비슷한 면이 있다""고 했다.그러면서 ""군사력의 규모 측면에서 러시아에 비해 열세로 보이지만, 용맹한 코사크 군대의 정신으로 끝가지 조국을 지켜 내려는 우크라이나 국민들과 젤렌스키 대통령, 시민군에 참여한 포로셴코 전 대통령의 모습에 가슴이 뭉클해진다""고 적었다. 오 시장은 ""서울시가 우크라이나의 수도 키예프시와 스마트시티 추진 등을 위해 활발하게 교류해왔고, 두 도시는 우호도시 협약도 추진 중이었다""며 ""서울시민 모두의 마음을 담아 우크라이나 국민들에게 위로를 전하고, 사태가 평화적으로 해결되기를 진심으로 바란다""고 강조했다. 한편 서울시는 뉴욕, 런던, 로마 등 전 세계 여러 나라의 랜드마크가 진행 중인 '평화의 빛' 캠페인에 동참하기로 했다. 이날 오후부터 시청 본관, 세빛섬, 서울로 미디어캔버스(우리은행 중림동 지점), 남산 서울타워에 파란색·노란색 조명으로 우크라이나를 위로하는 평화의 메시지를 표출할 계획이다.오 시장은 ""전쟁에 반대하고 평화를 기원하는 이번 '평화의 빛' 캠페인에 각계 각층의 동참을 요청드린다""며 ""우크라이나 국기를 상징하는 파란색과 노란색 불빛으로 우크라이나 국민에게 위로를 전하고 세계 평화 유지를 위한 메시지 확산에 적극 참여하겠다""고 말했다."
2022.02.22.,"LG, '글로벌 초거대 AI 생태계' 만든다",url없음,<네이버 기사 없음>
2022.02.20.,전직 금융인 110명 “文정권 금융감독 실패”...윤석열 지지선언,https://n.news.naver.com/mnews/article/374/0000276057?sid=100,"[지지 호소하는 윤석열 (창원=연합뉴스)]전직 금융지주 회장과 은행장 등 금융인 110명이 오늘(20일) 국민의힘 윤석열 대선후보 지지 선언을 했습니다.    이들은 오늘 오전 11시 여의도 국민의힘 당사에서 윤 후보에 대한 지지를 선언하며 ""문재인 정권하에서 처참하게 망가진 금융시장을 공정과 신뢰라는 원칙으로 바로 세우고자 하는 윤 후보의 금융정책 방향에 전적으로 동감한다""고 밝혔습니다.    참석자들은 성명서에서 ""(문재인 정권은) 금융감독의 실패로 라임, 옵티머스 같은 불량 펀드들이 생산 유통되는 것을 예방하지 못해 수많은 투자자의 손실을 불러왔다""며 ""디지털 금융이 활성화되고 가상자산 시장이 급속히 성장하고 있음에도 무정책, 무대응으로 일관해왔다""고 비판했습니다.        이들은 가계부채와 소상공·자영업자의 부채 문제 해결, 주택금융 장기 공급, 자본시장 선진화 등의 대책을 촉구했습니다.    지지자 명단에는 황영기 전 금융투자협회 회장, 이종휘 전 우리은행장, 민병덕 전 KB국민은행장, 김주하 전 NH농협은행장 등이 이름을 올렸습니다.      '대한민국을 사랑하는 전국 탈북민 연합회'도 전날 3만2천 명의 탈북민을 대표한다며 윤 후보 지지 선언을 했습니다.     이 단체는 ""(북한에 대한) 현 정권의 비굴한 태도에 과연 우리의 신변 안전을 맡겨도 되는지 의문이 들어 정권교체를 시급히 원한다""고 밝혔습니다."
2022.02.25.,"러, 우크라 군사행동 개시에…원달러 환율 상승 출발",https://n.news.naver.com/mnews/article/003/0011026842?sid=101,"[서울=뉴시스] 백동현 기자 = 코스피가 전 거래일(2719.53)보다 2.60%(70.73포인트) 내린 2648.80에 장을 마감한 24일 오후 서울 중구 하나은행 본점 딜링룸에서 딜러들이 업무를 보고 있다. 이날 코스닥지수는 전 거래일 대비 3.32%(29.12포인트) 하락한 848.21에, 원·달러 환율은 전 거래일(1193.6원) 보다 8.80원 급등한 1202.40원에 거래를 마쳤다. 2022.02.24. livertrent@newsis.com[서울=뉴시스] 류난영 기자 = 러시아군의 우크라이나에 대한 군사행동 개시로 안전자산 선호 심리가 이어지면서 원·달러 환율이 상승 출발했다.25일 서울 외환시장에서 원·달러 환율은 오전 9시 3분 현재 전 거래일(1202.4원) 보다 2.8원 오른 1205.10원에 거래 중이다. 이날 환율은 전 거래일 보다 2.6원 오른 1205.0원에 출발했다. 장 초반 1206.0원까지 오르면서 1210원 돌파를 시도 중이다. 1190원 대에서 등락해 왔던 원·달러 환율은 전날 블라디미르 푸틴 러시아 대통령이 우크라이나 내 군사작전을 선포했다는 소식이 나오자 장중 1200원을 돌파한 후 오름 폭을 되돌리지 못한 채 1202.4원에 마감했다.  러시아와 우크라이나를 둘러싼 긴장이 고조되면서 투자심리가 위축되는 등 안전자산 선호 심리가 커지고 있다. 24일(현지시간) 블라디미르 푸틴 러시아 대통령은 우크라에 대한 군사 작전을 개시, 동남북 3면에서 침공했다. 수도 키예프를 비롯해 주요 도시 곳곳에서 폭발과 미사일 공격이 보고됐고 양측에서 사상자가 발생했다.우크라 측은 이날 러시아군의 공격으로 57명이 사망하고 169명이 부상했다고 발표했다. 러시아군은 우크라 군사시설 83곳을 무력화했다고 밝혔다.              조 바이든 미 대통령은 이날 주요 7개국(G7) 정상들과 화상 회의를 개최한 뒤 러시아 은행 4곳과 푸틴 대통령의 측근을 제재 대상에 추가하고 러시아가 첨단 기술제품을 수입할 수 없도록 했다. 푸틴 대통령 개인에 대한 제재 가능성도 시사했다. 그러나 러시아 석유, 천연가스 산업에 대한 직접 제재는 없었다. 국제유가는 장중 100달러를 돌파했다. 24일 뉴욕상업거래소(NYMEX)에서 4월물 서부 텍사스산 원유(WTI) 가격은 전 거래일 대비 0.71달러(0.8%) 상승한 배럴당 92.81달러에 거래를 마쳤다. 장중 한 때 100.54달러까지 치솟았으나 이후 상승폭을 대부분 반납했다. 런던 ICE선물거래소에서 4월물 브렌트유는 전 거래일 보다 2.24달러(2.3%) 뛴 배럴당 99.08달러에 마감했다. 러시아가 우크라이나를 침공하면서 브렌트유는 장중 한때 105.79달러까지 치솟으면서 2014년 이후 7년 만에 최고치를 기록했다.  이날 뉴욕증권거래소(NYSE)에서 다우지수, 스탠더드앤드푸어스(S&P)500 지수, 나스닥 지수 등 3대 주요 지수 모두 상승마감했다.다우존스 30 산업평균 지수는 전장 대비 92.07포인트(0.28%) 오른 3만3223.83에 거래를 마쳤다. S&P 500 지수는 63.20포인트(1.50%) 상승한 4288.70에 폐장했다. 기술주 중심의 나스닥 지수는 436.10포인트(3.34%) 뛴 1만3473.59에 장을 마감했다.같은 날 채권시장에서 미국 국채 10년물 금리는 전장보다 1.31% 하락한 1.97%대로 마감했다. 통화정책에 민감한 2년물 국채금리는 전장보다 1.99% 하락한 1.57%대로 마감했다.민경원 우리은행 연구원은 ""서방 국가의 러시아에 대한 제재가 우려만큼 강력하지 않다는 인식에서 투자 심리가 회복을 보이면서 오늘 환윻은 1199~1207원선을 등락할 것으로 보인다""며 ""다만 러시아의 우크라이나 침공으로 시장의 투기심리가 극도로 예민해져 있어 변동성 확대는 불가피할 것""이라고 말했다．"
2022.02.16.,"조폐공사, 국립공원 기념주화 3종 출시…17일부터 예약",https://n.news.naver.com/mnews/article/003/0011007048?sid=102,"기사내용 요약가야산·변산반도·오대산 등 3종3월 10일까지 예약 접수[대전=뉴시스] 2022년 한국의 국립공원 기념주화 이미지. *재판매 및 DB 금지[대전=뉴시스] 김양수 기자 = 한국조폐공사는 가야산과 변산반도, 오대산등 3개 국립공원을 주제로 하는 '한국의 국립공원 기념주화'를 출시한다고 16일 밝혔다.주화의 앞면에는 각 국립공원의 특성을 담은 경관을, 뒷면에는 해당 국립공원을 대표하는 동·식물(깃대종)을 담아 자연환경의 아름다움과 생태 보전의 중요성을 알린다.17일부터 다음달 10일까지 조폐공사 온라인 쇼핑몰, 전국 NH농협은행, 우리은행 창구와 홈페이지 등에서 예약 접수를 받는다. 모두 직경 35㎜, 중량 23g, 순도 99.9%인 은(Ag)으로 제작된 채색주화다. 발행량은 화종별 각 7000장이고 액면가는 5만원이다.판매가격은 1종 단품은 각 6만 2500원이며 3종 세트는 18만 2500원이다. 조폐공사는 지난 2017년 한국의 국립공원을 주제로 첫 기념주화를 선보여 오는 2023년까지 7년에 걸쳐 시리즈로 매년 2~4종을 출시할 예정이다. 올해까지 발행된 국립공원 기념주화는 19종으로 ▲첫해인 2017년 지리산·북한산 ▲2018년 덕유산·무등산·한려해상 ▲2019년 속리산·내장산·경주 ▲2020년 계룡산·월악산·태안해안·한라산 ▲2021년 소백산·태백산·다도해해상·주왕산 등이 출시됐다.국립공원 기념주화 판매는 선착순이 아닌 추첨식 예약제로 접수량이 발행량을 초과할 경우 무작위 추첨을 통해 당첨자가 결정된다．"
2022.02.24.,"주총 앞둔 금융지주, 회장교체·노조추천 이사 등 과제 '산적'",url없음,<네이버 기사 없음>
