기사날짜,기사제목,네이버 뉴스 url,기사내용
2022.11.06.,"[사전인터뷰] KGC인삼공사 고희진 감독 ""호흡 맞출 시간 부족, 앞선 두 경기에서 결과로 나와""",url없음,<네이버 기사 없음>
2022.11.15.,"‘어색한 6위·3G 연속 셧아웃 패’ 차상현 감독의 아쉬움 “강소휘, 슬럼프가 온 것 같다” [MK장충]",https://sports.news.naver.com/news.nhn?oid=410&aid=0000907122,<구조 다름>
2022.11.14.,"쿼타북, 스톡옵션에 관한 모든 것 알려주는 '스톡옵션 마스터 과정' 개최",url없음,<네이버 기사 없음>
2022.11.10.,"소진공, 소상공인 대환대출 지원대상 및 대상채무 확대 실시",url없음,<네이버 기사 없음>
2022.11.14.,"KB리브엠·LG헬로·스테이지파이브, 내년부터 전파사용료 전액 다 낸다",url없음,<네이버 기사 없음>
2022.11.09.,'크립토 백기사'의 몰락..가상자산 혹한 이어지나,https://n.news.naver.com/mnews/article/014/0004925736?sid=105,"FTX CEO인 샘 뱅크맨 프라이드. ⓒ 로이터=뉴스1 ⓒ News1 박형기 기자 /사진=뉴스1 [파이낸셜뉴스] 세계 최대 가상자산 거래소인 바이낸스가 유동성 부족 사태에 내몰린 세계 3위 가상자산 거래소 FTX 인수를 추진하고 나서자 전 세계 가상자산 업계가 충격에 휩싸인 모습이다.   '가상자산 혹한기' 속에 '백기사' 역할을 자처했던 샘 뱅크먼 프리드 FTX 최고경영자(CEO)가 한 순간에 몰락하면서 '가상자산 시장의 취약성이 생각보다 심각한 것 아니냐'는 위기감이 확산되고 있다. 일각에서는 FTX가 발행하는 FTX토큰(FTT) 가격이 80% 이상 폭락한 것과 관련, ‘제2의 루나 사태’가 발생하는 것 아니냐는 우려도 커지고 있다.    ■FTX 유동성 위기에 수일만에 무너진 '크립토 백기사' 장펑차오 바이낸스 대표는 9일 자신의 트위터 계정을 통해 ""심각한 유동성 부족 사태에 직면한 FTX가 우리에게 도움을 요청했다""며 ""투자자 보호 취지에서 FTX닷컴을 전량 인수하는 내용의 인수의향서(LOI)를 체결했다""고 밝혔다. 샘 뱅크먼 프리드 FTX CEO 역시 ""FTX닷컴의 첫 번째이자 마지막 투자자는 동일 주체""라며 ""바이낸스와 전략적 거래를 하기로 합의했다""고 말했다.   이번 인수 발표는 FTX가 '유동성 위기는 루머일 뿐'이라고 반박한지 하루가 채 지나지 않아 나온 것이다. FTX는 최근 관계사인 알라메다의 재정 부실설로 뱅크런 사태가 발생하면서 유동성 위기에 시달렸다. 지난 2일 가상자산 전문매체 코인데스크는 알라메다의 대차대조표를 입수해 자산의 대부분이 FTT로 채워져 있다고 보도한 바 있다.   이에 시장에서는 'FTX가 FTT를 발행하면 알라메다가 대부분 사주는 것 아니냐'는 해석과 함께 두 회사의 재정 부실로 이어질 수 있다는 우려가 번졌다. FTX와 알라메다는 모두 뱅크먼 프리드 CEO가 창업한 회사다. 이런 상황에서 FTX와 경쟁 관계에 있던 바이낸스가 결정적 한 방을 날렸다.   자오창펑 대표는 보도가 나온지 5일 만인 이달 7일 바이낸스가 보유한 FTT를 모두 팔겠다고 발표했다. 그러면서 자신의 결정은 ""최근의 폭로에 따른 것""이라며 FTX와 알라메다의 코인 거래 구조를 겨냥했다. 이 발표로 FTX에서 뱅크런이 벌어지자 뱅크먼 프리드 CEO는 ""거짓 루머""라며 반발했으나 FTX의 유동성 경색 현상은 더욱 심해졌다.   결국 뱅크먼 프리드는 자오창펑에게 백기를 들었고, 이날 바이낸스는 FTX 인수 추진을 발표했다.   가상자산 커뮤니티에서는 며칠 새 뱅크먼 프리드 CEO이 추락했다는 사실을 충격으로 받아들이고 있다. 어려움을 겪는 스타트업들에 투자하며 '백기사'를 자처했던 인물이기 때문이다. FTX의 벤처캐피털인 FTX벤처스는 앱토스랩스, 메사리, 스카이마비스, 레이어제로, 유가랩스, 1인치네트워크 등 다수 가상자산 스타트업에 투자한 것으로 알려졌다.    ■글로벌 가상자산 전반 취약성 우려 심화 이번 인수 발표 이후 주요 가상자산의 가격은 일시 반등했다가 인수 거래가 성사되지 않을 수도 있다는 불안감이 확산하면서 낙폭이 오히려 더 커졌다. 비트코인 가격은 인수 발표 직후 급반등하며 한때 2만달러를 회복했다가 1만7000달러 선까지 미끄러졌다. 글로벌 가상자산 중계 사이트 코인마켓캡에 따르면 지난 24시간 동안 가상자산들의 총 시가총액은 1조3000억달러에서 9150억달러로 11% 이상 감소했다.   자오창펑 대표는 이번 인수 추진과 관련 ""구속력이 없는 투자의향서""라며 ""매우 역동적인 상황에서 실시간으로 상황을 평가하고 있다. 바이낸스는 언제든 거래에서 손을 뗄 재량권이 있다""고 강조했다. 가상자산 분석업체 크립토컴페어는 ""자오창펑이 인수 거래에서 손을 뗄 경우 여전히 (FTX의 유동성) 문제가 불거질 수 있다""고 전망했다.   세계 3위 가상자산 거래소로 올해 초 320억달러 몸값을 평가받았던 FTX가 한순간에 무너졌다는 사실은 글로벌 가상자산 거래소들의 구조적인 취약성과 불안정성을 보여준다는 지적도 나온다. 미 증권거래위원회(SEC)의 전 집행 변호사인 존 리드 스타크는 ""가상자산 죽음의 소용돌이는 순식간에 시작될 수 있으며 매우 임박한 것처럼 보인다""고 경고했다.   이번 사태로 비트코인 등 가상자산 가격 하락세가 심해질 수 있다는 전망도 있다. 크립토컴페어는 ""올해 비트코인이 사상 최악의 손실을 기록할 수 있다""며 ""과거 약세장과 비교했을 때 비트코인은 아직 바닥에 도달하지 않았다""고 분석했다."
2022.11.09.,"""확장되는 공격표면, XDR이 답이다""",url없음,<네이버 기사 없음>
2022.11.08.,"""불황땐 자리 지키는게 최선""…고연봉자 이직시장 찬바람",https://n.news.naver.com/mnews/article/009/0005042054?sid=101,"이직 뚝 끊긴 여의도·판교얼어붙은 이직시장""올해 초 이직 제안이 오긴 했는데 흐지부지 끝이 났습니다. 7월 이후에는 증권가 이직 시장이 거의 사라진 상황입니다.""(A증권사 채권 담당 직원)""지난해 시장이 좋을 때는 세 군데서 이직 제안을 받았습니다. 올해 여름 이후부터는 주변에서 이직 제안을 받았다는 직원이 확 줄었습니다.""(B증권사 기업대출 담당 직원)올해 들어 세계적인 경기 침체 우려와 함께 국내에서는 레고랜드 채무불이행(디폴트) 사태로 금융권의 유동성 위기까지 등장했다. 이런 분위기 속에 고소득 직장인의 대명사로 불리던 여의도 금융·증권가 이직 시장이 얼어붙고 있다. 주식 시장이 활황일 때는 ""출근하면 옆자리 직원이 바뀌어 있더라""는 말이 통용될 정도로 활발했던 증권가 이직 시장이 빠르게 사그라든 것이다. 이는 증권가뿐 아니라 회계사, 변호사와 같은 고소득 직장인 전반으로 확산하는 모양새다. 이직을 포함한 채용 동향은 경기를 한발 늦게 반영하는 후행지표로 꼽히는 만큼 고소득 직장인의 이직 시장 한파는 당분간 이어질 것으로 전망된다.증권가는 이직률이 상당히 높은 직종으로 꼽힌다. 직장에 소속돼 있지만 주식이나 채권, 선물 등을 다루는 경우 수익률이 꼬리표처럼 따라붙어 실적이 좋은 직원들을 채용하려는 증권사 간 경쟁이 치열하다. 증권사에서 채권을 담당하는 한 직원은 ""국고채 거래와 같은 일부 직종의 경우 진입장벽이 높은 만큼 이직도 활발하다""며 ""시장이 좋을 때는 한 달 새 두 차례나 직장을 옮기는 직원도 종종 있었다""고 말했다.특히 코로나19 이후 경기 부양을 위해 저금리 시대가 열리면서 국내 증권 시장은 활황을 맞았다. 그만큼 이직도 늘어났다. 미래에셋증권에 따르면 이 회사의 이직률은 2020년 5.0%에서 지난해 6.0%로 늘어났다. 퇴직이 아닌 본인 스스로 직장을 나가는 자발적 이직률도 높아지는 경향을 보였다. 카카오뱅크나 토스와 같은 핀테크기업의 빠른 성장을 비롯해 비트코인, 이더리움과 같은 가상화폐 시장이 열린 것도 증권가의 이직이 확대되는 데 불을 지폈다. 하지만 올해 들어서면서 이 같은 추세가 빠르게 꺾이고 있다. 코스피 하락과 함께 하반기 들어서는 채권 시장까지 얼어붙는 유동성 위기가 닥치면서 증권사들이 이직 시장 문을 단단히 걸어 잠갔다. 증권사의 경우 인력이 곧 비용이다 보니 지금처럼 시장 유동성이 얼어붙은 상황에서는 채용을 최소화하는 경향을 보인다. 한 자산운용사 관계자는 ""대형 운용사 외에는 신입 채용도 내년부터 줄일 가능성이 상당히 커졌다""고 말했다.또 작년까지는 이직에 따른 연봉 인상과 사이닝보너스가 이직으로 발생할 손실(성과급 등)을 상쇄할 만큼 많았지만 올해는 이마저도 기대하기 힘들다. 증권사 관계자는 ""현업 부서의 경우 잘못 이직하면 부실 자산을 맡는 어려운 업무를 할 수도 있다""며 ""기본적으로 기존보다 채용도 많이 줄었고 직원들도 불확실한 시기이다 보니 이직을 보류하는 분위기가 생기고 있다""고 전했다.회계업계에도 퇴사자들이 사라지고 있는 분위기다. 업계 관계자는 ""최근 몇 년간 인수·합병(M&A) 시장의 활성화로 인해 금융권, 사모펀드(PEF), 벤처캐피털(VC) 등 분야로 회계사들의 이직이 활발했다""면서도 ""이들 업종의 상황이 이전보다 안 좋아지자 퇴사 후 이직의 움직임도 뚝 떨어졌다""고 분위기를 전했다. 실제로 A회계법인이 자체적으로 파악한 결과 이 회사의 7월부터 10월까지 퇴사자 수는 지난해 같은 기간 대비 절반 이하인 것으로 나타났다. C회계법인 관계자는 ""회계사가 진출해왔던 스타트업 등의 시장이 급격히 투자겨울을 맞이한 것도 퇴사율 하락에 영향을 준 것으로 보인다""고 말했다. B회계법인도 상황은 비슷하다. 지난해부터 올해 초까지 퇴사자 수가 세 자릿수를 기록했지만 올 3분기 이후에는 뚝 떨어졌다고 한다. D회계법인 관계자는 ""M&A를 맡는 딜 부문은 아예 PEF 등으로 이직하는 사례가 빈번했으나, 올해 7월 이후로는 이 부문의 이직·퇴사율이 5%포인트 낮아진 것으로 파악된다""고 전했다.로펌들도 취업난의 영향을 실감하고 있다. 지난해까지 활발하던 기업 사내 변호사 이직이 눈에 띄게 줄어든 모습이다. 법무법인 율촌의 이준희 변호사는 ""지난 3~4년 동안 급성장한 스타트업 회사들을 중심으로 3~9년 차 변호사에 대한 수요가 많았지만, 최근 들어서는 경기 불황과 취업난이 가시화하면서 법무 인력 수요가 줄었다""고 설명했다. 이어 ""젊은 변호사들이 이직하기보다는 로펌에서 '버텨야 한다'는 분위기가 확산되고 있다""고 덧붙였다."
2022.11.09.,'코인런' FTX 유동성 위기에 암호화폐 시장 또 '패닉' [코인 스캐너],https://n.news.naver.com/mnews/article/015/0004772624?sid=101,"FTX·알라메다 핵심 자산 FTT 80% 폭락 FTT 담보 코인·대출 줄줄이 부실 우려 ""루나·셀시우스 사태 재현될라""비트코인 2년 만에 최저치로 FTX 코인런 불붙인 바이낸스 ""FTX 인수""글로벌 암호화폐거래소 FTX가 촉발한 유동성 위기로 코인 시장이 또 한 번 폭락했다. 세계 1위 거래소 바이낸스의 최고경영자(CEO) 창펑 자오가 ""이용자 보호를 위해 FTX 인수 작업에 착수했다""고 밝혔지만 거래 성사에 대한 의구심이 제기되며 암호화폐 시장 전반이 흔들렸다.FTX의 자체 토큰인 FTT 가격은 80% 폭락했고 비트코인, 이더리움 등 주요 코인 가격도 하루 만에 10% 안팎 급락했다. 비트코인 가격은 1만9000달러 밑으로 다시 떨어져 약 2년 만에 최저 수준으로 내려앉았다. 업계에서는 이번 일이 테라USD·루나 사태, 셀시우스발 위기에 이어 또 한 번 시장 혼란을 가져올 수 있다는 우려도 나온다. FTX와 그 모회사 격인 헤지펀드 알라메다 리서치에 돈을 대줬거나 투자를 받은 곳들도 줄줄이 타격을 받을 수 있기 때문이다. FTX는 지난 사흘 사이 60억 달러(약 8조3000억 원)의 '코인런'을 겪고 모든 이용자의 암호화폐 출금을 중단했다. 9일 암호화폐 시황 사이트 코인마켓캡에 따르면 이날 오전 10시30분 기준 비트코인은 24시간 전보다 10.4% 하락한 1만8459달러에 거래됐다. 비트코인 가격이 1만8000달러대로 떨어진 것은 2020년 12월 이후 약 2년 만이다. 이더리움 가격도 24시간 만에 15.6% 급락해 1325달러에 거래됐다. 다른 알트코인(비트코인 이외 암호화폐)도 일제히 하락했다. 특히 FTX와 그 창업자 샘 뱅크먼프리드가 강력하게 지원해온 솔라나(SOL)는 24시간 만에 20.3% 급락했고, FTX벤처스의 투자를 받은 앱토스도 22.6% 떨어졌다. '파산' 셀시우스 닮은꼴 알라메다-FTX  FTT 80% 급락에 유동성 위기 일파만파FTX가 자체 발행하는 유틸리티 토큰 FTT는 76% 폭락했다. FTT는 이번 FTX발 유동성 위기의 핵심에 있는 토큰이다. 지난 2일 코인데스크는 알라메다의 내부 보고서를 인용해 ""알라메다의 대차대조표상 총자산이 대부분이 FTT로 채워져 있다""며 ""FTT를 담보로 많은 활동이 벌어지고 있다""고 보도했다. 게다가 알라메다가 보유한 58억 달러어치 FTT는 총 발행량의 80%로 알려졌다. 알라메다는 샘 뱅크먼프리드가 FTX를 창업하기 전에 설립한 헤지펀드다. FTX와 사실상 한 몸으로 여겨진다. 시장에서는 FTX가 FTT를 발행하면 알라메다가 그 대부분을 매입해 가격을 올리고, 대차대조표상 이익을 얻은 것처럼 꾸미는 식으로 몸집을 불려온 게 아니냐는 의혹이 제기됐다. 더욱이 알라메다는 그 FTT를 담보로 여러 곳에서 대출과 투자를 받았다. FTT의 가격이 무너지면 알라메다, FTX를 시작으로 줄줄이 부실이 번질 수 있다는 우려가 번진 것이다. 창펑 자오는 이 우려에 불을 붙였다. 그는 지난 5일 자신의 트위터를 통해 ""작년 FTX 지분을 매각하며 받은 21억 달러(약 2조9000억 원) 상당의 BUSD와 FTT 중에서 바이낸스 장부에 남아있는 모든 FTT를 청산하기로 했다""고 밝혔다. 이어 FTX와 알라메다의 FTT 거래 구조를 지적하며 ""루나 사태에서 배운 리스크 관리의 일환일 뿐""이라고 첨언했다. 바이낸스가 이미 5억8000만 달러 상당의 FTT 2300만 개를 이미 바이낸스 지갑에서 빼낸 것도 포착됐다. 샘 뱅크먼프리드 FTX 창업자.샘 뱅크먼프리드는 ""FTX는 괜찮다""며 시장 달래기에 나섰지만 효과는 없었다. 투자자들은 앞다퉈 FTX에서 자산을 빼내는 '코인런'에 나섰고, FTX가 인출 중단을 반복하며 파산 우려가 커졌다. 업계에서는 샘 뱅크먼프리드의 적극적인 정계 로비와 암호화폐 규제 찬성, FTX의 자체 스테이블코인 발행 시도 등에 자극을 받은 창펑 자오가 경쟁자 제거에 나선 것 아니냐는 해석도 내놓는다. 뱅크먼프리드는 루나·셀시우스 사태 이후 유동성 위기에 빠진 시장에 구제금융 역할을 자처하고 지분을 사들이며 업계 장악력을 높여왔다. 블록체인 업계의 한 관계자는 ""바이낸스가 오로지 리스크 관리만을 위해 FTT를 매도할 것이었다면 굳이 사전 예고를 날려 가격을 급락시킬 유인이 없다""며 ""FTT 붕괴를 통해 FTX를 약화시키는 것도 목적이었을 것""이라고 분석했다. 바이낸스 ""FTX 인수 착수""...법적 구속력 無창펑 자오 바이낸스 최고경영자(CEO).시장 혼란이 커지자 창펑자오는 8일(현지시간) 트위터를 통해 ""FTX에 중대한 유동성 경색이 발생했고 (바이낸스에) 도움을 요청했다""며 ""이용자를 보호하기 위해 FTX를 모두 인수하는 목적의 LOI(인수 의향서)를 작성했다""고 밝혔다. 하지만 이 LOI는 ""법적 구속력이 없는 것""이라며 바이낸스는 언제든지 이번 거래에서 손을 뗄 재량권이 있다고 강조했다. 불과 하루 전 ""FTX는 괜찮다""고 했던 샘 뱅크먼프리드도 ""현재 정리 작업 중이며 유동성 경색을 해결할 것""이라며 창펑 자오와 바이낸스에 감사를 표했다. 바이낸스의 '구조' 가능성에 비트코인 가격은 한때 2만 달러 위로 반등했다. 하지만 시장의 안도는 오래 가지 않았다. 양사의 인수 의향서에는 법적 구속력이 없으며, 설사 인수가 성사되더라도 상당한 장기전이 될 수밖에 없다는 점이 주목받으며 시장은 다시 하락 반전했다. 크립토컴페어의 데이빗 모레노 다로카스는 블룸버그에 ""인수 의향서에는 아무런 구속력이 없다""며 ""다른 이슈가 제기되면 창펑 자오와 바이낸스가 언제든 거래에서 발을 뺄 수 있다는 뜻""이라고 했다. 업계에서는 이 사태가 FTX와 알라메다의 부실에서 그치지 않을 것이란 우려를 내놓고 있다. FTT의 가격 급락이 계속되면 알라메다가 FTT를 담보로 받은 대출과 알라메다에 투자한 벤처캐피탈도 줄줄이 부실화할 수 있기 때문이다.가상자산 펀드인 아르카의 제프 도먼 최고투자책임자는 CNBC에 ""FTT 가격 하락이 이어지면 알라메다는 마진콜과 모든 종류의 압력에 직면하게 될 것""이라고 했다. 암호화폐 트레이딩업체 오안다의 에드 모야는 ""신뢰의 위기가 다시 왔다""며 ""암호화폐 업계 핵심 인물과 관련된 자산이 불안정해지면 위기가 시장 전반에 전염될 수 있다""고 지적했다."
2022.11.02.,"[포토] 김혜성, 추가실점 내주는 1루 송구",https://sports.news.naver.com/news.nhn?oid=076&aid=0003934356,<구조 다름>
2022.11.12.,"'상무 전역' OK금융그룹 전진선, 3연속 블로킹으로 현대캐피탈 셧아웃",https://sports.news.naver.com/news.nhn?oid=425&aid=0000134203,<구조 다름>
2022.11.11.,"[fn마켓워치] ‘최적경로 택배’ 운영사 브이투브이, 시리즈A 투자 유치…100억 규모",https://n.news.naver.com/mnews/article/014/0004926774?sid=101,"티비티 파트너스·휴맥스·스마일게이트·신용보증기금 등에서 95억원 투자버스 대중교통망 체계 택배에 적용 ‘대중물류망’ 활용, 최적경로 택배 서비스 제공  [파이낸셜뉴스]최적경로 택배 서비스 투데이(To-Day) 운영사 브이투브이가 95억원 규모의 시리즈A 투자를 유치했다고 11일 밝혔다.   기존 투자사인 티비티 파트너스(TBT), 휴맥스가 후속 투자를 이어갔고, 스마일게이트 인베스트먼트, 우미글로벌, 더웰스 인베스트먼트, 신용보증기금 등의 기관이 신규로 참여했다. 이로써 브이투브이는 2021년 4월 설립이래, 세번째 투자를 성공적으로 완료하며, 본격적인 서비스 확대에 나선다. 투데이(To-Day)는 기존 택배 업계에서 보편적으로 사용하는 전국단위 허브앤스포크(Hub&Spoke) 방식의 비효율적인 동선 문제를 ‘대중물류망’이라는 새로운 솔루션으로 해결한 택배 서비스이다. 대중물류망은 수도권 버스 대중교통망 체계를 택배 시스템에 적용해 물건이 메가허브(Mega Hub)를 경유하기 위해 먼 길을 돌아가지 않고, 최적경로로 빠른 시간 내에 배송이 가능하도록 설계됐다.   사람이 수도권 버스 대중교통망을 이용할 경우 몇 시간 내 수도권 어디든 도착하듯이, 투데이(To-Day)의 대중물류망을 이용하는 쇼핑몰의 물건들도 이와 유사한 경로로 이동해 주문한 당일에 대부분의 물건을 수령할 수 있는 방식이다.   브이투브이는 작년 설립 이래, 인천광역시 디지털 물류 서비스 실증 지원사업을 시작으로 Cafe24 패스트박스, 삼영물류, 롯데글로벌로지스, NS홈쇼핑, W쇼핑, 아모레퍼시픽, 블루박스(Apple 공식 인증 리셀러), 오즈키즈 등의 대형 고객사를 유치하는데 성공했다. 네이버 스마트스토어와도 배송 협력을 준비하고 있다.   후속 투자를 이어간 TBT 박진 심사역은 “구현하기 어려운 대중물류망이라는 네트워크를 고도화된 기술력으로 만드는 과정을 지켜보며 브이투브이의 잠재력에 주목했다”며 “투데이 서비스가 기존 물류 산업의 문제점을 해결하는 것은 물론 당일 배송 시장의 저변을 확대할 것으로 기대한다”고 언급했다.   브이투브이 권민구 이사는 “IT기술이 고도로 발달한 시대에 도시 외곽에서 도시 내부로 배송되는 물건을 메가허브를 경유하여 다음날 받을 이유가 전혀 없다”며 “대중물류망을 활용해 최적경로 택배를 최초로 구현한 것이 투데이 택배 서비스이며, 이번 투자를 통해 많은 고객사와 시민들이 혜택을 받을 수 있도록, 서비스를 빠르게 확대해 나가겠다”고 덧붙였다.   한편, 브이투브이는 물류 업계뿐 아니라 스타트업 업계에서도 이례적일 정도로 뛰어난 인재 밀도를 갖춘 조직이다. 네이버, 카카오, 토스(Toss), 크래프톤, 데브시스터즈, 타다(TADA) 등에서 경험을 쌓은 IT 전문 인력들과 롯데글로벌로지스, 한진, 쿠팡, 배달의 민족 등에서 경험을 쌓은 물류 전문 인력들이 조화를 이루고 있다. #택배 #시리즈A #최적경로택배 #브이투브이"
2022.11.09.,"다야몬즈, 모바일 게임 '하이큐!!' 사전예약 개시",https://n.news.naver.com/mnews/article/030/0003057652?sid=105,"하이큐!! TOUCH THE DREAM다야몬즈가 지홀딩스와 개발·서비스 계약을 체결한 '하이큐!! TOUCH THE DREAM'의 사전예약을 시작했다. 배구 소재 인기 스포츠 애니메이션 '하이큐!!' 지식재산권(IP)에 기반을 둔 모바일 게임이다.'하이큐!!'는 일본 고교 배구를 무대로 한 청춘 스포츠 만화다. 2012년부터 일본 만화 잡지 '소년 점프'에 연재되어 시리즈 누계 발행 부수 5500만부를 돌파한 인기 작품이다. 2014년 애니메이션화가 이뤄졌다. 정통 스포츠물의 재미와 독특한 개성과 매력을 가진 캐릭터로 두터운 팬덤을 형성하고 있다.'하이큐!! TOUCH THE DREAM'은 카라스노, 네코마, 아오바조사이 등 애니메이션 등장 캐릭터가 귀여운 3D SD캐릭터로 구현됐다. 서브, 리시브, 토스, 스파이크, 블로킹 등 스킬을 활용해 전략적이고 박진감 넘치는 경기를 즐길 수 있다. 연내 국내 정식 서비스 예정으로 지홀딩스가 판권 관리와 일본 서비스를, 다야몬즈가 게임 개발과 한국 및 아시아 지역 퍼블리싱을 맡았다.김동균 다야몬즈 대표는 “스포츠 애니메이션의 신드롬을 일으켰던 '하이큐!!'는 일본뿐만 아니라 국내에도 두터운 팬 층이 있는 매력적인 IP”라며 “원작의 주인공이 선보이는 가슴 뜨거운 도전과 감동의 순간을 게임에 담아 선보일 것”이라고 말했다."
