기사날짜,기사제목,네이버 뉴스 url,기사내용
2022.11.15.,"토스증권, 출범 21개월 만에 ‘분기 흑자’ 달성",https://n.news.naver.com/mnews/article/014/0004928491?sid=101,"3·4분기 영업이익 22억원, 당기순이익 21억원 토스증권 분기별 실적 / 사진=토스증권 제공[파이낸셜뉴스] 토스증권이 출범 2년이 채 안 되는 시점에 첫 분기 흑자를 달성했다. 지난해 말 선보인 해외주식 서비스가 주효했던 것으로 풀이된다.   토스증권은 15일 올해 3·4분기 영업이익과 당기순이익은 각각 22억원, 21억원으로 공시했다. 월 기준으로는 지난 8월 첫 흑자를 기록한 데 이어 이번 분기 실적으로도 이 같은 성과를 거둔 셈이다. 특히 회사 출범 1년 9개월 만에 이룬 성적이라 더욱 눈에 띈다.   3·4분기 매출 역시 전 분기 대비 40%, 전년 동기 대비 1950% 불어난 492억원을 기록했다.   특히 해외주식 서비스 매출이 전체 약 30%를 차지했다. 지난해 12월 서비스를 내놓은 이후 올해 1·4분기 37억원, 2·4분기 100억원, 3·4분기 130억원으로 꾸준한 성장세를 확인시켰다. 같은 기간 해외주식 거래대금도 6조2000억원, 10조6000억원, 13조5000억원으로 지속 증가했다.   약 500개 종목으로 시작한 해외주식 서비스는 현재 3600여개 미국주식과 상장지수펀드(ETF)로 거래 대상을 넓혔다. 전 종목에 온주(1주) 및 소수점 단위로 투자할 수 있다.   올 상반기 출시했던 ‘주식 모으기’ 서비스도 성과에 크게 기여했다는 게 토스증권 평가다. 적립식 투자처럼 국내, 해외 주식을 매일, 매주, 매월 단위로 원하는 금액만큼 투자할 수 있는 게 특징이다. 이에 힘입어 8개월 만에 20만명 넘는 고객을 유치했다.   토스증권 관계자는 “변동성이 커진 주식시장에서 우량기업에 장기 투자할 수 있는 서비스를 선보인 게 고객들을 사로잡았다”며 “특히 실시간 소수점 거래를 지원하는 해외주식 서비스는 최소 1000원부터 미국주식과 ETF에 투자할 수 있어 ‘주식 모으기’와 시너지 효과를 발휘했다”고 설명했다.   토스증권은 남은 4·4분기에도 성장세를 이어가는 한편, 서비스 안정성 강화에 총력을 기울인단 계획이다. 연말까지 해외주식 브로커 및 환전 은행 이중화도 매듭 짓는다.   지난 10월 말 기준 토스증권 고객 수는 450만명이며, 월활성유저(MAU)는 200만명 이상을 꾸준히 유지하고 있다.    사진=토스증권 제공 #흑자전환 #토스증권"
2022.11.15.,토스증권 3분기 영업이익 22억원…출범후 첫 분기 흑자,https://n.news.naver.com/mnews/article/001/0013577032?sid=101,"토스증권 로고[토스 제공. 재판매 및 DB 금지](서울=연합뉴스) 채새롬 기자 = 토스증권은 3분기 매출 492억원, 영업이익 22억원, 당기 순이익 21억원을 기록했다고 15일 밝혔다.    토스증권이 분기 흑자를 달성한 것은 회사 출범 1년 9개월 만에 처음이다.     매출은 전 분기 대비 40%, 전년 대비 1천950% 증가했다. 작년 3분기에는 102억원 영업 손실, 전 분기에는 65억원 손실이었다.     토스증권은 해외주식 서비스가 작년 12월 출시된 이후 올해 1분기 37억원, 2분기 100억원, 3분기 130억원의 매출을 내며 큰 폭 성장했다고 설명했다.     해외주식 거래대금도 1분기 6조2천억원, 2분기 10조6천억원, 3분기 13조5천억원으로 지속해서 증가했다.    작년 12월 500여개 종목으로 시작한 해외주식 서비스는 현재 3천600개 미국주식과 상장지수펀드(ETF)로 대상을 넓혔다. 전 종목에 온주 및 소수점 단위로 투자할 수 있다.        토스증권은 연말까지 해외주식 브로커 및 환전 은행 이중화를 마무리하고, 서비스 안정성 강화에 주력할 예정이다.    10월 말 기준 토스증권 고객 수는 450만명이고, 월활성유저(MAU)는 200만명 이상이다.    srchae@yna.co.kr"
2022.11.15.,화이트해커 양성에 진심인 토스,https://n.news.naver.com/mnews/article/015/0004775022?sid=101,"금융사 유일 화이트해커팀 운영6개월간 악성앱 60만건 잡아내해킹 방지대회서 2년 연속 1위“토스 전 계열사에 화이트해커 16명이 있습니다. ‘화이트해커’팀이라고 부를 만한 팀이 있는 곳은 토스가 유일할 겁니다.”표상영 토스 보안기술팀 연구원은 15일 한국경제신문과의 인터뷰에서 “1주일마다 계열사 화이트해커가 모두 모여 공격자 입장에서 어떻게 접근할 수 있을지를 연구한다”며 이렇게 말했다. 표 연구원은 같은 팀의 김재성 연구원, 권재승 연구원과 함께 국내 유일의 금융 사이버침해 방지대회인 ‘FIESTA 2022’에 출전해 1위를 차지했다. 토스로서는 2년 연속 1위다.이들 세 명이 만든 팀 이름은 ‘커피사일로’. 토스의 사내 카페다. 권 연구원은 “해커 챕터 위클리에 참여하는 전원이 ‘파이트 프로’로 구성돼 있다”며 “자체 개발한 악성앱 탐지 솔루션으로 어떻게 탐지했고, 어떤 과정을 거쳐서 개발했는지 공유한다”고 말했다. FIESTA 2022에선 계열사인 토스페이먼츠가 3위에 올랐다. ‘해커 챕터 위클리’를 통해 해커들의 노하우를 공유한 게 주효했다는 평가다.금융권 보안이 여타 업권과 다른 점은 보이스피싱 범죄와 연관된다는 것이다. 보이스피싱으로 악성앱을 설치하게 하고, 악성앱에 깔린 코드로 사용자의 신용정보를 빼내 돈을 인출한다. 화이트해커의 역할은 악성앱 설치 단계에서 해킹을 차단하는 것이다. 지난 4월 토스가 개발한 악성앱 탐지솔루션은 6개월간 총 58만5000건에 달하는 악성앱을 잡아냈다. 그만큼 악성앱의 종류도 다양하고, 금융소비자들도 쉽게 속아넘어갈 만큼 고도화되고 있다.토스에서 화이트해커팀이 맡은 역할도 중요하다. 권 연구원은 “새로운 서비스를 출시할 때는 무조건 저희 팀의 컨펌을 받아야 한다”고 했다. 이들은 화이트해커 양성이 시급하다고 입을 모았다."
2022.11.15.,[ST포토] 염혜선 '정확하게 토스',url없음,<네이버 기사 없음>
2022.11.15.,[MD포토] 염혜선 '언더 토스도 잘해요',https://sports.news.naver.com/news.nhn?oid=117&aid=0003668159,<구조 다름>
2022.11.15.,"토스증권, 3분기 영업이익 22억원...""출범 후 첫 분기 흑자 달성""",url없음,<네이버 기사 없음>
2022.11.15.,[MD포토] 염혜선 '국대 세터의 노련한 토스',https://sports.news.naver.com/news.nhn?oid=117&aid=0003668171,<구조 다름>
2022.11.15.,"블루 아카이브 카페 ""키보토스, 현실이 되다""",url없음,<네이버 기사 없음>
2022.11.14.,철옹성 금융업 무모한 도전기..'유난한' 토스의 10년 기록,https://n.news.naver.com/mnews/article/008/0004817911?sid=103,"[[서평]'유난한 도전']금융의 패러다임을 바꿨다는 평가를 받는 '토스'의 지난 10년간을 기록한 책이 나왔다. 지금은 대부분의 은행 앱에서 쓰고 있는 '간편송금'을 무모하고 유난한 도전 끝에 만들어낸 토스의 잦은 실패담과 성공과정이 담겼다.  내부 직원들의 증언과 충실한 자료조사로 픽션같은 논픽션 스토리를 완성했다. 스타트업 초기 모델에서 흔히 볼 수 있는 들뜬 도전담과 동시에 경험부족으로 벽에 부딪혔던 좌절과 사내 갈등을 가감없이 보여준다.특히 다양한 규제를 통해 가진 것 없는 경쟁자는 쉽게 시장에 들어올 수 없도록 돼 있는 금융산업에 도전한 스타트업이 겪어야했던 여정이 당사자들의 생생한 기억에 의해 소환된다. 저자는 2020년 토스에 합류한 조선일보 기자 출신 컨텐츠 매니저다. 지난 1년간 이승건 대표를 포함해 전·현직 토스팀원 35명을 인터뷰하고, 사내 메신저에서 오간 대화와 이메일을 자료로 삼았다.스타트업을 꿈꾸는 이들과 스타트업의 성공과 실패담을 알고 싶은 이들 모두에게 재밌게 읽힐 만하다. 저자는 이 책이 ""성공적인 창업 지침서나 핀테크 경영서가 될 수 없다""고 잘라 말하지만 스타트업에서 일하는 이들에게 토스의 지난 11년을 기록한 이 책은 아주 좋은 교과서가 된다. 반대로 토스의 실패담만 배우고 싶은 이들에게도 반면교사로 작용할 수 있다. 창업자인 이승건 대표는 에필로그에서  ""부정당하고 실패했던 경험을 비참하게 느낀 적은 없었다. 오히려 이를 넘어서면 만들어낼 변화에 대한 기대로 흥분되었다. 이런 우리의 이야기가 더이상 낯선 소수자들의 것이 아니라, 흔한 주류의 경험이 될수 있다면 얼마나 멋진 미래가 펼쳐질 수 있을까?"" 라고 한다. 꽤 큰 회사가 된 지금도 자신들의 회사를 '토스팀'으로 부른다는 구성원들이 만들어 낸 독특한 조직문화를 엿보는 재미도 있다. 관료화된 대기업이나 중견기업에선 절대 찾아볼 수 있는 '자율과 책임'이 토스의 문화로 자리잡고 이어진 사연도 소개된다. 유니콘을 꿈꾸는 많은 스타트업들이 대기업 흉내 혹은 창업자의 독단으로 쓰러지고 사라져가기 쉬운 점을 고려하면, 토스의 독특한 '상호존중과 합리적 토론'을 기본으로 하는 '신뢰'문화는 스타트업이라면 공유해볼만 하다.  비효율과 허례허식에 대한 무관용, 속도와 실행에 방점을 둔 조직구조, 서로 헐뜯지 않고 존경할 수 있는 동료, 투명한 정보 공유를 통한 공감대 형성, 실무자의 결정은 CEO도 번복할 수 없는 신뢰와 위임의 문화가 토스팀의 성공을 이끌었단 점도 확인 할 수 있다. 아직 현재 진행형인 토스의 앞날은 예측할 수 없지만, 적어도 끝이 실패로 끝날 지라도 지난 10년간 달려 온 과정을 살펴볼 수 있는 기회를 이 책은 제공한다. 저자의 다른 책은  핀란드 특파원 때 경험을 담은, '세상에서 제일 우울한 동네 핀란드가 천국을 만드는 법'(틈새책방)이 있다◇유난한 도전/정경화 지음/북스톤/1만7000원"
