기사날짜,기사제목,네이버 뉴스 url,기사내용
2022.04.11.,"""봉쇄한 건 중국인데…"" 왜 세계 경제까지 답답한 거야",https://n.news.naver.com/mnews/article/008/0004731489?sid=101,"[편집자주] 중국 경제 수도 상하이시 코로나19 감염자 수가 줄어들 기미를 보이지 않는다. 집단 봉쇄가 풀릴 시기도 기약할 수 없다. 생필품난은 심화되고 주민들의 불안과 불만은 고조되고 있다. 중국을 넘어 세계 경제에 미치는 부정적 영향은 점차 커지고 있다.[[MT리포트]벼랑끝 中 '제로 코로나'③]9일(현지시간) 코로나19 전면 봉쇄령이 내려진 중국 상하이의 텅 빈 거리에 방역요원들이 자전거를 타고 있다. / AFP=뉴스1 중국의 코로나19 방역정책에 세계 경제도 흔들릴 위기에 놓였다. 시진핑 정부의 '제로 코로나' 정책에 주요 도시의 경제활동이 멈추면서 중국 경제성장 둔화에 대한 우려가 커졌고, 이것이 세계 경제위기로 이어질 거란 전망이 지배적이다. 중국 당국이 지난달부터 코로나19 재확산세에 경제수도인 상하이까지 봉쇄하는 고강도 방역규제에 돌입하면서 중국 경기는 급속히 둔화했다. '세계의 공장', '세계 경제 2위국'인 중국의 경제 위기는 세계의 문제이기도 하다. 세계은행(WB)은 최근 중국의 경기둔화 등을 이유로 올해 동아시아 경제성장률 전망치를 기존 5.4%에서 5.0%로 하향 조정했다. WB는 ""중국의 '제로 코로나' 정책은 중국뿐 아니라 다른 지역 경제에도 부정적인 영향을 준다""며 ""중국이 경기 부양에 실패하면 동아시아의 경제성장률이 4%대로 떨어질 수도 있다""고 경고했다. 11일 외신 보도를 종합해보면 전문가들은 중국의 '제로 코로나' 정책이 팬데믹(세계적 대유행)과 우크라이나 전쟁으로 이미 고조된 공급망 불확실성을 악화시킬 것이라며 세계 경기 둔화를 경고한다. 중국의 봉쇄 조치로 테슬라 등 주요 기업의 현지 공장 운영이 중단돼 목표생산량 조절이 불가피한 가운데 트럭 운행, 항만 가동 등에도 차질이 생겨 공급망 상황이 더욱 어려워질 거란 의미다. 애플의 최대 협력업체인 대만 폭스콘은 지난달 초 선전의 봉쇄정책으로 현지 아이폰 공장 가동을 일시 중단했었는데, 이 여파로 올해 매출이 최대 3% 감소할 것으로 예측한 바 있다. 지난달 28일부터 이날까지 15일째 봉쇄 중인 상하이는 세계 최대 컨테이너 항구를 보유한 곳이자 세계 항공물류 중심지 중 한 곳이다. 지난해 상하이항에서 처리된 컨테이너 물동량만 4700만TEU(1TEU=20피트 컨테이너) 이상으로, 12년 연속 세계 1위 자리에 올랐다. 항공 분야에서는 푸둥국제공항이 지난해 324만톤(t)의 국제화물을 처리해 세계 항공화물 물동량 3위를 기록했다. 세계 경제에 중요한 장소들이다. 중국 당국은 앞서 상하이의 단계적 봉쇄에도 해운, 항공 등의 운영을 이어가겠다고 했지만 현실은 다르다. 항구, 공항으로 연계되는 육상운송과 주변 창고 폐쇄로 물류작업이 원활하게 이뤄지지 않았다. 또 운송을 담당하는 사람들에게 음성 확인서를 요구하는 등 여러 장애물이 생겨 항공기, 선박이 오래 묶이게 됐다. /사진=블룸버그세계 해운 데이터 제공업체인 배슬스벨류에 따르면 상하이 봉쇄 시작 다음 날인 지난달 29일 기준 상하이 주요 항구에서 대기 중인 선박의 수는 2주 반 전보다 5배가량 는 300척 이상으로 급증했다. 이는 상하이 당국이 봉쇄 종료일을 언급하지 않는 사실상 무기한 봉쇄 연장을 발표하기 전 나온 수치로, 현재 대기 선박 수는 이보다 많을 것으로 추산된다.중국발 봉쇄에 따른 물류비용 상승으로 현재 세계 경제의 최대 걸림돌인 인플레이션(물가상승) 압력은 한층 고조될 것으로 보인다. 홍콩 기반 화물 예약서비스 플랫폼인 프레이토스의 즈비 슈라이버 최고경영자(CEO)는 ""(도시) 셧다운은 중국에서 수입되는 상품에 추가 인플레이션 압박을 줄 수 있다""며 상하이 도시 봉쇄 이후 상하이로 향하는 모든 항공기 운항이 중단됐고, 상하이-북유럽 간 항공 화물 운임은 봉쇄 전보다 43%가량 급등했다고 전했다."
2022.04.12.,"韓 물류대란 또 온다고? '봉쇄 고집' 中, 글로벌 민폐국가 되나",https://n.news.naver.com/mnews/article/008/0004731637?sid=104,"[편집자주] 중국 경제 수도 상하이시 코로나19 감염자 수가 줄어들 기미를 보이지 않는다. 집단 봉쇄가 풀릴 시기도 기약할 수 없다. 생필품난은 심화되고 주민들의 불안과 불만은 고조되고 있다. 중국을 넘어 세계 경제에 미치는 부정적 영향은 점차 커지고 있다.[[MT리포트]벼랑끝 中 '제로 코로나'(下)]━""봉쇄한 건 중국인데…"" 왜 세계 경제까지 답답한 거야━9일(현지시간) 코로나19 전면 봉쇄령이 내려진 중국 상하이의 텅 빈 거리에 방역요원들이 자전거를 타고 있다. / AFP=뉴스1 중국의 코로나19 방역정책에 세계 경제도 흔들릴 위기에 놓였다. 시진핑 정부의 '제로 코로나' 정책에 주요 도시의 경제활동이 멈추면서 중국 경제성장 둔화에 대한 우려가 커졌고, 이것이 세계 경제위기로 이어질 거란 전망이 지배적이다. 중국 당국이 지난달부터 코로나19 재확산세에 경제수도인 상하이까지 봉쇄하는 고강도 방역규제에 돌입하면서 중국 경기는 급속히 둔화했다. '세계의 공장', '세계 경제 2위국'인 중국의 경제 위기는 세계의 문제이기도 하다. 세계은행(WB)은 최근 중국의 경기둔화 등을 이유로 올해 동아시아 경제성장률 전망치를 기존 5.4%에서 5.0%로 하향 조정했다. WB는 ""중국의 '제로 코로나' 정책은 중국뿐 아니라 다른 지역 경제에도 부정적인 영향을 준다""며 ""중국이 경기 부양에 실패하면 동아시아의 경제성장률이 4%대로 떨어질 수도 있다""고 경고했다. 11일 외신 보도를 종합해보면 전문가들은 중국의 '제로 코로나' 정책이 팬데믹(세계적 대유행)과 우크라이나 전쟁으로 이미 고조된 공급망 불확실성을 악화시킬 것이라며 세계 경기 둔화를 경고한다. 중국의 봉쇄 조치로 테슬라 등 주요 기업의 현지 공장 운영이 중단돼 목표생산량 조절이 불가피한 가운데 트럭 운행, 항만 가동 등에도 차질이 생겨 공급망 상황이 더욱 어려워질 거란 의미다. 애플의 최대 협력업체인 대만 폭스콘은 지난달 초 선전의 봉쇄정책으로 현지 아이폰 공장 가동을 일시 중단했었는데, 이 여파로 올해 매출이 최대 3% 감소할 것으로 예측한 바 있다. 지난달 28일부터 이날까지 15일째 봉쇄 중인 상하이는 세계 최대 컨테이너 항구를 보유한 곳이자 세계 항공물류 중심지 중 한 곳이다. 지난해 상하이항에서 처리된 컨테이너 물동량만 4700만TEU(1TEU=20피트 컨테이너) 이상으로, 12년 연속 세계 1위 자리에 올랐다. 항공 분야에서는 푸둥국제공항이 지난해 324만톤(t)의 국제화물을 처리해 세계 항공화물 물동량 3위를 기록했다. 세계 경제에 중요한 장소들이다. 중국 당국은 앞서 상하이의 단계적 봉쇄에도 해운, 항공 등의 운영을 이어가겠다고 했지만 현실은 다르다. 항구, 공항으로 연계되는 육상운송과 주변 창고 폐쇄로 물류작업이 원활하게 이뤄지지 않았다. 또 운송을 담당하는 사람들에게 음성 확인서를 요구하는 등 여러 장애물이 생겨 항공기, 선박이 오래 묶이게 됐다. /사진=블룸버그세계 해운 데이터 제공업체인 배슬스벨류에 따르면 상하이 봉쇄 시작 다음 날인 지난달 29일 기준 상하이 주요 항구에서 대기 중인 선박의 수는 2주 반 전보다 5배가량 는 300척 이상으로 급증했다. 이는 상하이 당국이 봉쇄 종료일을 언급하지 않는 사실상 무기한 봉쇄 연장을 발표하기 전 나온 수치로, 현재 대기 선박 수는 이보다 많을 것으로 추산된다.중국발 봉쇄에 따른 물류비용 상승으로 현재 세계 경제의 최대 걸림돌인 인플레이션(물가상승) 압력은 한층 고조될 것으로 보인다. 홍콩 기반 화물 예약서비스 플랫폼인 프레이토스의 즈비 슈라이버 최고경영자(CEO)는 ""(도시) 셧다운은 중국에서 수입되는 상품에 추가 인플레이션 압박을 줄 수 있다""며 상하이 도시 봉쇄 이후 상하이로 향하는 모든 항공기 운항이 중단됐고, 상하이-북유럽 간 항공 화물 운임은 봉쇄 전보다 43%가량 급등했다고 전했다.━""항구만 열면 뭐해""…길어지는 中봉쇄, 韓에 또 물류대란 올라━29일 (현지시간) 코로나19 봉쇄령이 내려진 중국 상하이의 슈퍼마켓 진열대가 턴 빈 모습이 보인다.  (C) AFP=뉴스1  세계 최대 컨테이너항인 중국 상하이가 코로나19 확산으로 2주째 봉쇄되면서 물류난에 대한 우려가 커지고 있다. 해운업계에서는 2020년 하반기 벌어졌던 물류대란의 재연 가능성이 있다고 우려한다. 11일 업계에 따르면 지난해 상하이항의 물동량은 약 4700만TEU로, 전 세계 항구 중에서 가장 많은 컨테이너 물동량을 자랑한다. 상하이항이 멈추면 중국으로 가야하는 물량과 중국에서 받아야 하는 물량 모두에 차질이 불가피하다. 아직까지 상하이항 자체는 정상적인 가동을 하고 있다. 다만 트럭 운전자에 코로나19 음성 확인서와 2주 격리가 요구되면서 내륙운송 효율이 떨어졌고, 이로 인해 선적 일정이 서서히 지연되고 있다. 해운사 관계자는 ""중심지를 오가야 하는 트럭의 운행이 자유롭지 않아 일정에 차질이 생기고 있어 면밀히 상황을 살피고 있다""고 말했다.상하이의 봉쇄는 상당 시간 유지될 가능성이 높다. 2만명대인 하루 확진자 수는 계속 늘고 있다. 해운업계에서는 봉쇄가 길어지면 물류대란이 불가피하다고 말한다. 실제로 지난 2020년 초 중국이 코로나19 확산을 이유로 상하이항 등 여러 도시를 봉쇄했는데, 그 영향은 봉쇄가 끝난 뒤 터졌다. 밀려있던 물량이 급격하게 터져나오면서 물량을 제때 소화할 수 없는 상황에 이른 것이다. 이로 인해 해상 운임료도 급격하게 상승했다. 국제 컨테이너 운송 항로 15곳의 단기 운임을 종합한 '상하이컨테이너운임지수(SCFI)'는 2019년 12월 말 958.57에서 2020년 11월20일 1664.56까지 뛰었다. 이후에도 물류난은 해소되지 않아 2021년 12월31일 5046.66으로 역대 최고치를 기록했다. SCFI는 최근 12주 연속 하락세를 기록, 이날 기준 4263.66이다. 낮아졌다고는 하지만 코로나 직전과 비교해보면 4배 이상 높은 상황인데, 상하이항의 봉쇄는 이 운임을 다시 뛰게 할 가능성이 크다. 국내 대형 해운사 관계자는 ""운임료 하락은 상하이항이 봉쇄되며 물동량이 일시적으로 줄어든 영향이 있다""이라며 ""봉쇄가 길어졌다가 풀릴 경우 다시 운임료가 폭등할 가능성이 높다""고 말했다.HMM(대표이사 배재훈)은 국내 기업들의 원활한 수출을 지원하기 위해 올해 첫 임시선박이 8일 출항했다고 밝혔다.  사진은 6,800TEU급 컨테이너선 ‘HMM 홍콩(Hongkong)호’가 광양항에서 국내 수출기업들의 화물을 싣고 있는 모습. (HMM 제공) 2022.1.9/뉴스1  업계에서는 중국의 다른 항구도시로 코로나가 확산될 것도 우려하고 있다. 중국에는 물동량이 큰 항구가 많은데, 프랑스의 해운 분석기관 알파라이너(Alphaliner)에 따르면 지난해 컨테이너 물동량이 큰 항구 1위부터 5위까지 중 4군데가 중국이다. 1위 상하이, 3위 닝보저우산, 4위 선전, 5위 광저우 순이다. 선전은 이미 한 차례 봉쇄되기도 했다.정부도 긴장하는 모양새다. 당장은 물류대란까지 확대되지 않았으나 언제든 사태가 심각해질 수 있기 때문이다. 중국의 제로 코로나 정책 때문에 내륙이 봉쇄돼 발생한 문제로 국내에서 대처할 수단이 부족하다는 것도 문제다.산업통상자원부 관계자는 ""현재는 상하이 항구와 공항이 막힌 게 아니라 내륙운송이 막힌 것으로 배가 못들어가는 상황은 아니라서 극단적인 것은 아니지만 한국에서 물류 노동자를 보내지 않는 한 풀릴 때까지 기다릴 수밖에 없는 상황""이라며 ""정부도 적극적으로 동향파악에 나서고 있다""고 말했다. 본격적으로 물류대란이 발생하는 경우 정부는 운임비 등 물류비 지원과 공동창고 이용 등 물류지원에 나설 계획이다. 산업부 관계자는 ""앞서 미국 롱비치, 우크라이나 오데사 등에서 발생한 물류대란과 같은 상황이 재현되면 (정부가) 운임비 지원이나 공동물류창고 이용 등을 지원할 수 있을 것""이라며 ""정부 대책을 고민하고 있다""고 했다.다만 산업부는 미주항로에서 발생한 선복(배 화물 적재 공간) 부족은 발생하지 않을 가능성이 크다고 봤다. 연근해 선사가 충분하기 때문이다. 산업부 관계자는 ""중국은 조금 특수한 상황이라 배가 모자라지는 않다""며 ""연근해에서 영업하는 선사들이 많아 배는 충분하다""고 했다. 이어 ""대체항을 찾아봐야 하는데 내일(12일)도 물류업계를 만나 상황을 살펴볼 것""이라고 덧붙였다."
2022.04.14.,"[ER 산업부 오늘뉴스] 기준금리 인상부터 칼국수 8,000원 시대",url없음,<네이버 기사 없음>
2022.04.12.,'네이버 통장' 나오면 예금이자 올라 소비자에 이득… 예금자 보호는 과제,https://n.news.naver.com/mnews/article/469/0000669117?sid=101,"'빅테크' 지급서비스 등 전금법 개정안 분석은행-비은행 경쟁으로 예대마진 축소 전망예금자 보호는 한계… '중개형 예금' 도입 제안네이버의 간편결제서비스 '네이버페이' 화면. 네이버 제공 한국일보 자료사진빅테크 기업이 지급결제서비스에 진출해 이른바 ‘네이버 계좌’가 가능하게 되면 예금 금리가 높아지고 예대마진이 줄어들어 소비자 후생에 도움이 된다는 분석이 나왔다. 다만 현재 논의되는 규제 수준으로는 예금자 보호 문제가 생길 수 있어, 이용자 자금을 예금으로 인정해야 한다는 지적이 나왔다.황순주 한국개발연구원(KDI) 연구위원은 12일 ‘전자금융거래법 개정이 금융소비자에게 미치는 영향과 보완과제’ 보고서를 통해 “지급서비스 시장을 개방하면 은행 예대마진이 축소돼 금융소비자 후생에 기여할 것으로 예상되지만, 이용자 자금이 충분히 보호되지 않는 문제가 발생할 수도 있다”고 말했다.2020년 11월 국회에 발의된 전자금융거래법 전면개정안에는  ‘빅테크’ 기업이나 카드사 등 비은행 금융회사에 지급서비스를 개방하는 내용이 담겨 있다. 법이 통과되면 이들도 △현금입출금 △급여이체 △송금 등의 서비스를 제공할 수 있다. 이에 전자상거래와 금융업무를 연계하는 등  업권을 넘나드는 새로운 경쟁이 에상된다.가시적 변화는 은행과 신규 사업자의 예금 유치 경쟁이다. 이미 △네이버파이낸셜 △카카오페이 △토스 △코나아이 등 이른바 ‘4대 빅테크’ 기업의 선불충전금 잔액이 지난해 말 기준 1조 원을 넘어섰는데, 이들이 지급서비스에 본격 뛰어들면 은행 자금의 이동이 더 활발해질 것으로 예상된다.KDI는 은행이 빅테크와 경쟁하면 예금 금리와 대출 금리 차이를 좁힐 수 있다고 분석했다. 2010~2020년 자료를 기반으로 분석한 결과 은행 결제성 예금이 1% 줄어들면 예금 금리는 1년간 0.29%포인트 상승했고, 대출금리 상승 폭은 0.17%포인트 수준이었다.황 연구위원은 “대출시장은 전 금융권에 일정 부분 개방돼 있어 별도의 치열한 경쟁에 직면해 있다”며 “대출금리 상승 폭이 (상대적으로) 제한적일 것”이라고 말했다.황순주 한국개발연구원(KDI) 거시ㆍ금융정책연구부 연구위원이 12일 정부세종청사에서 ‘전자금융거래법 개정이 금융소비자에게 미치는 영향과 보완 과제’에 대한 발표에 앞서 관련 자료를 소개하고 있다. 세종=뉴스1다만 이들 기업이 은행은 아니기 때문에 예금 수준의 보호를 받기가 힘들다. 법 개정안은 예금자 보호를 적용하지 않는 대신 지급서비스 사업자가 이용자 자금의 50~100%를 제3의 은행 등에 별도로 예치해야 한다는 장치를 마련해 놓았지만 여전히 미흡하다는 평가다.이에 대안으로 제시한 것은 이용자 예치금을 사업자 명의가 아닌 각 이용자 명의로 예금하고, 이를 통해 일반 은행 예금과 마찬가지로 5,000만 원까지 보호하는 ‘중개형 예금’ 방식이다.황 연구위원은 “사용자가 경영 위험에 직면하면 이용자 자금을 유용할 가능성이 있고, 보증보험 가입 의무, 안전자산 투자 의무 역시 한계가 있다”며 “중개형 예금은 현행 예금보험료 부과 체계를 바꿀 필요가 없어 실행 가능성이 높고, 사업자 수용성도 높을 것”이라고 말했다."
2022.04.13.,"삼성증권 통합앱 모니모 반갑다, 디지털 자산관리 강화 기회",url없음,<네이버 기사 없음>
2022.04.13.,"""오픈소스 고마워"" 한글 글꼴 다양성에 날개 달았다",https://n.news.naver.com/mnews/article/009/0004948810?sid=105,"알파벳 26자만 만드는 영어와 달리한글, 가부터 �R까지 1만 글자 달해컴퓨터 한글 글꼴 개발비용 컸지만누구나 쓰고 바꾸는 오픈소스 덕에프리텐다드 등 다양한 무료글꼴 나와리멤버·카카오뱅크 등 기업서도 채택프리텐다드 글꼴. [사진 제공 = 길형진 디자이너 깃허브] 26자 vs 1만1172자. 각각 영어, 한글 컴퓨터 글꼴에 필요한 글자의 개수로, 한눈에 보기에도 상당한 차이가 난다. 영어는 ABC부터 시작해 Z까지 총 26개 글자만 만들면 되지만, 한글은 '가갸거겨'부터 시작해 '�R'까지 1만개가 넘는 글자를 일일이 다 만들어야 하기 때문이다. 이에 영어권에는 1957년 만들어진 헬베티카(Helvetica) 등 역사와 전통을 지닌 수많은 글꼴이 있는 데 반해, 한국은 개발 비용 등의 문제로 선택의 폭이 꽤나 적은 상황이다. 그 때문에 정보기술(IT) 기업들은 2004년 맑은고딕(마이크로소프트), 2008년 나눔고딕(네이버), 2012년 산돌고딕네오(애플) 등 각자에게 맞는 글꼴을 자체 개발하여 사용하고 있다.이들 기업에서 만든 글꼴은 사용 목적이 제한되어 있어 무단으로 사용할 경우 자칫하면 소송의 대상이 되기도 한다. 그런데 최근 기업이 아닌 개인이 직접 자신에게 맞는 글꼴을 만들어 무료로 배포하고, 역으로 이를 각종 기업에서 채택하는 사례가 늘고 있다. 프리텐다드 제작과정. [사진 제공 = 길형진 디자이너 블로그] 대표적인 사례는 2021년 개발된 프리텐다드(Pretendard)다. 프리텐다드는 디자이너 길형진 씨가 만든 글꼴로, 한글 글꼴인 '본고딕'과 영문 글꼴인 '인터(Inter)'를 기반으로 모양·굵기·위치 등을 조금씩 조정해 만들었다. 길 디자이너는 ""글꼴 제작에 대한 지식이 없는 상태에서 만드느라 시행착오를 많이 겪었다""며 ""주위 사람들의 도움 덕분에 지금 모습으로 공개할 수 있었다""고 말했다. 해당 글꼴이 공개된 이후 길 디자이너 블로그에는 ""가독성이 좋고 작업하기 용이하다"" ""제작자가 들숨에 건강을, 날숨에 재력을 얻길 바란다"" 등 900개가 넘는 댓글이 달렸다.  프리텐다드가 사용된 대표적인 사례는 명함 관리 애플리케이션(앱) 리멤버다. 리멤버는 과거 iOS와 안드로이드에서 서로 다른 글꼴을 쓰고 있었다. 각 운영체제에서 기본으로 제공하는 글꼴을 그대로 사용했기 때문이다. 그러나 두 글꼴의 크기와 자간 등이 달라, 앱을 디자인할 때 똑같은 화면을 운영체제마다 2개씩 만들어야 하는 문제가 있었다.리멤버를 운영하는 드라마앤컴퍼니는 이러한 문제를 해결하기 위해 상업용으로 사용할 수 있는 무료 글꼴을 사용하기로 결정했다. 후보군에는 여러 글꼴이 올랐으나, 최종적으로는 프리텐다드가 채택됐다. 강민석 리멤버 프로덕트디자이너는 회사 블로그에 ""유료 글꼴을 구입하기에는 비용 면에서 부담스러웠다""며 ""다양한 굵기를 지원하고 글자의 높낮이가 적절한 프리텐다드를 사용하게 됐다""고 밝혔다.이보다 앞선 2015년, 스타트업 스포카는 자사의 글꼴인 '스포카 한 산스'를 공개했다. 스포카는 원래 자영업자를 위한 비용 관리 서비스를 하는 업체로, 사내에서 사용하려고 만든 글꼴을 누구나 쓸 수 있게 공개한 것이다. 스포카 관계자는 ""기존에 사용하던 글꼴이 한글·영문·숫자의 크기가 제각각이라 이를 통일하기 위해 만든 것""이라고 전했다. 현재 국내에서는 토스, 타다 등 많은 업체가 이 글꼴을 사용하고 있다.최근 이와 비슷한 과정을 통해 만들어진 또 다른 글꼴은 수트(SUIT)가 있다. 수트는 'UI에 최적화된 글꼴'이라는 뜻을 갖고 있다. 윤병선 디자이너는 매일경제와 통화에서 ""기존 글꼴의 여백·자간 등이 UI 제작에는 부적합한 경우가 많아 이에 맞는 글꼴을 직접 만들었다""며 ""본고딕의 한글을 조금씩 수정하고, 이에 어울리는 영문·숫자·특수문자를 직접 디자인해 합친 것""이라고 설명했다.  이렇게 많은 글꼴이 개인에 의해 만들어지고 기업에 의해 채택될 수 있었던 이유는 다름 아닌 '오픈소스' 덕분이다. 오픈소스란 개발자나 디자이너가 만든 결과물을 누구나 자유롭게 사용할 수 있도록 공개해 놓는 것을 말한다. 공개된 결과물은 누구나 자유롭게 수정해 사용할 수 있고, 마찬가지로 이를 다시 사람들에게 공개해야 한다.본고딕은 2014년 만들어진 오픈소스 글꼴로, 상대적으로 글자 수가 많은 한글·한자에 적당한 무료 글꼴이 마련돼 있지 않다는 문제 의식에 따라 제작됐다. 산돌커뮤니케이션(한국)·창저우 사이노타이프(중국)·이와타(일본) 등 3개 국가의 글꼴 제작 업체가 모두 뛰어든 탓에, 발표 당시 세계 최대 규모의 오픈소스 글꼴로 주목받았다. 한국의 프리텐다드·수트·스포카 한 산스뿐만 아니라 미나모토노 마코토 고딕(일본)·타이페이 산스(대만) 등 수많은 글꼴이 어도비와 구글에서 만든 본고딕을 기반으로 제작됐다. 산돌커뮤니케이션 관계자는 ""본고딕은 애초에 무료 배포를 염두에 두고 만들어진 글꼴로, (프리텐다드처럼) 수정 배포하는 것에 대해 문제 삼지 않고 있다""고 설명했다."
2022.04.13.,전미라 “나 못 하겠어”…김민경 “미치고 환장하겠다”(운동뚱),https://n.news.naver.com/mnews/article/382/0000973090?sid=106,<구조 다름>
