기사날짜,기사제목,네이버 뉴스 url,기사내용
2023.09.27.,신용점수 900점도 대출 어렵다… 높은 은행 문턱에 중·저신용자 돈가뭄,https://n.news.naver.com/mnews/article/366/0000935581?sid=101,"은행 가계신용대출 평균 신용점수 925점저축은행 1년새 저신용자 대출 중단 2배↑연체율 악화와 가계대출 억제주문에 문턱 높여서울의 한 시중은행에 신용대출 현수막이 걸려져 있다. /뉴스1        고금리 현상이 지속하면서 대출 절벽 현상이 고신용자까지 확대되고 있다. 신용점수가 900점을 넘어도 시중은행에서는 대출이 어려워진 것이다. 특히 중·저신용자 비중을 넓히던 인터넷전문은행마저 최근에는 가계신용대출 평균 신용점수가 880점대를 나타냈다. 제1금융권뿐만 아니라 제2금융권도 대출 문턱을 높이며 중·저신용자의 삶이 팍팍해지고 있다.27일 은행연합회에 따르면 지난 8월 기준 5대 시중은행(KB국민·신한·하나·우리·NH농협은행)의 가계신용대출(신규취급액 기준) 평균 신용점수는 925점으로 올해 초(903점)보다 22점이나 높아졌다. 은행별로 평균 신용점수를 살펴보면 ▲KB국민 947점 ▲우리 936점 ▲하나 918점 ▲NH농협 917 ▲신한 909점 순이었다.신용등급의 기준이 되는 신용평가사인 코리아크레딧뷰로(KCB) 점수를 살펴보면 ▲1등급 942~1000점 ▲2등급 891~941점 ▲3등급 832~890점 ▲4등급 768~831점으로 통상 3등급까지 고신용자로 분류한다. 하지만 올해 들어 평균 신용점수가 900점 초중반까지 오르며 3등급 차주(돈 빌리는 사람)도 시중은행 대출을 받기가 어려워진 것이다.인터넷전문은행의 사정도 비슷하다. 지난 8월 기준 인터넷전문은행 3사(카카오·케이·토스)의 평균 신용점수는 884점으로 나타났다. 이는 올해 초 840점이었던 평균 신용점수가 무려 40점 이상 오른 것이다. 은행별로 살펴보면 카카오뱅크가 올해 초 770점에서 지난 8월 867점으로, 같은 기간 토스뱅크는 857점에서 918점으로 높아졌다.일러스트=이은현        이 때문에 제1금융권에서 밀려난 중·저신용자는 제2금융권을 찾고 있지만 이마저도 어려운 상황이다. 저축은행중앙회에 따르면 지난 8월 기준 가계신용대출을 취급한 저축은행 31개 중 16곳은 신용점수 600점 이하인 차주를 대상으로 대출을 내주지 않은 것으로 나타났다. 지난해 8월에는 35개의 저축은행에서 가계신용대출을 취급했으며 이 중 신용점수 600점 이하의 저신용 대출을 취급하지 않는 곳은 9곳에 불과했다. 1년 만에 저신용자 대출을 취급하지 않는 저축은행 비중이 두 배가량 증가했다.제도권 금융의 ‘최후의 보루’인 대부업체도 대출 빗장을 걸어 잠그고 있다. 국회 정무위원회 소속 국민의힘 김희곤 의원실이 서민금융진흥원으로부터 제출받은 자료에 따르면 올해 상반기 대부업계의 가계신용대출 신규 금액은 6000억원으로 집계됐다. 하반기에도 이러한 추세가 계속되면 올해 대부업계 가계신용대출 규모는 1조원대에 그칠 것으로 예상한다. 이는 지난해 대부업계의 가계대출 규모(4조1000억원)의 4분의 1 수준이다.최근 은행이 대출 문턱을 높이고 있는 데는 연체율이 상승하고 있기 때문이다. 금융감독원에 따르면 지난 7월 말 기준 국내은행 연체율은 0.39%로 전달(0.35%)보다 0.04%포인트 상승했다. 전년 동기(0.23%) 대비 0.17%포인트 오른 수치다. 가계신용대출 연체율은 0.71%로 전달(0.62%)보다 0.09%포인트 증가했다. 저축은행은 상황이 더 심각하다. 금융감독원에 따르면 지난 6월 기준 저축은행 가계신용대출 연체율은 5.65%로 전년 말(5.14%)보다 0.51%포인트나 올랐다.문제는 앞으로 대출금리가 더 올라 중·저신용자 대출 공급이 더욱 악화할 것이란 점이다. 최근 금융 당국은 가계대출 증가 억제를 주문하며 은행권에서는 가산금리를 올리는 등 대출금리를 추가로 올리는 방안을 검토 중이다. 올해 들어 가계부채는 계속해서 증가하고 있다. 지난 21일 5대 은행의 가계대출 잔액은 682조4539억원으로 지난 8월 말 680조8120억원보다 1조6419억 원 늘었다. 가계대출은 올해 5월 이후 5개월 연속 증가세를 보이고 있다.은행권 관계자는 “저신용자 차주에게 대출을 공급하려면 대출 원가가 낮춰져야 하는데 최근 금융채, 은행채 등 시장금리 상승으로 비용이 증가하고 연체율도 악화하는 추세라 중·저신용자 대출 취급이 어려워지고 있다”라며 “다만 은행권 신용점수가 올해 초보다 높아진 것은 고금리 현상이 지속하면서 신용점수가 낮은 차주들은 대출을 기피하는 측면도 있다”고 설명했다."
2023.09.27.,신용점수 900점도 대출 어렵다… 높은 은행 문턱에 중·저신용자 돈가뭄,https://n.news.naver.com/mnews/article/366/0000935581?sid=101,"은행 가계신용대출 평균 신용점수 925점저축은행 1년새 저신용자 대출 중단 2배↑연체율 악화와 가계대출 억제주문에 문턱 높여서울의 한 시중은행에 신용대출 현수막이 걸려져 있다. /뉴스1        고금리 현상이 지속하면서 대출 절벽 현상이 고신용자까지 확대되고 있다. 신용점수가 900점을 넘어도 시중은행에서는 대출이 어려워진 것이다. 특히 중·저신용자 비중을 넓히던 인터넷전문은행마저 최근에는 가계신용대출 평균 신용점수가 880점대를 나타냈다. 제1금융권뿐만 아니라 제2금융권도 대출 문턱을 높이며 중·저신용자의 삶이 팍팍해지고 있다.27일 은행연합회에 따르면 지난 8월 기준 5대 시중은행(KB국민·신한·하나·우리·NH농협은행)의 가계신용대출(신규취급액 기준) 평균 신용점수는 925점으로 올해 초(903점)보다 22점이나 높아졌다. 은행별로 평균 신용점수를 살펴보면 ▲KB국민 947점 ▲우리 936점 ▲하나 918점 ▲NH농협 917 ▲신한 909점 순이었다.신용등급의 기준이 되는 신용평가사인 코리아크레딧뷰로(KCB) 점수를 살펴보면 ▲1등급 942~1000점 ▲2등급 891~941점 ▲3등급 832~890점 ▲4등급 768~831점으로 통상 3등급까지 고신용자로 분류한다. 하지만 올해 들어 평균 신용점수가 900점 초중반까지 오르며 3등급 차주(돈 빌리는 사람)도 시중은행 대출을 받기가 어려워진 것이다.인터넷전문은행의 사정도 비슷하다. 지난 8월 기준 인터넷전문은행 3사(카카오·케이·토스)의 평균 신용점수는 884점으로 나타났다. 이는 올해 초 840점이었던 평균 신용점수가 무려 40점 이상 오른 것이다. 은행별로 살펴보면 카카오뱅크가 올해 초 770점에서 지난 8월 867점으로, 같은 기간 토스뱅크는 857점에서 918점으로 높아졌다.일러스트=이은현        이 때문에 제1금융권에서 밀려난 중·저신용자는 제2금융권을 찾고 있지만 이마저도 어려운 상황이다. 저축은행중앙회에 따르면 지난 8월 기준 가계신용대출을 취급한 저축은행 31개 중 16곳은 신용점수 600점 이하인 차주를 대상으로 대출을 내주지 않은 것으로 나타났다. 지난해 8월에는 35개의 저축은행에서 가계신용대출을 취급했으며 이 중 신용점수 600점 이하의 저신용 대출을 취급하지 않는 곳은 9곳에 불과했다. 1년 만에 저신용자 대출을 취급하지 않는 저축은행 비중이 두 배가량 증가했다.제도권 금융의 ‘최후의 보루’인 대부업체도 대출 빗장을 걸어 잠그고 있다. 국회 정무위원회 소속 국민의힘 김희곤 의원실이 서민금융진흥원으로부터 제출받은 자료에 따르면 올해 상반기 대부업계의 가계신용대출 신규 금액은 6000억원으로 집계됐다. 하반기에도 이러한 추세가 계속되면 올해 대부업계 가계신용대출 규모는 1조원대에 그칠 것으로 예상한다. 이는 지난해 대부업계의 가계대출 규모(4조1000억원)의 4분의 1 수준이다.최근 은행이 대출 문턱을 높이고 있는 데는 연체율이 상승하고 있기 때문이다. 금융감독원에 따르면 지난 7월 말 기준 국내은행 연체율은 0.39%로 전달(0.35%)보다 0.04%포인트 상승했다. 전년 동기(0.23%) 대비 0.17%포인트 오른 수치다. 가계신용대출 연체율은 0.71%로 전달(0.62%)보다 0.09%포인트 증가했다. 저축은행은 상황이 더 심각하다. 금융감독원에 따르면 지난 6월 기준 저축은행 가계신용대출 연체율은 5.65%로 전년 말(5.14%)보다 0.51%포인트나 올랐다.문제는 앞으로 대출금리가 더 올라 중·저신용자 대출 공급이 더욱 악화할 것이란 점이다. 최근 금융 당국은 가계대출 증가 억제를 주문하며 은행권에서는 가산금리를 올리는 등 대출금리를 추가로 올리는 방안을 검토 중이다. 올해 들어 가계부채는 계속해서 증가하고 있다. 지난 21일 5대 은행의 가계대출 잔액은 682조4539억원으로 지난 8월 말 680조8120억원보다 1조6419억 원 늘었다. 가계대출은 올해 5월 이후 5개월 연속 증가세를 보이고 있다.은행권 관계자는 “저신용자 차주에게 대출을 공급하려면 대출 원가가 낮춰져야 하는데 최근 금융채, 은행채 등 시장금리 상승으로 비용이 증가하고 연체율도 악화하는 추세라 중·저신용자 대출 취급이 어려워지고 있다”라며 “다만 은행권 신용점수가 올해 초보다 높아진 것은 고금리 현상이 지속하면서 신용점수가 낮은 차주들은 대출을 기피하는 측면도 있다”고 설명했다."
2023.09.20.,"국민의힘 유의동 의원, 인터넷은행법 제정 5주년 기념 “인터넷은행이 걸어온 길 그리고 나아갈 길” 토론회 개최",url없음,<네이버 기사 없음>
2023.09.18.,"[종합] 은행권, 외국인등록증 진위확인 시스템 구축 발맞춰 서비스 확대",url없음,<네이버 기사 없음>
2023.09.24.,뇌파계 의료기기 ‘뉴로하모니’…수면‧치매‧우울‧ADHD 분석해 건강상태 진단한다,url없음,<네이버 기사 없음>
2023.09.20.,만만한 보험업…플랫폼·은행에 인터넷사도 노린다,url없음,<네이버 기사 없음>
2023.09.27.,취준생 선호 금융회사 순위는,https://n.news.naver.com/mnews/article/658/0000053823?sid=101,"잡코리아, 4년대졸 407명 조사구직자들이 가장 취업하고 싶은 금융회사로 KB국민은행이 꼽혔다.취업준비생 선호 금융회사 순위. 잡코리아메타 커리어 플랫폼 잡코리아는 신입 취업을 준비하는 4년대졸 학력의 구직자 407명을 대상으로 금융권 취업 선호도를 조사한 결과 이렇게 나타났다고 27일 밝혔다. 이번 조사는 모바일로 지난 18일부터 24일까지 이뤄졌다. 먼저 ‘금융권에 취업할 의사가 있는가’라는 질문에 전체 응답자 10명 중 7명에 달하는 78.1%가 ‘있다’고 답했다. 상경계열 전공자 중에는 대부분에 달하는 90.4%가 ‘금융권에 취업할 의사가 있다’고 답했고, 인문계열(76.8%), 사회과학계열(76.7%) 전공자 중에도 이러한 답변이 상대적으로 높았다. 금융권 중에도 ‘은행’ 취업을 선호하는 신입 구직자가 많았다. ‘금융권에서 가장 취업하고 싶은 업계는 어디인가’라는 질문에 과반수이상인 58.5%가 ‘은행’을 꼽았다. 이어 ‘증권’ 업계를 꼽은 응답자가 21.1%로 다음으로 많았다. 가장 취업하고 싶은 금융회사 1위는 KB국민은행이 차지했다. 잡코리아가 국내 주요 금융회사를 보기 문항으로 복수응답으로 조사한 결과, KB국민은행을 가장 취업하고 싶은 금융회사로 꼽은 신입 구직자가 20.8%(복수선택 응답률)로 가장 많았다. 이어 토스뱅크를 꼽은 응답자가 19.5%로 다음으로 많았고 카카오뱅크(17.0%), IBK기업은행(11.3%), 신한은행(9.1%) 순으로 취업하고 싶은 금융회사를 꼽은 응답자가 많았다. 우리은행, 하나은행은 순위권 밖이었다.남성 구직자 중에는 토스뱅크(15.7%)를, 여성 구직자 중에는 KB국민은행(25.8%)을 가장 선호했다.신입 구직자들이 이들 금융회사에 취업하고 싶은 이유 중에는 ‘직원 복지가 우수할 것’이라는 기대감과 ‘어릴 때부터 이용하던 회사’라는 익숙함이 높은 비율을 차지했다. 조사결과 ‘직원 복지가 우수할 것 같아서’ 취업하고 싶다고 답한 응답자가 28.9%로 가장 많았고 이어 ‘어릴 때부터 이용하던 회사라서’ 취업하고 싶다고 답한 응답자도 23.6%로 상대적으로 많았다. 이 외에는 ‘연봉이 높을 것 같아서(23.3%)’, ‘평소 기업 이미지가 좋아서(17.0%)’ 순이었다. 신입 구직자들이 금융권 취업을 위해 가장 열심히 준비한 것은 ‘인턴십’과 ‘금융분야 자격증 취득’인 것으로 나타났다. 조사결과 금융권 취업을 위해 가장 열심히 준비한 것으로 ‘인턴 경험’을 꼽은 응답자가 25.5%로 가장 많았다. 다음으로 ‘금융 분야 자격증 취득’을 준비했다는 응답자가 24.5%로 많았다. 이 외에는 ‘전공분야 자격증 취득(23.9%)’, ‘영어 실력(20.4%)’ 순으로 준비했다는 응답자가 많았다."
2023.09.18.,"고금리 여파, 인터넷銀 중·저신용대출 연체율 '역대 최고'… 케이뱅크 4.13%",url없음,<네이버 기사 없음>
2023.09.17.,"간편결제, 선불충전 약관 일제 업데이트...환불 등에서 이용자보호 강화",https://n.news.naver.com/mnews/article/030/0003137158?sid=101,"간편결제주요 간편결제 업체들이 선불충전 정책을 일제히 강화했다. 전자금융거래법 개정안 시행을 1년여 앞두고 선제 적용했다.17일 관련업계에 따르면 카카오페이, 토스, 페이코 등은 최근 선불충전 관련 약관을 개편했다. 각 사별로 구체적 내용은 다르지만 △선불충전 신탁 내용을 신설하거나 △환불 범위를 넓히고 △유효기간 만료시 통지 내용을 추가하는 등 이용자 보호 수준을 높인 것이 골자다. 각 사별로 10월부터 적용할 예정이다.토스는 △회원 선불충전금 전부를 신탁해 안전자산으로 운용하고 △환급사항이 발생시 수수료 없이, 유효기간이 지나더라도 환불이 가능하다는 내용을 약관에 추가했다. 카카오페이는 유효기간이 도래하기 30일 전 통지를 포함해 3회 이상 이용자에게 환급 방법 등을 알려야 한다는 내용을 더했다. 페이코는 △전액 환불사유에 회원이 잔액 환급을 신청한 경우'를 따로 기재하는 등 항목을 분리해 기재하고 △ 선불충전금 안전자산 운영 관련 내용을 구체화 하는 등 손을 봤다.이들 업체들이 선불충전금 관련 약관에서 이용자 보호 수준을 높인 것은 지난 달 국회를 통과한 전자금융거래법(전금법) 개정안을 일부 반영한 것이다. 주요업체들은 이미 개정안에 준하는 이용자 보호 조치를 시행 중이었지만 이번 약관 개정을 통해 내용을 더 추가하고 촘촘하게 바꿨다.올 상반기 기준 카카오페이, 네이버파이낸셜, 토스, 페이코에 쌓인 선불충전금 잔액은 약 7000억원에 육박한다. 쿠팡 등 유통업체에 쌓인 충전금 규모까지 합치면 9000억원을 넘어섰다.간편결제 업체 관계자는 “주요 간편결제 업체들은 이미 고객 유상 선불충전금액 100%에 해당하는 금액을 지급보증에 가입해 보호하는 등 조치를 취해왔다”면서 “이번 법 개정이 소비자 선불충전금 관련 권리 보호에 대해 확실히 명문화했다는데 의의가 있고, 간편결제 업체를 포함한 업계 신뢰도 향상에도 도움이 될 것으로 기대한다”고 말했다.금융당국은 2021년 발생한 일명 '머지포인트 사태'를 방지하기 위해 법·제도 개편을 추진해왔다. 당시 머지포인트는 2020년 5월부터 2021년 8월 사이 적자 누적 상태에서 할인판매 등으로 선불충전금 규모를 늘리고 돌려막기 방식으로 자금을 운영하다 대규모 환불 요청 사태를 맞았다. 현행법 허점을 이용해 편의점, 대형마트 결제를 일방적으로 막아 포인트 사용처를 대폭 줄이는 등 사실상 선불충전금을 휴지조작으로 만들며 검찰 추산 2500억원 피해를 일으켰다.이런 사태를 방지하기 위해 제정된 전금법 개정안은 △선불업 감독 대상을 확대하고 △선불업자는 선불충전금 50% 이상을 신탁, 예치 또는 지급보증보험의 방식으로 별도 관리해야 하며 △가맹점을 정당한 이유 없이 이용자에게 불리하게 축소하거나 선불전자지급수단 이용 조건을 변경하는 경우 선불충전금 잔액 전부를 지급한다는 내용을 약관에 포함하고, 이를 이용자에게 통지하도록 했다. 내년 9월부터 시행 예정이다."
2023.09.18.,"카카오페이證, 서학개미 본격 공략",url없음,<네이버 기사 없음>
2023.09.20.,"YBM 인강, ‘토익 환급 코스’ 추석연휴 기간 중 특별한 혜택 제공",url없음,<네이버 기사 없음>
2023.09.20.,"YBM 인강, ‘토익 환급 코스’ 추석연휴 기간 중 특별한 혜택 제공",url없음,<네이버 기사 없음>
2023.09.27.,[속보]5대 은행 8월 가계 예대금리차 NH농협·우리·KB국민 순,url없음,<네이버 기사 없음>
2023.09.22.,"[이코노 브리핑] 한투, 토큰증권 발행 인프라 구축 완료 외",https://n.news.naver.com/mnews/article/022/0003858054?sid=101,"한투, 토큰증권 발행 인프라 구축 완료     한국투자증권은 21일 카카오뱅크, 토스뱅크, 카카오엔터프라이즈, 오픈에셋 등과 함께 참여한 토큰증권 협의체 ‘한국투자ST프렌즈’가 국내 최초로 토큰증권 발행 및 청산에 필요한 모든 과정을 구현한 인프라를 개발하고 시범 발행까지 마쳤다고 밝혔다. 토큰증권은 분산원장 기술을 통해 디지털화된 증권으로 부동산, 선박, 항공기, 미술품 등 실물 자산의 권리를 유동화해 조각 투자가 가능하다.    “과납·휴면 보험료 조회해 보세요”     보험개발원은 자동차보험 가입자들이 더 낸 보험료나 찾아가지 않은 보험금이 있는지 간편하게 확인하고 관련 보험사에 청구할 수 있도록 ‘과납보험료 및 휴면보험금 통합조회시스템’을 운영 중이라고 밝혔다. 군(軍) 운전 경력 증빙을 제출하지 않았거나 자동차보험 사기 피해 등으로 보험료를 과다 납입한 경우, 이 시스템을 통해 과납보험료 조회가 가능하다. 휴면보험금 조회를 통해선 보험사로부터 보험금 안내전화 또는 문자를 받고도 보이스피싱을 의심해 보험금을 찾아가지 않았거나, 연락을 받지 못해 미지급된 보험금이 남아 있는지 등을 확인할 수 있다."
2023.09.21.,"[업계 만화경] 인터넷은행법 제정 5주년, 그 성과와 의미",url없음,<네이버 기사 없음>
