기사날짜,기사제목,네이버 뉴스 url,기사내용
2023.09.22.,올 7·8월 1금융권 온라인 관심도...KB국민·신한·우리·하나은행 빅4 형성,https://n.news.naver.com/mnews/article/123/0002316474?sid=101,"데이터앤리서치, 12개 채널 23만개 사이트 대상 관심도 조사 결과 발표1위 KB국민은행과 4위 하나은행간 정보량 차이는 크지 않아 카카오뱅크, 인뱅 중 가장 많은 정보량 보여 ◆…데이터앤리서치가 22일 발표한 7,8월 1금융권 관심도 1위는 KB국민은행으로 나타났다. 이어 신한은행, 우리은행, 하나은행이 2-4위를 차지했다.［자료출처=데이터앤리서치］데이터앤리서치가 올해 7·8월 제1금융권 14개 은행의 관심도(정보량=포스팅 수)를 조사한 결과 KB국민은행과 신한은행·우리은행·하나은행이 빅4를 형성한 것으로 나타났다. 다만 이들 빅4 은행간 관심도 차이는 크지 않았다.   22일 데이터앤리서치는 뉴스·커뮤니티·카페·유튜브·블로그·X(트위터)·인스타그램·페이스북·카카오스토리·지식인·기업/조직·정부/공공 등 12개 채널 23만개 사이트를 대상으로 제1금융권 14개 은행의 관심도(정보량=포스팅 수)를 조사한 결과, KB국민은행이 최근 두 달간 금융 소비자 관심도가 가장 높은 것으로 나타났다고 발표했다.   이어 신한은행과 우리은행·하나은행이 뒤를 이었으며 빅4 은행 간 관심도 차이는 크지 않았다. 이번 조사에서 BNK부산은행, DGB대구은행 등 지역거점 은행 6곳은 제외됐다.   아울러 데이터앤리서치는 조사 시 은행 고유 업무와 관련이 없는 스포츠, 야구, 골프, 농구, 배구, 탁구, 경기 등의 스포츠 관련 용어는 제외했다고 밝혔다.   조사 대상 은행은 비수도권 은행을 제외한 시중은행, 특수은행, 인터넷 뱅크 등이며, 조사 방식은 한글 기준 15자 이내인 경우만 결과값으로 도출하도록 했기 때문에 실제 정보량은 달라질 수도 있다는 게 회사측 설명이다.   분석 결과 KB국민은행이 올 7,8월 두 달간 총 10만7937건의 정보량을 기록하며 관심도 1위에 올랐다. KB국민은행은 14개 은행 가운데 유일하게 10만건을 넘겼다.   같은 기간 신한은행은 9만7196건을 기록해 관심도 2위를 차지했다. 이어 우리은행이 9만2367건의 정보량을 보이며 관심도 3위에 랭크됐다. 하나은행은 9만340건으로 4위를 기록했다.   카카오뱅크가 8만6519건으로 5위를, NH농협은행이 7만8974건으로 6위를, 기업은행이 6만2715건으로 7위를 기록했으며, 카카오뱅크는 인터넷 뱅크 중 가장 많은 정보량을 보였다.   이어 KDB산업은행 2만8772건, 케이뱅크 2만3000건, 토스뱅크 2만1941건, SC제일은행 1만2495건, Sh수협은행 1만1843건, 한국수출입은행 9050건, 한국씨티은행 4318건 순으로 집계됐다."
2023.09.21.,"한국투자증권, 업계 최초 토큰증권 분산원장 인프라 구축 완료",https://n.news.naver.com/mnews/article/366/0000934066?sid=101,"한국투자증권은 업계 최초로 토큰증권 발행 인프라 구축을 완료했다고 21일 밝혔다. 토큰증권은 분산원장 기술을 활용해 발행된 디지털화 증권으로, 실물증권과 전자증권에 이은 새로운 발행 형태의 증권이다. 부동산은 물론 선박, 항공기 미술품 등 실물로 존재하는 자산의 권리를 손쉽게 유동화할 수 있어 조각 투자가 가능한 게 특징이다.        이번 인프라 구축은 지난 5월 ‘한국투자ST프렌즈’가 인프라 개발을 시작한 지 4개월 만이다. 한국투자ST프렌즈는 한국투자증권을 중심으로 카카오뱅크, 토스뱅크, 카카오엔터프라이즈, 오픈에셋 등이 참여한 토큰증권 협의체다. 해당 협의체는 국내 최초로 토큰증권 발행 및 청산에 필요한 모든 과정을 구현한 인프라를 개발하고 시범 발행까지 완료했다.한국투자증권은 법제화 단계에 있는 토큰증권 사업 특성을 고려해 클라우드 시스템을 기반으로 분산원장 인프라를 구현했다. 이를 통해 향후 제도 변화를 탄력적으로 수용하고 시스템 개선에 능동적으로 대처할 수 있도록 했다.새로운 발행 인프라가 기존 증권거래 시스템과 충돌 없이 결합해 유기적으로 작동하도록 연동 작업도 마쳤다. 중앙집중식 계좌부에 기재하는 일반적인 금융 시스템과 달리 분산원장에 기재되는 토큰증권의 특성상 이를 효과적으로 연결하기 위해서는 여러 기술적 난제를 해결해야만 했다.한국투자증권은 두 시스템을 연동하기 위해 그간의 노하우를 바탕으로 새로운 기술을 개발ᆞ적용했다. 그 중 ▲스마트 계약을 통한 배당 처리 ▲분산원장 예수금을 활용한 즉각적인 거래 완결성 보장 ▲개인정보 처리 및 보호 기술 등은 특허 출원까지 진행 중이다. 토큰증권 인프라의 높은 기술력과 시스템 안정성을 입증해 업계를 선도하는 기술적 우위를 확보해 나간다는 방침이다.최서룡 한국투자증권 플랫폼본부장은 “이번 발행 인프라가 분산원장 기술이 제도권 금융으로 편입되는 과정에서 중요한 변곡점이 될 것으로 기대한다”면서 “투자자의 니즈를 반영한 우량자산 발굴에 힘쓰고 안정적인 제도 정착과 투자자 보호에 노력해 선도 사업자로서의 위상을 공고히 하겠다”고 밝혔다."
2023.09.19.,"정대영도 반한 신인 세터 이윤신, “효희 언니 다음으로 빠르다”",https://sports.news.naver.com/news.nhn?oid=530&aid=0000009300,<구조 다름>
2023.09.26.,제4인뱅 내년에 나온다…추가 진입 매력은 ‘글쎄’[머니뭐니],https://n.news.naver.com/mnews/article/016/0002203122?sid=101,"한국신용데이터, 소상공인 전문으로 내년 인가 도전“기존 은행과 차별화 없어” VS “메기하래놓고 규제만”신규 진입 검토하던 것도 “실효성 적다” 포기[헤럴드경제=서정은 기자] 금융당국이 인터넷전문은행 추가 인가 문을 열어둔 가운데 내년에야 제4의 인터넷전문은행이 새로 출범할 것으로 보인다. 현재로서는 한국신용데이터가 소상공인 전문 인터넷은행 설립 준비에 본격적으로 나선 상태다. 다만 수익성 없는 성장에 대한 회의감, 인터넷은행에 대한 각종 규제 등으로 인터넷은행 진출 수요는 떨어지고 있는 중이다.26일 금융권에 따르면 한국신용데이터(KCD)는 소상공인전문 인터넷은행 설립을 위한 KCD 뱅크 태스크포스팀(TFT)을 꾸리고 관련 인력을 충원 중이다. KCD 뱅크 TFT는 인터넷은행 인가를 위한 사업모델 개발부터 전략 수립, 금융 당국과의 커뮤니케이션 등을 담당한다. 한국신용데이터는 당초 인터넷은행이 아닌 특화전문은행으로 시장 진출을 검토했으나, 연초 실리콘밸리은행(SVB) 파산을 겪으며 노선을 틀었다.한국신용데이터 관계자는 “구체적인 인가 시점을 얘기할 수는 없지만, 올해는 넘겨야할 것으로 보인다”며 “당국이 상시인가 체제로 바꾼 만큼 관련 업무가 진행되는대로 서류를 낼 계획”이라고 말했다.앞서 당국은 지난 7월 5대 시중은행 중심의 과점체제를 깨기 위해 인터넷은행 인가 진입문을 낮추겠다는 뜻을 밝혔다. 과거에는 당국이 인가방침을 발표한 이후 신규인가가 가능했지만, 수요가 있다면 보다 적극적으로 검토하겠다는 게 골자였다. 인터넷은행의 자본금 요건은 250억원 이상으로 시중은행에 비해 4분의 1 수준밖에 되지 않아 더 많은 플레이어가 진입할 것으로 봤다.하지만, 한국신용데이터 외에 아직까지 추가로 인터넷전문은행 전환의사를 적극적으로 밝힌 곳은 없는 상태다. 금융권 안팎에서 제4의 인터넷은행의 실효성에 물음표가 달리고 있어서다. 당국에도 관련 인가서류를 접수한 곳은 없는 것으로 파악됐다.현재 인터넷은행 3사가 있지만 은행권에서 차지하는 비중이 약 2% 안팎으로 미미해 시중은행 위주의 구조를 깨는 메기 역할에는 한계가 있다. 영업 형태 또한 기존 은행과 차별점을 보이지 않는다는 점에서 회의적인 목소리가 나오는 중이다.한 금융지주 고위 관계자는 “인터넷은행 설립 취지 중 하나가 중저신용자 대출 활성화였는데 50년 만기 주택담보대출을 취급하는 등 기존 은행과 비즈니스 차별점이 없어 당국에서도 비판적인 시각이 있는 것 같다”며 “은행업 특성상 자금투여가 지속적으로 이뤄져야되는데 이런 부분에 한계가 있는데다, 수익이 수반되지 않는 성장에 대한 거품 우려도 크다”고 언급했다.다른 시중은행 고위 관계자도 “불과 2~3년전만해도 금융지주들은 인터넷은행 진입을 고민했으나, 지금은 그렇지 않다”며 “사업의 실효성이 크지 않기 때문”이라고 말했다.인터넷은행 또한 현 상황에서는 신규 플레이어 진입의 실효성이 크지 않을 것이라는 입장이다. 기존 은행과 차별화는 어려운데, 각종 규제에 발목 잡혀있다는 얘기다. 중저신용자 목표치를 채우느라 부실 지표 악화까지 감수하고 있는데도 ‘주담대 블랙홀’로 지목받는 등 지나친 비판이 쏟아지고 있다는 하소연도 나온다.카카오뱅크·케이뱅크·토스뱅크 등 인터넷은행 3사가 국회 기획재정위원회 양경숙 더불어민주당 의원에게 제출한 자료에 따르면 지난달 말 기준 인터넷은행의 신용대출 연체율은 1.2%에 달했다. 2021년 말엔 0.3%이었으나, 작년 말 0.8%로 오르더니 올 들어 1%를 넘겼다. 이 가운데 신용도가 낮은 3사의 중·저신용대출 연체율은 지난달 말 기준 약 2.8%를 기록했다. 이런 상황에서 금융 당국으로부터 올해 말까지 각 사별로 신용대출의 30~44%까지 중·저신용 대출로 채울 것을 요구받고 있는 실정이다.한 인터넷은행 관계자는 “인터넷은행에 신규 플레이어가 진입하는 것이 소비자 후생 측면에서 좋을 것으로 본다”면서도 “그동안 정부에서 메기 역할을 주문했으나 정작 인터넷은행이 커지니 이를 견제하는 모습이 더 커지고있어 신규 진입에 대해 얼마나 메리트가 있을지 의문”이라고 전했다."
2023.09.25.,"""저금리 대환대출로 유혹""…올 상반기 사기이용계좌 지급정지 1만8000건",url없음,<네이버 기사 없음>
2023.09.21.,"한국투자증권, 토큰증권 분산원장 인프라 구축 완료",https://n.news.naver.com/mnews/article/374/0000352125?sid=101,"'한국투자ST프렌즈' 인프라 구축 및 시범 발행 완료한국금융지주 자회사 한국투자증권이 업계 최초로 토큰증권 발행 인프라 구축을 완료했다고 21일 밝혔습니다. 토큰증권은 분산원장 기술(Distributed Ledger Technology)을 활용해 발행된 디지털화된 증권으로 실물증권과 전자증권에 이은 새로운 발행 형태의 증권입니다. 부동산은 물론 선박, 항공기 미술품 등 실물로 존재하는 자산의 권리를 손쉽게 유동화해 '증권형 디지털자산'로 전환, 조각 투자가 가능하다는 게 특징입니다. 한국투자증권, 카카오뱅크, 토스뱅크, 카카오엔터프라이즈, 오픈에셋 등이 참여한 토큰증권 협의체 '한국투자ST프렌즈'는 지난 5월 토큰증권 발행 인프라 구축을 위한 개발에 착수한 이후 4개월 만에 국내 최초로 토큰증권 발행 및 청산에 필요한 모든 과정을 구현한 인프라를 개발하고 시범 발행을 완료했습니다. 또 법제화 단계에 있는 토큰증권 사업 특성을 고려해 클라우드 시스템을 기반으로 분산원장 인프라를 구현함으로써 향후 제도 변화를 탄력적으로 수용하고 시스템 개선에 능동적으로 대처할 수 있도록 했습니다.  한국투자증권 관계자는 ""중앙집중식 계좌부에 기재하는 일반적인 금융 시스템과 달리 분산원장에 기재되는 토큰증권의 특성상 기존 증권거래 시스템과 충돌 없이 연동하기 위해 새로운 기술을 개발해 적용했다""며 ""그 중 스마트계약을 통한 배당 처리, 분산원장 예수금을 활용한 즉각적인 거래 완결성 보장, 개인정보 처리 및 보호 기술 등은 특허 출원까지 진행 중""이라고 강조했습니다. 최서룡 한국투자증권 플랫폼본부장은 ""이번 발행 인프라가 분산원장 기술이 제도권 금융으로 편입되는 과정에서 중요한 변곡점이 될 것으로 기대한다""면서 ""투자자의 니즈를 반영한 우량자산 발굴에 힘쓰는 한편, 안정적인 제도 정착과 투자자 보호를 위해 선도 사업자로서의 위상을 공고히 하겠다""고 말했습니다.한편, 한국투자ST프렌즈는 토큰증권 상품의 발행 및 청산 전 과정에서 다양한 필드 테스트를 진행하며 안정성과 기능을 더욱 강화해 나갈 예정입니다. 또한, 토큰증권 생태계 구축을 위해 펀더풀, 밸류맵을 비롯한 다양한 카테고리의 콘텐츠 기업들과 협업하여 토큰증권 상품화에도 집중할 방침입이다.당신의 제보가 뉴스로 만들어집니다.SBS Biz는 여러분의 제보를 기다리고 있습니다.홈페이지 = https://url.kr/9pghjn"
2023.09.21.,"한국투자증권, 업계 최초 토큰증권 발행 인프라 구축 완료",https://n.news.naver.com/mnews/article/468/0000982731?sid=101,"사진|한국투자증권[스포츠서울 | 홍성효기자] 한국투자증권이 업계 최초로 토큰증권 발행 인프라 구축을 완료했다고 21일 밝혔다.토큰증권은 분산원장 기술(Distributed Ledger Technology)을 활용해 발행된 디지털화된 증권으로,실물증권과 전자증권에 이은 새로운 발행 형태의 증권이다. 부동산, 선박, 항공기 미술품 등 실물로 존재하는 자산의 권리를 손쉽게 유동화해 ‘증권형 디지털자산’로 전환, 조각 투자가 가능해진다.한국투자증권을 중심으로 카카오뱅크, 토스뱅크, 카카오엔터프라이즈, 오픈에셋 등이 참여한 토큰증권 협의체 ‘한국투자ST프렌즈’는 지난 5월 발행 인프라 구축을 최우선 과제로 천명하고 개발에 착수했다. 4개월 만에 국내 최초로 토큰증권 발행 및 청산에 필요한 모든 과정을 구현한 인프라를 개발하고 시범 발행까지 완료했다.특히 한국투자증권은 법제화 단계에 있는 토큰증권 사업 특성을 고려하여 클라우드 시스템을 기반으로 분산원장 인프라를 구현했다. 또한 애자일 개발 방식을 채택해 신속한 의사결정과 효율적인 협업을 통해 개발 시간을 크게 단축할 수 있었다.나아가 새로운 발행 인프라가 기존 증권거래 시스템과 충돌 없이 결합해 유기적으로 작동하도록 연동 작업도 마쳤다. 중앙집중식 계좌부에 기재하는 일반적인 금융시스템과 달리 분산원장에 기재되는 토큰증권의 특성상 이를 효과적으로 연결하기 위해서는 여러 기술적 난제를 해결해야만 했다.한국투자증권은 두 시스템을 연동하기 위해 새로운 기술을 개발·적용했다. 그 중 △스마트계약을 통한 배당 처리 △분산원장 예수금을 활용한 즉각적인 거래 완결성 보장 △개인정보 처리 및 보호 기술 등은 특허 출원까지 진행 중이다. 토큰증권 인프라의 높은 기술력과 시스템 안정성을 입증해 업계를 선도하는 기술적 우위를 확보해 나간다는 방침이다.최서룡 플랫폼본부장은 “이번 발행 인프라가 분산원장 기술이 제도권 금융으로 편입되는 과정에서 중요한 변곡점이 될 것으로 기대한다”며 “투자자의 니즈를 반영한 우량자산 발굴에 힘쓰는 한편, 안정적인 제도 정착과 투자자보호에 노력하여 선도 사업자로서의 위상을 공고히 하겠다”고 말했다.shhong0820@sportsseoul.com"
2023.09.26.,제4인뱅 내년에 나온다…추가 진입 매력은 ‘글쎄’[머니뭐니],https://n.news.naver.com/mnews/article/016/0002203122?sid=101,"한국신용데이터, 소상공인 전문으로 내년 인가 도전“기존 은행과 차별화 없어” VS “메기하래놓고 규제만”신규 진입 검토하던 것도 “실효성 적다” 포기[헤럴드경제=서정은 기자] 금융당국이 인터넷전문은행 추가 인가 문을 열어둔 가운데 내년에야 제4의 인터넷전문은행이 새로 출범할 것으로 보인다. 현재로서는 한국신용데이터가 소상공인 전문 인터넷은행 설립 준비에 본격적으로 나선 상태다. 다만 수익성 없는 성장에 대한 회의감, 인터넷은행에 대한 각종 규제 등으로 인터넷은행 진출 수요는 떨어지고 있는 중이다.26일 금융권에 따르면 한국신용데이터(KCD)는 소상공인전문 인터넷은행 설립을 위한 KCD 뱅크 태스크포스팀(TFT)을 꾸리고 관련 인력을 충원 중이다. KCD 뱅크 TFT는 인터넷은행 인가를 위한 사업모델 개발부터 전략 수립, 금융 당국과의 커뮤니케이션 등을 담당한다. 한국신용데이터는 당초 인터넷은행이 아닌 특화전문은행으로 시장 진출을 검토했으나, 연초 실리콘밸리은행(SVB) 파산을 겪으며 노선을 틀었다.한국신용데이터 관계자는 “구체적인 인가 시점을 얘기할 수는 없지만, 올해는 넘겨야할 것으로 보인다”며 “당국이 상시인가 체제로 바꾼 만큼 관련 업무가 진행되는대로 서류를 낼 계획”이라고 말했다.앞서 당국은 지난 7월 5대 시중은행 중심의 과점체제를 깨기 위해 인터넷은행 인가 진입문을 낮추겠다는 뜻을 밝혔다. 과거에는 당국이 인가방침을 발표한 이후 신규인가가 가능했지만, 수요가 있다면 보다 적극적으로 검토하겠다는 게 골자였다. 인터넷은행의 자본금 요건은 250억원 이상으로 시중은행에 비해 4분의 1 수준밖에 되지 않아 더 많은 플레이어가 진입할 것으로 봤다.하지만, 한국신용데이터 외에 아직까지 추가로 인터넷전문은행 전환의사를 적극적으로 밝힌 곳은 없는 상태다. 금융권 안팎에서 제4의 인터넷은행의 실효성에 물음표가 달리고 있어서다. 당국에도 관련 인가서류를 접수한 곳은 없는 것으로 파악됐다.현재 인터넷은행 3사가 있지만 은행권에서 차지하는 비중이 약 2% 안팎으로 미미해 시중은행 위주의 구조를 깨는 메기 역할에는 한계가 있다. 영업 형태 또한 기존 은행과 차별점을 보이지 않는다는 점에서 회의적인 목소리가 나오는 중이다.한 금융지주 고위 관계자는 “인터넷은행 설립 취지 중 하나가 중저신용자 대출 활성화였는데 50년 만기 주택담보대출을 취급하는 등 기존 은행과 비즈니스 차별점이 없어 당국에서도 비판적인 시각이 있는 것 같다”며 “은행업 특성상 자금투여가 지속적으로 이뤄져야되는데 이런 부분에 한계가 있는데다, 수익이 수반되지 않는 성장에 대한 거품 우려도 크다”고 언급했다.다른 시중은행 고위 관계자도 “불과 2~3년전만해도 금융지주들은 인터넷은행 진입을 고민했으나, 지금은 그렇지 않다”며 “사업의 실효성이 크지 않기 때문”이라고 말했다.인터넷은행 또한 현 상황에서는 신규 플레이어 진입의 실효성이 크지 않을 것이라는 입장이다. 기존 은행과 차별화는 어려운데, 각종 규제에 발목 잡혀있다는 얘기다. 중저신용자 목표치를 채우느라 부실 지표 악화까지 감수하고 있는데도 ‘주담대 블랙홀’로 지목받는 등 지나친 비판이 쏟아지고 있다는 하소연도 나온다.카카오뱅크·케이뱅크·토스뱅크 등 인터넷은행 3사가 국회 기획재정위원회 양경숙 더불어민주당 의원에게 제출한 자료에 따르면 지난달 말 기준 인터넷은행의 신용대출 연체율은 1.2%에 달했다. 2021년 말엔 0.3%이었으나, 작년 말 0.8%로 오르더니 올 들어 1%를 넘겼다. 이 가운데 신용도가 낮은 3사의 중·저신용대출 연체율은 지난달 말 기준 약 2.8%를 기록했다. 이런 상황에서 금융 당국으로부터 올해 말까지 각 사별로 신용대출의 30~44%까지 중·저신용 대출로 채울 것을 요구받고 있는 실정이다.한 인터넷은행 관계자는 “인터넷은행에 신규 플레이어가 진입하는 것이 소비자 후생 측면에서 좋을 것으로 본다”면서도 “그동안 정부에서 메기 역할을 주문했으나 정작 인터넷은행이 커지니 이를 견제하는 모습이 더 커지고있어 신규 진입에 대해 얼마나 메리트가 있을지 의문”이라고 전했다."
