기사날짜,기사제목,네이버 뉴스 url,기사내용
2023.01.09.,"저신용자 사채 쓸 판… 2금융은 ""법정최고금리연동제 도입을"" [2금융 대출중단 조준한 당국]",https://n.news.naver.com/mnews/article/014/0004953307?sid=101,"대출중개 플랫폼 조회 늘어나는데 ‘점검’ 장기화에 대출 문턱 높아져2금융 ""법정최고금리 묶여 역마진""1금융보다 높은 수수료율도 불만금융당국 대출 재개 압박 본격화  #. 사업자금 확보를 위해 급전이 필요한 A씨는 매일 토스, 카카오페이 등 대출 중개 플랫폼에 접속하고 있으나 마땅한 대출상품을 찾을 수가 없었다. 대다수 저축은행, 캐피털 업체들이 '점검'을 이유로 대출상품 판매를 제한해서다. A씨는 ""이전에는 많은 저축은행 상품들이 나열됐는데 현재는 '점검'이라는 불분명한 이유로 선택지가 좁아졌다""면서 ""한정된 상품 내에서 대출을 선택할 수밖에 없어 저금리 상품을 찾기 힘들다""고 토로했다.   지난해 말부터 대출 중개 플랫폼에서 대출 빗장을 걸어 잠근 2금융권의 움직임이 장기화되자 중저신용자의 대출 문턱이 높아졌다는 비판이 나오고 있다. 금융당국은 2금융권의 대출재개를 위해 간담회를 열고 수수료 등 주요 쟁점과 관련한 후속 조치 논의에 들어갔다. 다만 법정 최고금리를 시장금리에 연동시키는 법정최고금리연동제 같은 근본적 대책이 나오지 않고서는 2금융권의 대출 활성화가 쉽지 않을 것이라는 지적이다.   ■대출조회 늘었는데 선택지는 오히려↓   9일 업계에 따르면 대출 중개 플랫폼에서 대출상품을 조회하는 건수는 급증했다. 대출 중개 플랫폼 토스는 지난해 총 1280만건의 대출조회 건수를 기록했다. 전년 대비 75.34%(550만건) 증가한 수치다. 분기별로 살펴봐도 2021년 1·4분기 약 270만건, 2·4분기 320만건, 3·4분기 350만건, 4·4분기 340만건으로 증가 추세를 보였다.   그러나 정작 조회 건수 대비 대출승인 건수는 줄고 있다. 대출 중개 플랫폼 핀다에 따르면 지난해 1·4분기 대출승인율은 전년동기 대비 160%에 달했으나 금리가 가파르게 오른 4월 이후 급격히 떨어졌다. 2·4분기 96%, 3·4분기 94%로 50% 넘게 승인율이 떨어졌다. 이에 지난해 하반기 대출한도 조회 건수가 전년동기 대비 63.8% 늘어난 것에 비해 승인 건수는 37% 늘어나는 데 그쳤다. 조회하는 사람은 늘어났는데 정작 실제 대출을 받은 사람은 줄어든 것이다.   이는 최근 들어 제2금융권들이 대출 중개 플랫폼상에서 줄줄이 대출상품 취급을 줄였기 때문이다. 현대캐피탈은 지난달 말부터 토스, 카카오뱅크 등 플랫폼에서의 신규대출 영업을 중단했다. 같은 기간 업계 1위인 SBI저축은행은 신용대출을, 웰컴저축은행은 중금리대출을, 신한저축은행은 햇살론을 중단했다.   한때 최대 20개가 넘는 금융사들이 '점검'을 이유로 대출조회 결과를 제공하고 대출업무를 사실상 중단했다. 올 들어 몇몇 곳은 플랫폼을 통한 대출을 재개했지만 여전히 10개 넘는 금융사들은 대출을 재개하지 못하고 '점검 중'이라고 안내하고 있다.   ■근본 해결책은 법정최고금리연동제   이에 금융당국은 저축은행, 캐피털사와 대출중단 사유를 명확히 한다는 명목으로 간담회를 열고 대출재개 압박에 나섰다. 저축은행들은 간담회에서 조달금리 상승과 법정 최고금리 제한에 묶여 역마진을 겪고 있다고 토로한 것으로 알려졌다.   저축은행 관계자는 ""대출재원을 예적금에만 의존하는 저축은행 입장에서 기준금리 상승으로 조달금리가 오르고 법정 최고금리 20% 제한에 걸려 경영이 악화돼 불가피하게 대출을 조정했다는 점을 설명했다""고 말했다.   대출 중개 수수료와 관련한 논의도 이뤄졌다. 저축은행은 대출 중개 플랫폼이 2금융권에 부과하는 수수료율이 1금융권의 은행에 비해 과도하고 높다고 주장하고 있다. 금융권에 따르면 대출 중개 플랫폼들이 저축은행에 평균적으로 부과하는 중개수수료율은 1.7~1.8%인 반면 은행권에 대해서는 0.4~0.5%의 수수료를 받고 있는 것으로 알려졌다.   이에 따라 수수료율 조정 등 2금융권 대출 활성화를 위한 당국의 움직임이 본격화될 것으로 예상된다. 다만 2금융권 업계에서는 대출 활성화를 위해서는 법정최고금리연동제 같은 근본적 해결책이 필요하다고 입을 모은다.   한 저축은행 관계자는 ""사실 급격히 오른 금리가 대출을 어렵게 하는 주요 원인인데 금리가 당장 낮춰지긴 힘든 상황인 만큼 최소한 법정 최고금리가 시장금리에 연동될 수 있게 해 역마진 상황에서 벗어날 수 있게 해주는 게 가장 필요한 해결책""이라고 말했다."
2023.01.03.,"토스, 소상공인 간편결제 수수료 반값 인하···'네·카'는?",https://n.news.naver.com/mnews/article/018/0005399488?sid=101,"영세중소가맹점 사업자 대상 인하토스페이 기존 대비 최대 47% 내려네카 ""작년 선제적 조치 인하 계획 없다""[이데일리 유은실 기자] 토스가 영세·중소가맹점 사업자를 대상으로 결제 수수료 인하를 결정했다. 토스는 소상공인들의 부담을 덜어주고자 오는 2월부터 결제 수수료를 기존 대비 47% 내리기로 했다. 올해 3월부터 간편결제 서비스 수수료율이 공시될 예정인 만큼, 네이버페이·카카오페이 등 다른 빅테크(대형 정보기술기업)들도 인하 방침을 결정할 지 주목된다.(사진=비바리퍼블리카)3일 모바일 금융 플랫폼 토스 운영사 비바리퍼블리카는 영세·중소가맹점을 대상으로, 자사의 간편결제 서비스인 ‘토스페이’ 결제 수수료를 대폭 인하한다고 밝혔다. 새 수수료 정책은 매출 규모 별로 표준 인하 수수료를 마련하는 데 중점을 뒀다. 오는 2월 1일부터 새 수수료가 적용될 예정이다. 앞으로 연 매출 3억원 이하 영세 가맹점의 토스페이 수수료는 1.60%으로 낮아진다. 기존 대비 약 47% 인하된 수치다. 또 연 매출 3억원~30억원 이내의 중소 가맹점도 매출 규모에 따라 1.90%~ 2.40%로 인하된다. 그동안 토스페이 수수료는 매출 규모 구분 없이 3%로 고정이었다. 해당 수수료에는 간편결제에 연계된 카드사나 결제은행에 토스가 지급하는 수수료, PG(지급결제대행)사 수수료 등이 포함돼 있다.업계는 이번 결정에 결제 수수료율 공시가 주효하게 작용한 것으로 봤다. 올해부터 온라인 간편결제 서비스를 제공하는 전자금융업자들은 결제 수수료율을 홈페이지에 반기마다 공시해야 한다. 전자금융업자엔 토스 뿐만 아니라 네이버파이낸셜, 카카오페이, 쿠팡페이 등이 포함된다.토스와 함께 빅테크 3인방으로 묶이는 네이버파이낸셜과 카카오페이는 아직 추가 인하 방침은 없다는 입장이다. 작년 카드사들이 소상공인 대상으로 수수료를 인하했던 당시 함께 수수료를 내리면서 선제적인 인하 작업을 마쳤다는 설명이다.앞서 네이버파이낸셜은 2021년, 2022년 두 차례에 걸쳐 네이버페이 수수료를 인하했다. 지난 2021년 7월부터 결제 수단 구분 없이 모든 결제 수단에 대해 단일한 수수료 체계를 적용 중이다.수수료율은 사업자 매출 규모만을 기준으로 연 매출 3억원 이하인 영세 사업자의 경우 0.9%, 중소사업자는 매출 규모에 따라 1.45~1.85%를 적용하고 있다. 네이버파이낸셜은 영세·중소가맹점에게 카드 뿐만 아니라 선불전자지급수단 등 수수료 우대 의무가 없는 결제 수단에도 수수료를 우대하고 있다고 강조했다.카카오페이는 작년 1월 영세 소상공인 대상으로 수수료를 한 차례 인하했다. 이 당시 카카오페이의 온라인 가맹점들은 규모에 따라 영세 0.3%포인트, 중소사업자 0.2%~0.1%포인트 인하된 수수료를 적용받았다."
2023.01.08.,‘좋은 보모찾기 플랫폼’ 투자 의사 밝힌 이승건 토스 대표,https://n.news.naver.com/mnews/article/018/0005402221?sid=105,"페이스북 통해 펀딩 및 고객사될 것 의지 밝혀'한국에서 믿고 맡길 보모 찾기 정말 어려운 일''훌륭한 보모 없이는 회사 일 집중 어려워'창업자들에게 관심 부탁..페메로 연락 달라[이데일리 김현아 기자]이승건 비바리퍼블리카 대표. 사진=토스 제공이승건 비바리퍼블리카 대표 페이스북금융 앱 토스를 운영하는 비바리퍼블리카의 이승건 대표가 좋은 보모를 찾을 수 있는 플랫폼에 투자하고 싶다는 의견을 밝혀 관심이다.이 대표는 최근 페이스북에 ‘좋은 보모를 구할 수 있는 플랫폼을 만드는 아이디어를 실행하실 창업자를 찾는다. 필요한 만큼의 초기 투자를 하겠다. 그리고 토스 커뮤니티가 첫 기업 고객사가 되어 드리겠다’고 적어, 직원 복지 차원에서 직원들의 육아 고민을 해결하기 위해 ‘좋은 보모 찾기’가 절실함을 에둘러 표현했다.그는 ‘한국에서 정말 믿고 맡길 수 있는 보모(nanny)를 찾는 건 정말 어려운일’이라면서 ‘보통 보모를 찾을 때 100명씩 인터뷰 보시는 부모님들도 많다. 근데 훌륭한 보모 없이는 회사 일에 집중할 수 없고, 그로인해 정말 많은 직장인들이 고통받고 있다’고 부연했다.그러면서 ‘믿을 수 있는 보모를 바로 찾을 수 있는 플랫폼을 구축하신다면 첫 고객으로 토스 커뮤니티가 되겠다’며 ‘펀딩, 첫 고객도 안전 기지로 돼 있다.관심 있으신 창업자의 많은 관심을 부탁드린다. 진지하게 실행하실 창업가는 제게 페메(페이스북 메신저)를 달라’고 적었다. 비바리퍼블리카는 2015년 2월, 국내 최초로 간편송금 토스를 시작한 뒤 은행(토스뱅크), 증권(토스증권)을 성공적으로 론칭한 데 이어 알뜰폰(MVNO) 업체 머천드코리아를 인수해 토스를 금융과 통신을 아우르는 생활편의 수퍼앱으로 키우고 있다. 계열사로는 토스뱅크, 토스증권, 토스씨엑스, 토스인슈어런스, 비바리퍼블리카 베트남법인, 브이씨엔씨 등이 있다."
2023.01.04.,"토스, 개인정보 안심리포트 서비스 출시",url없음,<네이버 기사 없음>
2023.01.05.,"토스뱅크, '매일 이자' 서비스 9개월간 2천억 지급",url없음,<네이버 기사 없음>
2023.01.09.,"저신용자 사채 쓸 판… 2금융은 ""법정최고금리연동제 도입을"" [2금융 대출중단 조준한 당국]",https://n.news.naver.com/mnews/article/014/0004953307?sid=101,"대출중개 플랫폼 조회 늘어나는데 ‘점검’ 장기화에 대출 문턱 높아져2금융 ""법정최고금리 묶여 역마진""1금융보다 높은 수수료율도 불만금융당국 대출 재개 압박 본격화  #. 사업자금 확보를 위해 급전이 필요한 A씨는 매일 토스, 카카오페이 등 대출 중개 플랫폼에 접속하고 있으나 마땅한 대출상품을 찾을 수가 없었다. 대다수 저축은행, 캐피털 업체들이 '점검'을 이유로 대출상품 판매를 제한해서다. A씨는 ""이전에는 많은 저축은행 상품들이 나열됐는데 현재는 '점검'이라는 불분명한 이유로 선택지가 좁아졌다""면서 ""한정된 상품 내에서 대출을 선택할 수밖에 없어 저금리 상품을 찾기 힘들다""고 토로했다.   지난해 말부터 대출 중개 플랫폼에서 대출 빗장을 걸어 잠근 2금융권의 움직임이 장기화되자 중저신용자의 대출 문턱이 높아졌다는 비판이 나오고 있다. 금융당국은 2금융권의 대출재개를 위해 간담회를 열고 수수료 등 주요 쟁점과 관련한 후속 조치 논의에 들어갔다. 다만 법정 최고금리를 시장금리에 연동시키는 법정최고금리연동제 같은 근본적 대책이 나오지 않고서는 2금융권의 대출 활성화가 쉽지 않을 것이라는 지적이다.   ■대출조회 늘었는데 선택지는 오히려↓   9일 업계에 따르면 대출 중개 플랫폼에서 대출상품을 조회하는 건수는 급증했다. 대출 중개 플랫폼 토스는 지난해 총 1280만건의 대출조회 건수를 기록했다. 전년 대비 75.34%(550만건) 증가한 수치다. 분기별로 살펴봐도 2021년 1·4분기 약 270만건, 2·4분기 320만건, 3·4분기 350만건, 4·4분기 340만건으로 증가 추세를 보였다.   그러나 정작 조회 건수 대비 대출승인 건수는 줄고 있다. 대출 중개 플랫폼 핀다에 따르면 지난해 1·4분기 대출승인율은 전년동기 대비 160%에 달했으나 금리가 가파르게 오른 4월 이후 급격히 떨어졌다. 2·4분기 96%, 3·4분기 94%로 50% 넘게 승인율이 떨어졌다. 이에 지난해 하반기 대출한도 조회 건수가 전년동기 대비 63.8% 늘어난 것에 비해 승인 건수는 37% 늘어나는 데 그쳤다. 조회하는 사람은 늘어났는데 정작 실제 대출을 받은 사람은 줄어든 것이다.   이는 최근 들어 제2금융권들이 대출 중개 플랫폼상에서 줄줄이 대출상품 취급을 줄였기 때문이다. 현대캐피탈은 지난달 말부터 토스, 카카오뱅크 등 플랫폼에서의 신규대출 영업을 중단했다. 같은 기간 업계 1위인 SBI저축은행은 신용대출을, 웰컴저축은행은 중금리대출을, 신한저축은행은 햇살론을 중단했다.   한때 최대 20개가 넘는 금융사들이 '점검'을 이유로 대출조회 결과를 제공하고 대출업무를 사실상 중단했다. 올 들어 몇몇 곳은 플랫폼을 통한 대출을 재개했지만 여전히 10개 넘는 금융사들은 대출을 재개하지 못하고 '점검 중'이라고 안내하고 있다.   ■근본 해결책은 법정최고금리연동제   이에 금융당국은 저축은행, 캐피털사와 대출중단 사유를 명확히 한다는 명목으로 간담회를 열고 대출재개 압박에 나섰다. 저축은행들은 간담회에서 조달금리 상승과 법정 최고금리 제한에 묶여 역마진을 겪고 있다고 토로한 것으로 알려졌다.   저축은행 관계자는 ""대출재원을 예적금에만 의존하는 저축은행 입장에서 기준금리 상승으로 조달금리가 오르고 법정 최고금리 20% 제한에 걸려 경영이 악화돼 불가피하게 대출을 조정했다는 점을 설명했다""고 말했다.   대출 중개 수수료와 관련한 논의도 이뤄졌다. 저축은행은 대출 중개 플랫폼이 2금융권에 부과하는 수수료율이 1금융권의 은행에 비해 과도하고 높다고 주장하고 있다. 금융권에 따르면 대출 중개 플랫폼들이 저축은행에 평균적으로 부과하는 중개수수료율은 1.7~1.8%인 반면 은행권에 대해서는 0.4~0.5%의 수수료를 받고 있는 것으로 알려졌다.   이에 따라 수수료율 조정 등 2금융권 대출 활성화를 위한 당국의 움직임이 본격화될 것으로 예상된다. 다만 2금융권 업계에서는 대출 활성화를 위해서는 법정최고금리연동제 같은 근본적 해결책이 필요하다고 입을 모은다.   한 저축은행 관계자는 ""사실 급격히 오른 금리가 대출을 어렵게 하는 주요 원인인데 금리가 당장 낮춰지긴 힘든 상황인 만큼 최소한 법정 최고금리가 시장금리에 연동될 수 있게 해 역마진 상황에서 벗어날 수 있게 해주는 게 가장 필요한 해결책""이라고 말했다."
2023.01.11.,"토스뱅크, ‘목돈 굴리기’ 투자상품 소개 1조원 돌파..경쟁력 높은 투자상품 선별해 소개",url없음,<네이버 기사 없음>
2023.01.11.,알뜰폰 약진에 이통시장 지각변동 '초읽기',url없음,<네이버 기사 없음>
2023.01.11.,금융위·보험사·GA '보험 비교·추천 서비스' 동상삼몽,url없음,<네이버 기사 없음>
2023.01.03.,"토스, 영세·중소 사업자 간편결제 수수료 3%에서 최대 1.6%로 인하",https://n.news.naver.com/mnews/article/366/0000866969?sid=101,"모바일 금융 플랫폼 토스 운영사 비바리퍼블리카는 영세·중소가맹점을 대상으로, 자사의 간편결제 서비스인 ‘토스페이’ 결제 수수료를 인하한다고 3일 밝혔다. 특히 연 매출 3억원 이하의 영세 가맹점의 경우 수수료는 기존 3%에서 절반 수준으로 내려간다./토스 제공        앞으로 연 매출 3억원 이하 영세 가맹점의 토스페이 수수료는 1.60%으로 낮아진다. 기존 대비 약 47% 인하된 수치다. 또한, 연 매출 3억원~30억원 이내의 중소 가맹점도, 매출 규모에 따라 1.90%~ 2.40%로 인하된다.그 동안 토스페이 수수료는 매출 규모 구분 없이 3%로 고정됐었다. 해당 수수료에는 간편결제에 연계된 카드사나 결제은행에 토스가 지급하는 수수료, PG(지급결제대행)사 수수료 등이 포함되어 있다. 새 수수료 정책은 오는 2월 1일부터 적용될 예정이다.토스 관계자는 이번 조치는 코로나 및 정책금리 인상 등으로 영세·중소 사업자들의 어려운 상황을 감안해 사업자들의 수수료 부담을 낮추고 영업을 지원하자는 고민에서 시작됐다고 설명했다.한편 토스페이는, 토스 앱에서 결제카드 혹은 은행계좌 등록 후 사용이 가능하다. 지난해 말 기준 토스페이 도입 가맹점 숫자는 2만5000개 이상이다."
2023.01.08.,[MD포토] 김하경 '정확한 토스',https://sports.news.naver.com/news.nhn?oid=117&aid=0003685667,<구조 다름>
2023.01.04.,토스 '개인정보 안심리포트' 서비스 출시,url없음,<네이버 기사 없음>
2023.01.11.,알뜰폰 약진에 이통시장 지각변동 '초읽기',url없음,<네이버 기사 없음>
2023.01.11.,금융위·보험사·GA '보험 비교·추천 서비스' 동상삼몽,url없음,<네이버 기사 없음>
2023.01.03.,"토스, 영세·중소 사업자 간편결제 수수료 3%에서 최대 1.6%로 인하",https://n.news.naver.com/mnews/article/366/0000866969?sid=101,"모바일 금융 플랫폼 토스 운영사 비바리퍼블리카는 영세·중소가맹점을 대상으로, 자사의 간편결제 서비스인 ‘토스페이’ 결제 수수료를 인하한다고 3일 밝혔다. 특히 연 매출 3억원 이하의 영세 가맹점의 경우 수수료는 기존 3%에서 절반 수준으로 내려간다./토스 제공        앞으로 연 매출 3억원 이하 영세 가맹점의 토스페이 수수료는 1.60%으로 낮아진다. 기존 대비 약 47% 인하된 수치다. 또한, 연 매출 3억원~30억원 이내의 중소 가맹점도, 매출 규모에 따라 1.90%~ 2.40%로 인하된다.그 동안 토스페이 수수료는 매출 규모 구분 없이 3%로 고정됐었다. 해당 수수료에는 간편결제에 연계된 카드사나 결제은행에 토스가 지급하는 수수료, PG(지급결제대행)사 수수료 등이 포함되어 있다. 새 수수료 정책은 오는 2월 1일부터 적용될 예정이다.토스 관계자는 이번 조치는 코로나 및 정책금리 인상 등으로 영세·중소 사업자들의 어려운 상황을 감안해 사업자들의 수수료 부담을 낮추고 영업을 지원하자는 고민에서 시작됐다고 설명했다.한편 토스페이는, 토스 앱에서 결제카드 혹은 은행계좌 등록 후 사용이 가능하다. 지난해 말 기준 토스페이 도입 가맹점 숫자는 2만5000개 이상이다."
2023.01.08.,[MD포토] 김하경 '정확한 토스',https://sports.news.naver.com/news.nhn?oid=117&aid=0003685667,<구조 다름>
2023.01.03.,"문화누리카드, 올 하반기부터 네이버·토스·KB페이로",https://n.news.naver.com/mnews/article/003/0011624781?sid=103,"기사내용 요약행안부 '디지털서비스 개방' 선도과제 선정문화누리카드. (사진= 한국문화예술위원회 제공) photo@newsis.com *재판매 및 DB 금지[서울=뉴시스] 박주연 기자 = 올해 하반기부터 네이버·토스·KB페이를 통해 통합문화이용권(문화누리카드)을 더욱 편리하게 이용할 수 있게 된다. 3일 한국문화예술위원회에 따르면 문화누리카드는 행정안전부 '디지털서비스 개방'시범서비스에 선정됐다. 디지털서비스 개방은 서비스를 누구나 쉽게, 한 곳에서, 한 번에 이용할 수 있도록 민간과 함께 혁신 생태계를 조성해 나가려는 디지털플랫폼정부 과제다. 행안부는 국민이 공공서비스를 친숙하고 편리한 민간 앱(웹)에서 신청·이용할 수 있도록 개방하고자 지난 9월 시범서비스 6종을 선정했다. 그 중 공공바우처 중 최초로 문화누리카드가 선정됐다.이에 따라 올 하반기부터 국민에게 친숙한 네이버, 토스, KB페이에서 쉽고 빠르게 발급·이용할 수 있게 된다. 기존에는 주민센터를 방문하거나 문화누리카드 누리집(웹)과 모바일 앱을 통해서만 발급·이용이 가능했다.문화누리카드는 복권기금을 재원으로, 6세 이상의 기초생활수급자 및 차상위계층에게 문화예술·국내여행·체육활동을 지원하는 바우처다. 올해는 국민 267만여 명이 개인당 연간 11만원을 지원받는다."
2023.01.03.,"토스, 영세·중소 사업자 간편결제 수수료 인하한다",https://n.news.naver.com/mnews/article/016/0002085992?sid=101,"기존 대비 최대 47% 인하[토스 제공][헤럴드경제=홍승희 기자] 모바일 금융 플랫폼 토스를 운영하는 비바리퍼블리카는 영세·중소가맹점을 대상으로 자사의 간편결제 서비스인 ‘토스페이’ 결제 수수료를 대폭 인하한다고 3일 밝혔다.앞으로 연 매출 3억원 이하 영세 가맹점의 토스페이 수수료는 1.60%으로 낮아진다. 기존 대비 약 47% 인하된 수치다. 또한, 연 매출 3억원~30억원 이내의 중소 가맹점도, 매출 규모에 따라 1.90%~ 2.40%로 인하된다. 그 동안 토스페이 수수료는 매출 규모 구분 없이 3%로 고정 이었다. 해당 수수료에는 간편결제에 연계된 카드사나 결제은행에 토스가 지급하는 수수료, PG(지급결제대행)사 수수료 등이 포함되어 있다. 새 수수료 정책은 오는 2월 1일부터 적용될 예정이다.이번 조치는 코로나 및 정책금리 인상 등으로 영세·중소 사업자들의 경영 환경이 녹록치 않은 상황을 감안해 사업자들의 수수료 부담을 최소화하고 영업을 지원하자는 자발적 노력의 일환으로 결정됐다.토스는 이미 지난해 8월부터 일부 영세 가맹점을 대상으로 토스페이 계좌 결제 수수료를 인하해왔다. 이번 정책 도입은, 보다 많은 영세·중소 가맹점이 혜택을 볼 수 있도록 매출 규모 별로 표준 인하 수수료를 마련했다는데 의의가 있다.최재호 토스 사업전략총괄는 “토스페이는 토스앱을 통한 간편한 결제 경험과 빠른 연동으로 영·중소 가맹점과 함께 성장을 해왔다”며 “이번 간편결제 수수료 인하로 가맹점의 부담은 덜고, 많은 고객이 토스페이를 경험할 수 있는 계기가 되기를 바란다""고 말했다.토스페이는, 토스 앱에서 결제카드 혹은 은행계좌 등록 후 사용이 가능하다. 쉽고 편리한 결제 경험을 내세워 빠르게 성장 중이며, 지난해 말 기준 토스페이 도입 가맹점 숫자는 2만5000개를 넘어섰다. 지난해 토스페이 거래액 증가율은 85%에 달한다."
2023.01.05.,"우리은행, 주요 적립식 상품 금리 인상 外 토스뱅크 [쿡경제]",url없음,<네이버 기사 없음>
2023.01.13.,하고 싶은 거 할 뿐인데...'돈'까지 잔뜩 버는 10대들 정체 (ft. 클래스),url없음,<네이버 기사 없음>
2023.01.10.,"""최고 수준 보안 인증체계 구축""...토스페이먼츠 'ISO·IEC 27701' 취득",url없음,<네이버 기사 없음>
