기사날짜,기사제목,네이버 뉴스 url,기사내용
2023.01.06.,"은행권, 저신용자 신용대출 취급액 1년새 25% 감소",https://n.news.naver.com/mnews/article/629/0000194329?sid=101,"최승재 의원 ""취약계층에 대출 활로 열어줘야""고금리 여파 등으로 지난해 은행권의 저신용자에 대한 신규 신용대출이 크게 감소했다. /더팩트 DB저신용자에 대한 은행권의 신규 신용대출이 크게 줄어들면서 저신용자들의 '대출 보릿고개'가 시작되는 게 아니냐는 우려가 나온다.6일 금융감독원이 최승재 국민의힘 의원실에 제출한 자료에 따르면 지난해 1~10월까지 KB국민·신한·하나·우리·농협 등 5대 시중은행의 저신용자(NICE신용평가 664점 이하 기준) 대상 신규 신용 대출 취급액은 1192억 원으로, 전년 동기(1592억 원)보다 25.1% 감소했다. 저신용자의 신규 신용 대출 계좌 수도 1만2931좌에서 9189좌로, 28.9% 줄어들었다.같은 기간 저신용자들이 보유한 전체 신용대출 잔액은 23조3000억 원에서 19조5000억 원으로 16.1% 감소했으며, 계좌 수 역시 178만 좌에서 147만 좌로 17.4% 줄었다.케이뱅크, 카카오뱅크, 토스뱅크 등 인터넷은행도 사정은 마찬가지다. 인터넷은행의 저신용자 대상 신규 대출 취급액은 지난해 1월 117억 원에서 10월 68억 원으로 거의 반토막이 수준으로 감소했으며, 10월 기준 저신용자 대상 신규 대출잔액 합계(4654억 원) 역시 전년 대비 25.2% 감소했다.최승재 국민의힘 의원은 ""코로나19로 인해 가계부채 폭탄이 커진 상황에서 저신용자가 뇌관이 되지 않도록 관리할 필요는 있지만 대출이 절실한 취약계층에는 활로를 열어주어야 한다""며 ""추후 불법사금융 피해를 구제하기 위해 더 큰 비용을 지불해야 할 수도 있는 만큼, 금융당국의 적극적인 행보가 필요하다""고 말했다.발로 뛰는 더팩트는 24시간 여러분의 제보를 기다립니다.▶카카오톡: '더팩트제보' 검색▶이메일: jebo@tf.co.kr▶뉴스 홈페이지: http://talk.tf.co.kr/bbs/report/write"
2023.01.11.,"남양유업, 아이엠마더·임페리얼드림XO 리뉴얼 출시 이벤트 진행",url없음,<네이버 기사 없음>
2023.01.09.,[신상품] 풀무원·남양유업,url없음,<네이버 기사 없음>
2023.01.03.,"YBM인강, ‘계묘년’ 새해 맞이 특별 혜택 이벤트 진행",url없음,<네이버 기사 없음>
2023.01.12.,미국 캐주얼 다이닝 '윙스탑 강남점' 13일 오픈,url없음,<네이버 기사 없음>
2023.01.13.,"증권플러스 비상장, 2022년 비상장 주식시장 결산 ""RABBIT""",url없음,<네이버 기사 없음>
2023.01.11.,"남양유업, 조제분유 리뉴얼 출시 이벤트~",url없음,<네이버 기사 없음>
2023.01.12.,"대형 보험사, 연이어 약관대출 한도 축소…서민들 '난감'",url없음,<네이버 기사 없음>
2023.01.12.,배회영업 비율 '쑥' 대형택시 대중화 시대 왔다,url없음,<네이버 기사 없음>
2023.01.04.,'제재 완화' 베네수엘라에 15년만에 첫 유럽 관광크루즈 입항,https://n.news.naver.com/mnews/article/001/0013679998?sid=104,"승객 498명 태우고 도착…베네수엘라, 관광산업 '훈풍' 기대15년만에 베네수엘라에 '관광 크루즈' 도착(마르가리타[베네수엘라] AFP=연합뉴스) 3일(현지시간) 베네수엘라 누에바에스파르타주 마르가리타섬에 독일 크루즈 선박을 타고 온 유럽 관광객이 손을 흔들며 인사하고 있다. 이 섬에 유럽 관광 선박이 온 건 이날이 15년만에 처음이다. 2023.1.4(멕시코시티=연합뉴스) 이재림 특파원 = 국제사회의 고립에서 차츰 벗어나고 있는 남미 베네수엘라에 3일(현지시간) 15년만에 처음으로 유럽의 관광크루즈 선박이 도착했다.    EFE·dpa통신에 따르면 바하마 국기를 단 아마데아 호가 이날 베네수엘라의 마르가리타섬 엘구아마체 항구에 정박했다.    독일·오스트리아·스위스 등에서 온 498명의 승객을 태운 이 선박은 독일 피닉스 라이즌에서 운영하는 크루즈선으로, 유럽 관광선이 베네수엘라에 온 것은 15년 만에 처음이라고 매체들은 보도했다.    베네수엘라 항구·공항 운영 관련 국영기업인 '볼리푸에르토스'의 에리카 비르구에스 오비에도 대표는 자신의 트위터에 ""우리나라에 방문한 승객 여러분을 환영한다""며 ""여러 나라 중 (베네수엘라를) 선택한 것에 대해 기쁘게 생각한다""고 썼다.    그는 관광객 안전 보장을 위한 모든 세부 사항을 철저히 점검했다고 강조하며 ""베네수엘라는 미래를 향해 문을 연다""고 덧붙였다.    카리브해 휴양지로 명성을 크게 얻었던 마르가리타섬은 지난 십수년간 불안한 정세와 경제 위기 등으로 점점 관광객을 잃고 있었다. 한때 호텔에 수도와 전기 공급도 원활하지 않았던 것으로 전해졌다.    그러나 니콜라스 마두로 정부 여당과 야당 간 대화 재개 및 이에 따른 미국의 제재 완화 등 미묘한 변화 움직임 속에 베네수엘라에는 석유 수출 증대와 관광산업 활성화라는 훈풍이 불기 시작했다.     특히 최근 몇 년간 미국 달러화 사용을 허가한 베네수엘라 정부의 결정은 휴양지 사업주들의 인프라 투자로 이어졌다고 dpa통신은 보도했다.    walden@yna.co.kr"
2023.01.13.,보험사도 대출 문턱 높인다…연이어 한도 줄이고 판매채널 축소,url없음,<네이버 기사 없음>
2023.01.02.,"“비키니 사진은 1~2초 봤는데...”…권성동, SNL서 진땀",https://n.news.naver.com/mnews/article/009/0005068895?sid=100,"SNL ‘주기자가 간다’에 출연한 권성동 국민의힘 의원. [사진 출처 = 쿠팡플레이 영상 캡처]국민의힘 전당대회에서 출마 선언을 앞둔 권성동 의원이 쿠팡플레이 SNL코리아의 ‘주 기자가 간다’에 출연했다가 ‘연찬회 술자리 논란’ ‘윤핵관(윤석열 대통령 핵심 관계자)에 대한 생각’ ‘국정감사장 비키니 사진 논란’ 등과 관련한 송곳 질문에 진땀을 흘렸다.2일 정치권과 방송계에 따르면 권 의원은 지난달 31일 SNL코리아 ‘주 기자가 간다’ 코너에 출연했다. ‘주 기자가 간다’는 유명인을 초청해 날 것 그대로의 질문을 던져 상대를 곤혹스럽게 만드는 것으로 유명한 시사풍자 코미디 프로그램이다. 방송에서는 개그우먼 주현영과 김아영이 각각 기자와 인턴기자로 나서 질문을 던졌다.‘인턴기자’로 분한 개그우먼 김아영은 권 의원이 지난 2014년 10월 국회 국정감사장에서 휴대전화로 플레이보이 모델 티파니 토스의 비키니 사진을 보다가 언론 카메라에 포착된 점을 언급했다. 이어 ‘기자’로 분한 배우 주현영은 권 의원에게 “그녀의 어떤 점이 가장 끌렸나”라고 물었다.이에 권 의원은 난처한 듯 웃으며 “그게 아니고, 기사 검색하다가 우연히 그 화면이 나왔다”며 “한 1~2초 봤는데 그때 탁 찍힌 거다. 그 여성이 누구인지 전혀 기억나지 않는다”고 해명했다. 이상형에 관한 질문엔 “눈이 큰 사람”이라며 “제가 눈이 작아 그렇다”고 답했다.지난해 8월 을지훈련 기간 중 천안에서 열렸던 국민의힘 연찬회 때 빚어진 이른바 ‘음주 파문’에 대한 질문도 나왔다.김아영은 당시 순간이 담긴 영상을 태블릿PC로 보여주면서 “술 반입이 금지되었던 연찬회 후, 기자들과 가지신 술자리 영상”이라며 “굉장히 핵인싸이신 것 같다”고 했다. 권 의원은 웃으면서 “해명을 하자면 공식 연찬회가 끝난 후 뒤풀이였다”며 “연찬회는 술 반입이 금지됐지만 연찬회가 종료된 이후에 뒤풀이 장소였다”고 했다.또 주현영은 “대표적인 별명 윤핵관(윤석열 대통령 핵심 관계자)에 대해서 ‘자랑스럽다’고 말씀하셨다는데 맞느냐”고 물었다. 권 의원은 “윤핵관이라는 별명을 만든 분(이준석 전 대표)은 조금 비아냥거리기 위해 만들었기에 윤핵관 표현 자체는 듣기 거북하다. 왜냐면 저는 권성동 국회의원이고 정치인 권성동이기 때문”이라고 했다.그러자 주현영은 “그렇다면 윤핵관 4인방으로는 권성동, 장제원, 이철규, 윤한홍 의원 중 누가 일짱이라고 생각하느냐”고 했다. 이에 권 의원은 “제가 일짱이라고 생각한다. 왜냐하면 저는 4선이고 장제원 의원이 3선, 나머지 의원이 재선이다”라며 “국회의원은 선수가 중요하니까 그러니까 제가 일짱”이라고 했다. 주현영이 “완전 대장이시네요”라고 하자 권 의원은 “그 의미는 윤석열 대통령 운명을 같이 하겠다는 것”이라고 말했다.윤석열 대통령의 연말 선물에 국산 아닌 수입산 농산물이 포함됐다는 논란에 대해선 말을 아꼈다. 두 선택지 가운데 하나를 선택하는 이른바 ‘밸런스 게임’에서 주현영이 “우리 농산물과 수입 농산물 중 더 받고 싶은 선물은 무엇이냐”고 질문하자 권 의원은 “당연히 우리 농산물”이라고 했다.이어 “그렇다면 수입 농산물을 연말 선물로 보내신 그분(윤 대통령)께 영상 편지 부탁드린다”는 요구에 권 의원은 “수입 농산물을 선물로 보내신 분이 누구냐. 저는 그에 대한 정보가 전혀 없다”며 답변을 피했다. 사진출처 = 권성동 국민의힘 의원 페이스북당대표 출마 여부에 대해선 “아직까지 결정은 안 했는데 많은 사람의 의견을 듣고 있다. 지금 한 98%는 출마 쪽에 마음이 기울고 있는데 2%를 채워주면 선언하려고 한다”고 말했다.2023년 보고 싶은 엔딩을 고르라는 질문(내가 당대표가 되는 해피엔딩 vs 이재명 각본·연출·주연의 범죄 스릴러의 배드엔딩)에는 “당대표에 만약 출마하게 된다면 당대표가 돼서 국민에 희망을 드리고 싶어서 전자를 선택하겠다”고 대답했다.권 의원은 전날 자신의 페이스북을 통해 SNL코리아 출연 소감을 전했다. 그는 “다른 분들처럼 저 역시 주현영 기자와 김아영 인턴기자의 날카로운 질문에 많이 당황했다”며 “이에 방어하기 어렵다고 판단하고, 가감 없이 있는 그대로 내려놓았다”고 했다.그는 “몇몇 장면에서는 보좌진이 팔로 ‘X자’를 만들며 만류했으나 최대한 요구에 부응하고자 노력했다”며 “해당 코너 최고 스타인 홍준표 선배만큼 재미있을 수는 없겠지만 솔직한 제 모습이니 편하게 봐주셨으면 좋겠다”고 덧붙였다.한편 권 의원은 이르면 오는 6일 출마 선언이 유력한 분위기다. 여의도 중앙보훈회관 8층에 캠프 사무실을 마련한 권 의원은 지난달 29일 윤석열 대선 캠프에서 함께 했던 실무 관계자 300여명을 사무실로 초청해 ‘국민캠프 송년회’를 열었다."
2023.01.02.,"“비키니 사진은 1~2초 봤는데...”…권성동, SNL서 진땀",https://n.news.naver.com/mnews/article/009/0005068895?sid=100,"SNL ‘주기자가 간다’에 출연한 권성동 국민의힘 의원. [사진 출처 = 쿠팡플레이 영상 캡처]국민의힘 전당대회에서 출마 선언을 앞둔 권성동 의원이 쿠팡플레이 SNL코리아의 ‘주 기자가 간다’에 출연했다가 ‘연찬회 술자리 논란’ ‘윤핵관(윤석열 대통령 핵심 관계자)에 대한 생각’ ‘국정감사장 비키니 사진 논란’ 등과 관련한 송곳 질문에 진땀을 흘렸다.2일 정치권과 방송계에 따르면 권 의원은 지난달 31일 SNL코리아 ‘주 기자가 간다’ 코너에 출연했다. ‘주 기자가 간다’는 유명인을 초청해 날 것 그대로의 질문을 던져 상대를 곤혹스럽게 만드는 것으로 유명한 시사풍자 코미디 프로그램이다. 방송에서는 개그우먼 주현영과 김아영이 각각 기자와 인턴기자로 나서 질문을 던졌다.‘인턴기자’로 분한 개그우먼 김아영은 권 의원이 지난 2014년 10월 국회 국정감사장에서 휴대전화로 플레이보이 모델 티파니 토스의 비키니 사진을 보다가 언론 카메라에 포착된 점을 언급했다. 이어 ‘기자’로 분한 배우 주현영은 권 의원에게 “그녀의 어떤 점이 가장 끌렸나”라고 물었다.이에 권 의원은 난처한 듯 웃으며 “그게 아니고, 기사 검색하다가 우연히 그 화면이 나왔다”며 “한 1~2초 봤는데 그때 탁 찍힌 거다. 그 여성이 누구인지 전혀 기억나지 않는다”고 해명했다. 이상형에 관한 질문엔 “눈이 큰 사람”이라며 “제가 눈이 작아 그렇다”고 답했다.지난해 8월 을지훈련 기간 중 천안에서 열렸던 국민의힘 연찬회 때 빚어진 이른바 ‘음주 파문’에 대한 질문도 나왔다.김아영은 당시 순간이 담긴 영상을 태블릿PC로 보여주면서 “술 반입이 금지되었던 연찬회 후, 기자들과 가지신 술자리 영상”이라며 “굉장히 핵인싸이신 것 같다”고 했다. 권 의원은 웃으면서 “해명을 하자면 공식 연찬회가 끝난 후 뒤풀이였다”며 “연찬회는 술 반입이 금지됐지만 연찬회가 종료된 이후에 뒤풀이 장소였다”고 했다.또 주현영은 “대표적인 별명 윤핵관(윤석열 대통령 핵심 관계자)에 대해서 ‘자랑스럽다’고 말씀하셨다는데 맞느냐”고 물었다. 권 의원은 “윤핵관이라는 별명을 만든 분(이준석 전 대표)은 조금 비아냥거리기 위해 만들었기에 윤핵관 표현 자체는 듣기 거북하다. 왜냐면 저는 권성동 국회의원이고 정치인 권성동이기 때문”이라고 했다.그러자 주현영은 “그렇다면 윤핵관 4인방으로는 권성동, 장제원, 이철규, 윤한홍 의원 중 누가 일짱이라고 생각하느냐”고 했다. 이에 권 의원은 “제가 일짱이라고 생각한다. 왜냐하면 저는 4선이고 장제원 의원이 3선, 나머지 의원이 재선이다”라며 “국회의원은 선수가 중요하니까 그러니까 제가 일짱”이라고 했다. 주현영이 “완전 대장이시네요”라고 하자 권 의원은 “그 의미는 윤석열 대통령 운명을 같이 하겠다는 것”이라고 말했다.윤석열 대통령의 연말 선물에 국산 아닌 수입산 농산물이 포함됐다는 논란에 대해선 말을 아꼈다. 두 선택지 가운데 하나를 선택하는 이른바 ‘밸런스 게임’에서 주현영이 “우리 농산물과 수입 농산물 중 더 받고 싶은 선물은 무엇이냐”고 질문하자 권 의원은 “당연히 우리 농산물”이라고 했다.이어 “그렇다면 수입 농산물을 연말 선물로 보내신 그분(윤 대통령)께 영상 편지 부탁드린다”는 요구에 권 의원은 “수입 농산물을 선물로 보내신 분이 누구냐. 저는 그에 대한 정보가 전혀 없다”며 답변을 피했다. 사진출처 = 권성동 국민의힘 의원 페이스북당대표 출마 여부에 대해선 “아직까지 결정은 안 했는데 많은 사람의 의견을 듣고 있다. 지금 한 98%는 출마 쪽에 마음이 기울고 있는데 2%를 채워주면 선언하려고 한다”고 말했다.2023년 보고 싶은 엔딩을 고르라는 질문(내가 당대표가 되는 해피엔딩 vs 이재명 각본·연출·주연의 범죄 스릴러의 배드엔딩)에는 “당대표에 만약 출마하게 된다면 당대표가 돼서 국민에 희망을 드리고 싶어서 전자를 선택하겠다”고 대답했다.권 의원은 전날 자신의 페이스북을 통해 SNL코리아 출연 소감을 전했다. 그는 “다른 분들처럼 저 역시 주현영 기자와 김아영 인턴기자의 날카로운 질문에 많이 당황했다”며 “이에 방어하기 어렵다고 판단하고, 가감 없이 있는 그대로 내려놓았다”고 했다.그는 “몇몇 장면에서는 보좌진이 팔로 ‘X자’를 만들며 만류했으나 최대한 요구에 부응하고자 노력했다”며 “해당 코너 최고 스타인 홍준표 선배만큼 재미있을 수는 없겠지만 솔직한 제 모습이니 편하게 봐주셨으면 좋겠다”고 덧붙였다.한편 권 의원은 이르면 오는 6일 출마 선언이 유력한 분위기다. 여의도 중앙보훈회관 8층에 캠프 사무실을 마련한 권 의원은 지난달 29일 윤석열 대선 캠프에서 함께 했던 실무 관계자 300여명을 사무실로 초청해 ‘국민캠프 송년회’를 열었다."
2023.01.11.,"엔비티 애디슨, 마이데이터 기반 앱 '뱅크샐러드'와 오퍼월 제휴",url없음,<네이버 기사 없음>
2023.01.04.,"SK스토아, 설 선물 고객 겨냥 '설프라이즈' 열어",https://n.news.naver.com/mnews/article/092/0002278638?sid=105,"22일까지 진행SK스토아(대표 윤석암)는 다가오는 설을 맞아 ‘설프라이즈’ 행사를 진행한다고 4일 밝혔다.오는 22일까지 진행하는 이번 행사는 SK스토아 온라인몰과 모바일 앱을 중심으로 마련됐다. 최대 명절인 설을 앞두고 선물을 구매하려는 고객들을 겨냥해 할인, 적립금, 참여 이벤트 등 다양한 혜택을 제공한다.먼저 ‘설맞이 세일’ 기획전을 준비해 약 1천200종 설 선물 관련 상품을 최대 40% 할인가에 판매하고, 행사 상품 구매 고객에게 최대 10만원 적립금을 지급한다. 과일과 건강기능식품을 비롯한 먹거리 선물세트부터 뷰티·생활용품, 가전제품 등 다양한 상품을 선보인다.SK스토아 설프라이즈대표 상품으로 ▲정관장 홍삼진고 데일리스틱(10g*20포*4박스, 10만원)  ▲설화수 자음 2종 기획세트(자음수 125ml+자음유액 125ml, 6만9천520원) ▲삼성 비스포크 4도어 프리스탠딩 냉장고(RF85B9111APWR, 875L, 202만5천810원) 등이 구성됐다.또한 산지직송 전문 브랜드 ‘더싱싱’과 손잡고 사과·배·황금향 등 각종 과일 선물세트를 비롯해 한우·제주 흑돼지·완도 활 전복·영광 보리굴비 등 신선 선물세트 상품을 다채롭게 판매한다.대표 상품으로는 ▲햇 나주배 선물세트(5kg, 8~10과, 2만5천900원) ▲양념 LA갈비 세트(미국산·캐나다산, 1kg, 3만2천900원) ▲완도 활 전복 선물세트(1kg, 중 15~16미, 4만9천900원) 등을 선보인다.더불어 행사 상품 중 ‘BEST 선물’과 ‘PREMIUM 선물’로 지정된 상품을 구매하는 고객에게는 최대 10만원의 적립금을 지급하고, 토스페이로 결제하는 고객에게는 최대 7%의 즉시할인 혜택도 제공한다.여기에 매일 오전 11시 ‘매일 당첨 룰렛 이벤트’도 연다. SK스토아 모바일 앱 행사 페이지에서 1일 1회 참여 가능하며 10원~5천원 적립금 중 당첨 금액을 매일 증정한다.이 밖에도 오는 24일까지 식품·건강식품·가전·주방용품 등 행사 상품을 구매하는 고객에게 최대 20% 적립금을 지급하는 ‘다다익설’ 기획전도 함께 진행한다.SK스토아 신양균 DT그룹장은 “설을 맞아 더 많은 고객에게 합리적인 혜택을 드리기 위해 이번 ‘설프라이즈’ 행사를 마련했다“며, “기획전, 적립금, 참여 이벤트 등 다양한 혜택을 마련한 만큼 설 선물 구매를 앞둔 고객에게는 좋은 쇼핑 기회가 될 것”이라고 말했다."
2023.01.11.,"영어 말하기 시험 ‘토익스피킹’, 취업 자격요건 영향력 여전",url없음,<네이버 기사 없음>
2023.01.07.,"저축은행 ""수수료 과도"" vs 플랫폼 ""덕 봤는데 이제와서""",https://n.news.naver.com/mnews/article/008/0004837641?sid=101,"[[이슈속으로]대출비교 서비스 균열]이슈속으로 /사진=머니투데이대출비교 서비스를 통해 서로 '윈윈' 관계를 유지했던 저축은행들과 플랫폼 핀테크(금융기술기업) 운영사간 균열이 감지된다. 저축은행들이 최근 대출 중개 수수료가 시중은행 대비 과도하다는 불만을 제기하면서부터다. 일부 저축은행들은 관련 수수료율이 개선되지 않으면 '방을 빼겠다'는 움직임도 보인다. 플랫폼 업체들은 저축은행 마진 악화 원인의 화살 방향이 잘못됐다는 의견이다. 7일 온라인플랫폼 업계와 저축은행업계에 따르면, 온라인 플랫폼을 통한 저축은행들의 대출비교 서비스 수수료율은 대출금액 기준 1.6~1.7%에 형성된 것으로 알려졌다. 대출비교 서비스는 자신의 신용 조건에 맞는 대출 상품을 각 금융기관별로 조회할 수 있는 서비스다. 2019년 8월 금융위원회로부터 혁신금융으로 지정받았다. 현재 카카오페이와 토스와 같은 빅테크(IT대기업)는 물론이고 핀다 등 중소 핀테크도 서비스하고 있다.대출비교 서비스가 시작될 당시 플랫폼들과 저축은행은 서로 상호 보완할 수 있다는 점에서 관계가 좋았다. 플랫폼들은 다수의 저축은행들이 제휴사로 참여하면서 제도 시작 초창기 부족할 수 있었던 라인업을 채울 수 있었다. 저축은행들은 수수료율이 오프라인 대출 모집인에게 지급하는 3%보다 저렴해 수수료를 아낄 수 있었고 그동안 아쉬웠던 고객점점을 늘릴 수 있었다. 실적도 좋았다. 저축은행들이 지난 3년간 대출비교 서비스를 통해 실행한 신용대출 규모만 15조원 가량으로 추정된다. 저축은행의 신용대출 잔액이 2019년말 약 21조원에서 지난해 9월말 40조원까지 늘어나는 데 적지 않은 역할을 한 것으로 분석된다. 그러나 고금리가 지속되자 문제가 발생했다. 예·적금 금리 경쟁이 펼쳐지면서 수신금리가 가파르게 올랐고, 대출 재원을 수신으로만 충족하는 저축은행 특성상 마진이 급격히 줄어들었다. 대출 마지노선인 법정 금리가 20%로 막혀있다 보니 예·적금 금리만큼 대출 금리를 높이는게 어려워졌다. 이에 따라 1.7%대 대출중개 서비스 수수료마저 버거워진 상황으로 해석된다. 더욱이 뒤늦게 대출비교 서비스에 합류한 시중은행 수수료율은 0.5% 정도다. 저축은행들은 형평성을 거론한다. 저축은행 한 관계자는 ""마진 겨우 1%를 보고 서비스해 왔는데, 최근엔 이마저도 쉽지 않은 상황""이라며 ""업권 간 차별 역시 부당하다""고 말했다. 이에 대해 플랫폼 업체들은 이해할 수 없다는 반응이다. 저축은행들이 대출비교 서비스를 통해 고객 접점을 늘려 매출 규모를 키우는 등 긍정적인 효과를 봤음에도 이제와서 '불공정' 프레임을 씌우고 있다고 지적한다. 플랫폼업체 관계자는 ""명시적인 건 아니지만 대출비교 서비스 수수료율은 대출 금리의 10분의1을 원칙으로 하고 있어 금리가 5%가량인 시중은행 수수료율이 0.5%, 대출 금리가 10대 중반인 저축은행 수수료율은 1%대 중반에서 형성되는 것""이라며 ""어려운 시기인 것은 이해가 가지만, 사업 성장을 함께한 제휴사를 비난하는 것을 이해할 수 없다""고 말했다."
